content,content_source,source_id,auto_related,sentiment_label
本人七零后，一直梦想有一台属于自己的汽车，可以带着家人到处走走看看。所以平时有空就经常看看汽车之家以及各个论坛。可是由于种种原因，一拖再拖。不过终于在2015年年底，决定买车。   决定之后，一有空就看看车展，在汽车之家看评测，逛论坛，看口碑。不过由于个人原因（也许是有一颗爱国的心吧），我始终把目标定在国产自主汽车之内。很快就有了目标：首先是哈弗，不过看过实车及试驾后，果断PASS，原因是带着家人外出动力可能不够，换档不够平顺。 后来看了长安的CS75，车很大，但内饰真的不喜欢，其它的真的不错，无耐放弃。——再后来又看了广汽传祺的GA6，GS4等等等，不再一一详说，不过一大圈看下来，真的有很大的感受，那就是国产真的是越来越好了，我想终于有一天能赶上进口甚至是赶超，我坚信！  转眼间兜兜转转，期间各种犹豫，各种等待。终于确定了最终目标：吉利的博瑞（各位别急，别以为我发错了，耐心往下看）。确定目标后，先在汽车之家上问询了一下价格，基本无优惠，后来4S店来电话了，就约了个时间去看车。3月23号和老婆一起去了4S店（转变来了，如果没带老婆，也许我巳经是博瑞车主了）。到店后，是孙姐（后来买博越的销售顾问）接待了我，人不错，店里停了一辆黑色的博瑞，车真的不错，造型时尚，各项高科技配置很全，安全性也很不错。[坐了一下，空间很大，座椅很舒服。但是老婆却果断PASS难过]。原因很简单，车身太长，她开转向，倒车有问题。不过这还不是重点，在我试博瑞时，她没事看了旁边停着的一辆白色的SUV（一开始我还没注意），那就是吉利的博越。她一看一坐，就喜欢上了，无奈本人是一个非常爱老婆的人（此处应该有掌声）。既然她喜欢就看看吧，这一看不要紧，真不错！真不错！真不错！侧面线条流畅，整体比较圆润，流露出有中国风的元素，在尾部，博越的整个视觉车身较高，采用的是悬浮式车顶，营造出动感的一面。在配置方面，四门车窗的一键升降、驾驶员座椅上的蓝牙电话声音输出端、后排及后备厢12V电源、空气净化器等。而在科技和安全装备上，博越配备有自适应巡航、陡坡缓降、前后雷达系统、电子手刹、自动驻车、车身电子稳定控制、自动大灯等。预售价12.98－18.68，问了售销，价格应该会低2到3万，至少会比博瑞低。  不再犹豫了，就它了，果断下了订金（由于还没上市，可预先订车，订金可退，60个工作之内提车。终于上市了，价格大家都知道了，在预想之内，马上抽空去4S店把订车合同转成正式合同。定了1.8T黑色智尊。接下来就是耐心的等吧，不过事实证明，看到渐渐有人提车，耐心就慢慢没了，期间时不时催一下销售，还好我的销售人真不错，一直帮我催，终于在定车后的两个月，也就是5月23日通知提车了。由于要等上牌，交了钱后一直等到6月1日正式提车。好了，费话不多说，上图    提车二十天了，说下感受吧，动力很好，深踩油门，虽然没有很强的推背感，但也是随叫随到，加速很线性。操控很精准，给驾驶者有很强的信心。座椅很舒服，长途开也不会很累。底盘很整，路感很清晰，减震过滤很干脆。油耗在预料当中，毕竟车重有1.67吨，基本在10－11升之间，能接受，首保后应该会降下来。二十天开下来，还没发现论坛上各位车友碰上的各种问题，也许我人品好？  就说这么多，等开段时间以后再和大家分享！最后祝国产自主车越来越好！   2016.6.22更新   闲来没事，正好618在网上瞎逛，看到有可以任意裁剪的丝圈脚垫，马上下单订了一套，必竟原厂的不耐脏。同时在网上买了二十套脚垫卡扣，今天正好同时到货，立马准备工具开始改装。   天气太热，弄了两个小时，浑身都湿了。还好店主送了开孔器，安装方便多了，另外自己弄时最好下面放块木板，不然开孔器容易坏。安装好后试了下，挺厚实（买的20MM厚的），挺软，舒服多了，关键是耐脏，好打理。,auto_home,7c1af91a29d1b6d4037a400cf86222d4,,
我也觉得上汽产的车的质量，要比其他国产品牌要好,auto_home,43738344c13a0d9491ad995fb7786529_10,,
中控看着很高大上的样子,auto_home,794d7302cbbf17aee4068bcfcf206995_12,,
发现一个问题，帝豪GL和gs的销量每次都是神相似…,auto_home,19992,,
这不是让二手车贩子颤抖的车型吗还有纳智捷哪个,auto_home,3a5c2e8b043ce2acb76fca0931de3692_79,,
不太喜欢语音控制，而且屏幕问题确实需要反应一下,auto_home,16c9d1c1c26b553d3abab8f3d4dc95e3_7,,
希望设计越来越合理，周末车展再去感受了一下实车，车内好像“码头”一样的那个设计严重破坏了整车感觉，很不实用而且大大减分，严重影响购买欲望！虽说奇瑞虎7在降价，但依然不火，其中重要原因可能就是出在车内的设计上，不管如何改进升级，“大码头”不去掉，消费者都不会买账，奇瑞该好好反省反省！,auto_home,5724590879874c711042d2bfddb014a6_1263,,
别费劲了.听着听着就习惯.上汽的G3小毛病特别多.我开始跟你一样不爽,auto_home,1667f7db10c48808a6f14fac2e74a860_6,,
哇噻，五种车身颜色可供选择，真是太爽了啦。。。。,auto_home,55d059eef91312ad99559f8be8bda7d5_11,,
评论荣威水军太多，而且楼主把16寸轮圈说成17寸，无语,auto_home,5624607804ab8eaa3a43805c048bfb03_12,,
现在还有说法说会增加1.5T车型。,auto_home,39c66231160d91ec30b667166fbcacd7_200,,
那款X1上过N55发动机？,auto_home,21987,,
绝对真爱 GS ,auto_home,6713213087e06544838c311d38d1d3d3_23,,
空调异响还是有的 我就是8月份的车,auto_home,7d51e318db10b9c155b95edc65cee6a7_39,,
那家车排气管不是黑的,auto_home,7fd9bb30cbf8b8cbf03dc0086a4374e4_6,,
对，宝来，速腾，卡罗拉，英朗，福克斯，轩逸，朗逸,auto_home,18683,,
我的车是13年带原厂导航仪跟倒车影视的，现在换个安卓的导航仪(原厂的导航这么样子你们懂的，真的是不想说什么了)现在倒车影视我重新拉了条线，现在的问题就是方向盘没有协议，我就想问问个位大哥，这么区分方向盘的线，可以拆原厂方向盘协议来接线用么？,auto_home,14426fe9f0d4d8c2e575be4a6801dc78,,
10款好像没有自动大灯和自动雨刷，不过这车不会让你后悔的。,auto_home,49228338b3387d58e2100c66a9a9f8a4_3,,
装个科视智能系统才几千，其实功能也还不错,auto_home,2239,,
第一次买车吧！所有车都是这样，只要在外面保养车，就算脱保，车子有啥问题，厂家不会再管！,auto_home,7a7fa9d5e53fd60b80110bd470385ad8_10,,
有博越的颜值支撑,auto_home,1e133897ea666ccdc5285527c76bb9fe_111,,
这种路况减速慢行肯定没压力，而且对于城市suv博越的表现还是挺给力的,auto_home,14a5e0b759bfd107108f814a54fd9aad_5,,
你以为汉斯只是来调校底盘的吗，比亚迪最新的SEA模块化平台汉斯也有参与。,auto_home,102c516e39092dbab799caabf59290c2_3,,
路基下面是斜的而且土比较松千斤顶受不到力顶不起来，右边整个底盘都磕在路边了，动弹不得,auto_home,7f8a0bb103d530165cda1dad8d1190ad_14,,
博越内饰做工精细,auto_home,25911,,
"考虑它的原因11万多的，老君越的底盘，就是变速箱比较纠结是双离合还是6AT,but又怕2.0动力不够",auto_home,354b1bc407b660feda83f367ac5dfb90_4,,
关注荣威i6有一段时间了，预算15w左右，最后还是买了它！当初既定的车型除了荣威i6，还有很多车型。只是作为年轻人，我更加喜欢与时俱进一点的东西，荣威i6正好又比较智能，不仅是配置上，就算是外观也相较来说年轻化一点。,auto_home,578e27d0cd4aaf4ae8abaab95705dfa0,,
真的不错，希望过几年还是这么给力,auto_home,1477be33032527eb23113d8e6e9c031b_82,,
首先恭喜你了。我想买个两驱的。,auto_home,26788,,
看来不是个例，上汽只管卖车，这种广发性问题，根本都不会管你,auto_home,7476fa9f72c6b507dfdeab63d1787ae8_12,,
外观，设计，内饰，座椅，后备箱，还有动力，都没得说。其他也我也看了好多，轩逸，大众，现代，配置太低要不就空间小，我不管贬值不贬值买来就是开的没打算卖，时间长不行就当买菜车用。,auto_home,41cd20b6855209adfb299da93e09a330,,
那个车主买的假 i6,auto_home,19000,,
我是打方向就咯噔咯噔响，不管倒车还是前进，跑起来就不响了。我的车有发动机护板，开始以为是护板响，保养的时候让师傅看了一下，师傅说可能是右前减震顶胶坏了，先给我紧紧螺丝试试，看还响不响，响了就换顶胶。结果紧了螺丝就不响了，现在一切正常。除了底盘螺丝，还紧了紧挨减震的螺丝。,auto_home,24aa86238d28afec8801f64365774f27_11,,
i6本来就很大 定位为B负级,auto_home,7a41bb5e3f05763cb2dad95ec11861a4_29,,
1.6家用够了,auto_home,155f60581ee80499b8a2e7798f3212fe_17,,
我们也不黑双离合，也不捧双离合，实事求是的讨论，哈哈哈哈,auto_home,769de24e1954570436ae8fc1f84a7477_8,,
谢谢，博越三好生。,auto_home,1445fb45abb8416ba15e283d0db7c0c8_90,,
"我们这蓝色的好几辆 1,3自动尊贵2辆  还有一辆手动的",auto_home,20077,,
书中说记忆像是倒在掌心的水，不论你摊开还是紧握 终究还是会从指缝中，一滴一滴，流淌干净！ 80后已长大——与其热闹着引人夺目，步步紧逼，不如趋向做一个人群之中真实自然的人，不张扬，不虚饰~心有所定，只是专注做事。就像我选的这款车·荣威RX5自动互联智享受版，我爱家也爱车和生活。 选车经历并不波折也不烧脑，从匆匆那些年说起吧,auto_home,47638d522c29a4ceeaab2efedcd4c7ff,,
我的当时是师父用力划断的，结果又出来别的异响，好像是金属松动碰撞的声音一走颠簸路就会发出声音，有时候响有时候不响去修也找不到那里响特别烦人。,auto_home,1733b3548b36f99f169f518cabc657be_171,,
等有钱了，就买一辆开开。,auto_home,455ec4200090b341d79ca9f54de60c3e_50,,
隔壁的车主们你们这么说考虑过双离合的车友感受么博越的这个六档变速箱主要是因为齿比不够密，所以换挡的冲击会有一点，但绝对比双离合的质感要好很多，尤其是低速蠕动的时候??,auto_home,5159436fc1632b880e505660d7e9a3b8_6,,
好像抖动的不是特别厉害！我还能接收！空调压缩机那个声音就有点大了！你们都是这样的吗？,auto_home,538931c535bd7d9246c347c78a27cae3_7,,
车看着精致，但动力系统就是一逼渣渣,auto_home,44e6ed5c259d81166086e56779fc3be7_93,,
吉利应该多和土鳖奇瑞比，作为爱七车主，就喜欢吉利跟土鳖比，秒杀土鳖，完爆土鳖，我就放心了,auto_home,2e29d765d7a4490710ef1a5b45353c0a_5,,
这个车真心喜欢 良心车,auto_home,515d57b43b00e2be0f746bda13faae2f_15,,
异响原因 面已经说过由于换档时机对产生顿挫感顿挫感因为两股力量结合平稳造成久而久之期受力变速箱里档位齿轮半轴都金属件期受外力干扰肯定会受损受损之后难免会有异响 1，如果你真的是学汽车检测专业建议把以前的课本拿起来好好再学一次； 2，把职业资格证书写成职称证书， 貌似写手作为,auto_home,520adfb2344115442aaa08cfb53538dc_106,,
我现在开的就是国产b50.一年半的车就开始锈了,auto_home,51b4188c70cf848297f212ad957bc1d3_13,,
各位，我的博越在行驶中有时踩油门有加不了油的情况出现，不知是否正常，你们的博越有不有这种情况，请踢教，谢谢！,auto_home,4365001352f9a8048ebfa57a71b44d8e_8,,
可能是我人品不行，正好遇到问题车了。,auto_home,23910,,
我的和这个一样，12年买车加2000在4S装的，用到现在挺好的，就是大屏有时会闪，为啥要卖，有比这个好的吗？,auto_home,4e4df2bfb5388505a4ed805f407a9667_7,,
我也想装了，博越的高科技配置都是很实用的，常来常往,auto_home,6a6370b8a1452a057b9f521b7e894595_82,,
不用解释我也明白你的意思。只是合资自主进口不管哪个也都是竞争对手，可以论高低上下。这车我没接触过，看参数配置我觉得很不错。,auto_home,19a04a5eed26c815e724323fe82cf2e6_18,,
内饰只要换方向盘路改才质就行了，新款中控丑哭,auto_home,2b1ec299606adbdc2588636fad3ed431_5,,
南浔古镇，7000余年历史，865年建镇史，国家5A级景区，江南六大古镇，沪苏杭后花园。          ‘一镇之地，拥有五园，皆为巨构，世所罕见’，南浔，难寻，萦绕于心几十年，终于在四月得见你。     又一次驱着虎子的出游，简单讲下最喜欢虎子的几个地方吧 第一：外形时尚大气，一路上为我赚到了不少的回头率； 第二：最喜欢虎子的大天窗，行驶的时候喜欢开着，因为老婆又点晕车，开着天窗会好点； 第三：动力充足，起步快，想超车还是没问题的。,auto_home,3f43fef3823714cb155f3f4c4ae777fe,,
通病，都这样，我原来的车也这样。,auto_home,75a5f0f03edfb5781e3cfe27c099aa5a_20,,
不知道，我车是14款的，没有支架问题。只是见很多老款车主这么反馈的，你搜搜其他人的帖子看看，也许有帮助,auto_home,597fb3b32ab893604043dec0e36c1f77_13,,
内饰装的不错，赞一个,auto_home,5bf8e7b0010e8ded1eb73f663bd8e447_20,,
审美这东西一人一个样，我觉得不是宝马车就没必要弄个天使眼，我更喜欢尽量保持车的原造型,auto_home,7f1c60faf9860013ab48555d6298e72f_30,,
把手放在大灯上，没感觉到热，,auto_home,47a5b1bad46b97c5ae148674db56e4e6_4,,
唐100很多简配的大家知道吗？1.最不能容忍和反人类的是全车除了中控扶手箱里面暗藏的两个USB口，前排，后排都没有直插USB接口了，第二排无任何12V，220V，USB接口，手机充电要放扶手箱里吗？前排点烟器也没了，这都要省太孙子了吧？2.唐100的二排中控空调，收音机控制面板没了，唐80都有的高大上配置，唐100给减了，地板也比唐80高了不少，头部空间减少了，3.方向盘后视镜联动记忆没了，只有E包32万的才有。4.唐100鼓吹的acc自适应巡航只有32万的E包才有，唐100基础版和D包都没有，这些想买唐100D包的车主知道吗？,auto_home,4f645190cee1aadaeb3bbe59a2b2e0ee_15,,
不是一个平台的车，gl肯定比帝豪高出不少，质感 驾驶品质都要强于帝豪,auto_home,77384303f57cbdae78978ec96903f5ff_4,,
比亚迪的新能源的车型还是不错的,auto_home,e67243401ad490aac9b7be2f9b3ae0c0_18,,
作为荣威360得车主，对荣威360也是情有独钟，喜欢他霸气得外观，喜欢中庸得内饰，喜欢超大得驾乘空间，前不久报名参加了菏泽站得节油赛，应该是有幸运的成分在里面吧，很荣幸进级区域节油赛，此次车友会阵容强大，规模也很强大，是荣威i6和荣威360双车节油赛，文采不好，请见谅，让图片来详细得向大家介绍这次荣幸之旅吧~,auto_home,3321290680a42ca17aa7e44c42119649,,
宝马Q5也问题很多，中国质量投诉提示过，还都是比较大的问题，厂方还不承认有问题说是路况造成。,auto_home,24810,,
车子已经很不错了，对得起这个价位,auto_home,642e7f9fdd34a248bf54aa720e3e5e17_57,,
临近五月底的某一天，闲来无事又见天气晴朗临时决定给我的大越越洗个澡，喷水，打沫，再喷水接下来就是仔细擦干，看着焕然一新的爱车心里别提有多美了。可是俗话说得好“乐极生悲”就在擦洗越越的大脚时突然发现右前轮轮毂上有一道深深的划痕！顿时……看着越越受伤的大脚除了自责就是满满的心痛。心爱的越越受到如此伤害我却浑然不知，真是“罪过、罪过”啊！。 静下心来苦思冥想之后终于想起来：五一节去迁西青山关回来的路上经过一段S形山路，拐弯时有点急有点大确实听到一声异响当时以为是压到石子就没往心里去，没想到伤到了轮毂，唉！太大意了！这里真心提醒大家行驶山区路段一定要谨慎驾驶避免给自己的爱车造成不必要的伤害。山脚下突出的石头要比马路牙子的杀伤力要大很多啊！谨记！谨记！ 接下来就是如何处理轮毂上的伤口，由于博越的轮毂是铝合金拉丝的需要专业设备才能修复。在附近找了好几家都未能如愿。最后通过经过多方寻找终于找到一家，来回需要一百多里地，虽然有些远但为了越越的完美这点路又算的了什么呢！和店里师傅沟通一番后便驱车前往。 这就是那只刮伤的轮毂，看着就心疼。都怨自己太不小心了。 虽然修复了轮毂心情好了一些但原车轮毂毕竟受到了损伤，希望不会影响到以后的使用。最后再次告诫广大车主“路上行驶，安全为主。山路行驶，谨慎为妙！” 用心写了这么多求版主給个“精”吧！,auto_home,40df6df191958ffbc2893c6464ae5c3c,,
了解过车身底盘底板结构的人都知道，有非承载式车身和承载式车身，非承载式车身底盘是带大梁，特征是粗厚的大梁是一体式连续性的延伸到后地板，几乎所有的非承载式车身大梁结构布局都是差不多的，不像承载式底盘各家原创的底盘骨架布局方式都不一样，非承载式车身在车身钢性上有着显著的优势，连贯性的大梁在追尾和被追尾时的优势非承载式车身的刚度是承载式车身难于媲美的，不过非承载式车身也是有缺点和弊端，非承载式车身发动机舱的溃缩区的设计相对要不容易，在各机构碰撞测试的非承载式车身碰撞固体硬障碍物体的时候引擎室部分的溃缩区由于刚性车架结构的影响，相比承载式车身带给驾驶舱司机和乘坐者更大惯性伤害，发动机舱的吸能的作用自然不如承载式车身结构的车辆，在日常行驶操控和高速行驶操控贴地感也不如承载式车身                                                                                                                                                              承载式车身的地板内由中间通道梁、左右门槛内外板、前后座椅横梁 钢板构成的，车身底盘底板是由纵梁 横梁...各种钢板冲压件组成的底盘框架骨架总成，发动机舱的纵梁承载着动力总成 电瓶和空调压缩机，我观察到现在平台的比较新的车发动机舱纵梁设计成直线性纵梁，没有太多被左右轮罩连接着显得独立干净利落，发动机舱的纵梁延伸到底盘是力量传递的主要路径，每个原创车企的SUV和轿车发动机舱纵梁延伸到底盘的方式都不一样，有些轿车的底板中部甚至没有纵梁加固，各家车企的地板骨架总成和底板骨架结构总成差异还是很大的，如本田一些轿车和最新的艾力绅是中置油箱的底盘骨架，同一家车企拿本田轿车底盘白车身来说，非中置油箱和中置油箱的底盘底板骨架结构差异就非常大，如丰田系列的SUV底盘白车身中低板以上的结构类似丛字形状的底盘底板纵梁结构，不知道是不是油箱的原因，绝大多数底盘底板的纵梁是无法绕过油箱连接后地板 绝大多数底盘后低板纵梁都是非连续化拼接的，承载式车架的纵梁设计目前很少类似非承载式车架的连续化纵梁设计                                                                                                                                                   这一点上我很佩服奇瑞，在整个自主汽车企业里面，能自己设计底盘白车身已经相当不容易了，以前没有成为奇瑞爱好者的时候在互联网上经常听人说奇瑞的底盘好？安全好？吸引着我去了解和探索奇瑞是否有何其他车企不同之处，很多奇瑞车主和喜欢奇瑞汽车的车友准车友都知道奇瑞在超高强度钢材上用料很舍得，比如6万起步的艾瑞泽5是这个价位唯一AB柱用热成型钢，车门防撞钢梁用的是防护面积更宽更结实的W型热成型钢，这样的结构沃尔沃也是这样用，但是奇瑞的白车身底盘结构有什么不同之处吗？有不同之处，就是奇瑞从A3开始就把底盘纵梁连贯性的绕过油箱连接后地板，就是连续性一体式纵梁结构，类似非承载式车身，尽管如此不过刚性还是差远了，家用车承载式车身无法像非承载式车身这样推重，不过承载式连续性连贯性车身的设计继承了非承载式连续性大梁的一部分优点，如侧面抗撞能力却比后地板拼接的纵梁提升很大，在正面碰撞或者被追尾力量传递分散不容易集中在一起，奇瑞连贯性的车身使奇瑞目前一部分采用的车型力量分散更好，奇瑞发展到现在车身结构上有着前瞻性的，起码现在也有车企放弃非连贯性纵梁底盘纵梁车身设计，采用连贯性纵梁结构设计，如2013年马自达发布创驰蓝天技术，其中一部分就在宣传创驰蓝天车身结构技术，创驰蓝天车身把底盘的纵梁连续化连贯化起来就是纵梁绕过油箱连接后地板，目前应用到CX-5身上，那CX-5表现如何？根基现有的资料马自达CX-5车身扭转刚度27000NM 这个价位扭转刚度已经很高了，同样采用连贯化的观致3扭转刚度也达到28200NM这个价位已经非常高了,auto_home,54f5bd4a3e04c420e220accfa1fc0662,,
乘坐空间大气不含蓄，后排感觉比前排舒服,auto_home,88e3b533c52c1230d090154d1646fe10_22,,
其实广汽应该正视问题的出现，这是对自己负责对消费者负责。不要到处洗地是。,auto_home,4e3e4d3194c47be139766de27701a395_62,,
媳妇儿上班要近一些，平时都是坐公交上下班，也比较方便。我上班在东边，有30公里，所以车基本都是我在开，感觉平时上三环，小五的油耗还算低的，一下三环就升起来了。今天媳妇儿说想让我去接她，还不赶紧领命，下班打卡都跑的飞快。 感谢汽车之家，感谢荣威俱乐部。,auto_home,39887b742f066bb075d53e73b8ec6eb4,,
