content,content_source,source_id,auto_related,sentiment_label
荣威550&nbsp;1.8T品逸换辆自动档或者SUV开开跑7万9千公里&nbsp;&nbsp;改装18寸轮毂&nbsp;225/35&nbsp;R18胎&nbsp;&nbsp;空气悬挂&nbsp;&nbsp;原装奥迪A6L海拉5双光透镜+恶魔眼&nbsp;&nbsp;还刷过ECU&nbsp;1挡破70&nbsp;&nbsp;挡破110刚换全车油水&nbsp;&nbsp;离合件套&nbsp;&nbsp;元宝梁胶套&nbsp;&nbsp;&nbsp;后对羊角总成&nbsp;&nbsp;前摆臂&nbsp;&nbsp;后摆臂&nbsp;&nbsp;&nbsp;清洗过节气门&nbsp;&nbsp;喷油嘴&nbsp;&nbsp;油路以及元催化器手动档开腻&nbsp;&nbsp;想换辆自动开开,auto_home,3937ffee87c04e790bc0da91a7fe4025,,
你滴车得上牌没有？,auto_home,10160ef49f47dc8599690bb48b1ceccc_41,,
最好不动，安也比较难，我的费了好大劲拉了下来，到4S也没安上，最后，我不得以，用小刀削了一圈，涂上油才又套上， 问题是弄不好，前挡风就玩完,auto_home,56f54bec0822fde4b46bc8e014d02a12_4,,
不知道什么问题，我的也不稳，不开空调也会跳转速。。清洗节气门了。不管用。。,auto_home,196dcc3fd68265d4294120415a19e743_4,,
车子贵就过来借 深有感触,auto_home,456f2b6e63656bc1f976816e128d10bf_11,,
所有拆车坊都在埋汰荣威，估计是上汽公关没搞好。当然不能说荣威底盘多好，就是一个中间水平，没有大的瑕疵也没有太多优点。视频上来就说20万的车，塌怎么不说12万？事实上荣威的传动轴并不是全裸，只是槽浅些。客观说荣威底盘不算太好但也不算太次，毕竟是6纵三横底盘，比起4纵如何？,auto_home,72e86cfbf94a8b0c003f163648681256_6,,
这几年班上下来，自己也存了点钱，想想身边的人好多都买车了，于是动了念头。经过筛选，选择了荣威360，办好了10w不到，家用车，我觉得这个档次的也还行了。购买荣威360的一方面原因是外观，之前在路上就遇见过好几次，我觉得挺好看的，整体的一个车身看上去十分的流畅，是我喜欢的运动款轿车，不呆板，符合我的一个审美观念。我这6月份才买的新车，就跟打仗似的，乡下路不好，灰尘也多，千万不要嫌弃我的技术不好，我这手机像素不行，跪求真实，无p无磨皮。前脸没车之前去哪都是坐车，上车睡觉是习惯，很少去关注交通状况，保养常识，节油技巧。但当自己成了司机，恨不得一下子都能领会，真心验证了一句话，书到用时方恨少啊有辆属于自己的车，已经很满足了，&nbsp;10w左右的车，家用代代步可以了，当然了，有钱人随意,auto_home,6253b669efb82b24b6a9bf18fcb2a2b6,,
博越真的不错，值得拥有，求回访,auto_home,4a812aa5f355f65928fafe8c367b5c4a_17,,
"crv,思域都是飞度的底盘。",auto_home,21668117585bda5f71e35ad50a3d6d9b_30,,
不仅不心疼，更不用担心哈弗的高油耗了。呵呵。,auto_home,142ce440a75e891f94dd5bf46d6de116_82,,
1.0T发动机装到家用车上真的够用了，也不会天天跑长途....,auto_home,26203,,
博采众长，驾越不凡！,auto_home,575cd5c8b1cf1e9f47c223e4f826dd51_179,,
先上一张美照 作为人生中第一辆属于自己的车，在经过一段时间的观察了解后，毅然选择加入GS的大家庭。 第一次在路上看到GS时还以为这是一辆十二三万的车，当后来了解过后才发现，GS真心是拥有极高性价比的一辆车，正好打算买辆十万以内的车，终选择GS。 6月30下午来到四海店里看车，销售人员很热情，细心讲解，趁着当天活动订车，7月1日来店提车，一切顺利。我的小金在年中第一天交到了我的手里 毕竟90后嘛，喜欢个性，于是乎自己做一些廉价的外观小改，目前算告一段落了，日后金钱充裕时再接着改 到今天已经开了一个半月，1500公里，GS并没有带给我任何负面体验，在市区舍得给油基本是一路超车因为时常会带家里老人，GS给足了充分的后排空间，全景天幕也让车内显得非常敞亮，这里要给GS点个赞。 下面开始看一波美照，技术有限凑合看,auto_home,47c51fcf848efb8dbce6010bf768b217,,
表显是9.5，实际应该快11升，又堵车又开空调，加200块油都开不了300公里,auto_home,3bb03d8ca26ee78af382cd882dd4481f_13,,
LZ  太牛了  马六后视镜那个三角形位置刚刚好吗？,auto_home,59c4bf21930a3e2b24f4b265ed6f30c0_142,,
这车开起来隔音怎么样,auto_home,758a99669a5903079e2fe954c5ab3690_78,,
对的，选择荣威没错的,auto_home,5770beda7b6065767d99749bd034cfbd_106,,
我朋友也有一台同样的车，还不错。,auto_home,5f5c1526f57a04657164816e1614cc72_46,,
接着来，，，，，嗯，越改越国产样，越改越丑几吧,auto_home,4f3c948237ef448c1969326a378e3411_14,,
如果我们博越能用上沃尔沃发动机就好了，油耗决对能降下来,auto_home,1aedf86eaf5ddac433b36b5dcf809662_59,,
今天去4s店提车，之前定的是红色1.5T的智享，到了之后老婆看见蓝色的，她说蓝色比红色好看，可是店里蓝色只有低配的，销售叫我们等几天，我喜欢红色，她喜欢蓝色，大神们支个招吧,auto_home,72fd7d0ab2a0f98a03a97bfc08d742ca,,
"但从我们荣威550看,漆应该是荣威的强项才对.",auto_home,502bb8a2b7b34e6b157a15ec89addfc3_21,,
哈哈，买车就是个代步工具，性价比差不多我觉得就行了,auto_home,2c5734d4575fb0547ff88932b4e127ce_17,,
哥们  荣威车费油吗 ？？ 我听好多人说同等价位 荣威比其他车费油,auto_home,784445e2b20a2e7250012cf19d7f0038_171,,
车挺好看的，奇瑞的车就是稳，如果换车还是奇瑞,auto_home,5cedf0774e8daa3fa308faec38d22790_5,,
外形有点闷闷的感觉，底盘好低啊。。。。。,auto_home,1e195c2abbee88f252312a4c3f57f921_13,,
选车背景： 身边人都买车，我也就顺其自然步入买车大道，当时应该也看了很多车的，总要多比较比较的。我就记得自己差点就买了别克英朗了，就是价格比360的要高，内饰做工还差不多，甚至我觉得英朗的塑料感更强，后来也就不了了之了。 用车感受： 360给我最大的感受，就是油耗低，逢人必夸的一点，就算现在是一上车就开空调，但也才5毛多，6毛还没到，这个数字不得不服！话说回来，油耗多少，也要看个人水平的，新手不知道技巧，大脚油门，大脚刹车，应该是正常的，而这种情况肯定油耗会高的。 动力，试驾的时候就有感觉起步有点不给力，但到了后面提速还是蛮快的，凡是不能要求绝对，将就将就。不过只要你舍得踩油门，我觉得动力都不会肉到哪里去，又不去要去翻山越岭，家用轿车而已。 其次，空间，很大。麻雀虽小五脏俱全，也就差不多这个意思了。从外面看不觉得空间有多大，但坐进去就深有体会了，后排坐4个都可以，很大很宽敞，坐着不挤人。 至于，舒适度，只能说还行。车子减震偏硬，每次过减速带的时候，都会跳一下，我也挺无奈的。 晒车过程： 为什么感觉我拍出来的侧面略显臃肿，其实还是比较修长的 眼睛造型很锋利，可惜是卤素的，最起码标配个氙气大灯吧 车身轮廓很有线条感，也很有运动感 屁股很翘，底盘高度我很满意，一般的路面通过无误 轮毂有点小，不够大气 虽然已经买了好久了，但是外观也仍旧没有落伍，看上去还是一样很舒服的，接着说内饰吧！ 自我感觉360的内饰还是挺厚道的，塑料感也是有的，但还可以接受的，这个价格的车都难免，但我觉得比很多合资企业好很多了，设计方面我还是满意的，比较简约时尚。 8寸中控屏，哪里都好，就是没有导航，表示无语，还要用手机去导航，确实挺麻烦的。不过有个carplay，这个倒是挺实用的，可以连接iphone的，操作起来也很简便。 电子助力方向盘轻巧，指向准确，转动起来很方便 简单大气仪表盘，科技感十足 换挡平顺 门板开合度都还可以 头顶距离刚刚好，坐进去还有一拳头，本人177 后备箱和储物空间也都不错 认证！,auto_home,236a5386d3ffdb0491a38e03d0405035,,
车子拍的挺6的，景色也横不错呦,auto_home,4816211c197e3c29d1cd209a566b6ec1_230,,
下坡你没踩油门换毛线档。。。刹车和油门一直有异响，已习惯了，不影响使用和面子问题，不像压缩机噪音，自己听了受不了，别个听了没面子，，，,auto_home,33f37379fdeb5dd1d31f909ab83dbe2e_1,,
用车三天了，家住乡村的我刚开回家周围邻居都围过来看，还一个劲的夸这车好，当时心情美得都笑得合不拢嘴?。特别是这中控大屏，都说洋气得很，都是第一次见，心里小小的虚荣心得到了大大的满足。当然了，车的舒适感也是蛮不错的。动力方面也能得到满足，1.5T的有169的码力这说明发动机的技术还是蛮了不起的。咱来说说车身,auto_home,25402,,
轮胎还在吗？,auto_home,26a039d246e9de461d7728c1cbd35f34_14,,
这个4S店还赶不上一般的街边店，设备也垃圾，晕死。,auto_home,146303c013823a602a0191792d7453cb_24,,
那自己一开始就要用脑啊，买了1.3t，才后悔。还说人家1.5t也不行，又说要开2.0t才有感觉，那自己是不疯了才去买了1.3吗？我本来都想说的，我去年那台锐志2.5又说动力，那不如开飞机才不塞了。,auto_home,10341,,
你只能开自动挡了。 350已经是我见过的最轻的离合器了，比日本车都轻。,auto_home,74bac938a554fc8667312d30c5ed029f_3,,
这辆车外形特点确实很不错的，很给力的车型,auto_home,7edd08f4c8fd64c4f977e7f670ef3b3a_138,,
恭喜恭喜，和我的是同一款车，油耗我们开的也差不多的。刚买车的时候在城市开，觉得后备箱大没什么作用，回家过年的时候才真正体会到后备箱大真的很好，在家走亲戚基本都是满的，一般的轿车根本装不下,auto_home,51ade5d7561de43dd36ded819e86424b_202,,
颜色还是玫瑰金最耐看。,auto_home,d40ad85780e313c483f382cedc6b2540_184,,
H1代步和个人开都非常不错,auto_home,20b088ff368d32f60543e2a4e2c2424c_33,,
楼主这么担心大众DSG，那对于这个车上的同样是7速干式双离合怎么看？就不担心了吗？,auto_home,2453,,
全面了解了一下名爵ZS这款车,auto_home,615192ffc676542dd4b4a5b73cfb059f_19,,
很喜欢名爵ZS这款车的前脸，造型很霸气,auto_home,13ff99b5a903cf5f0383c66aec414f80_39,,
你买高配胎噪就比较好. 其他配置配玛吉斯都是噪 但可以接受,auto_home,7bb81af337c4845654980eca787c4440_36,,
好多天没动车了，今天早上开还正常，刚才准备出门，一启动报图片上第三个灯的警，也不知道是怎么回事，开关几次都不会消，各位坛友问下这是什么原因给指点指点！！！,auto_home,41dda9f9c5fa65d3c41b687530450997,,
没啥问题，保险起见还是不跑高速。,auto_home,6659615d21d782b60ecefa5113c70b87_9,,
广汽传祺GS4，现在GS4有点乱套。。。你还问这是啥车,auto_home,107507291abdbaec3ca764bed75503bf_1,,
  大家好，大头又来了，这次继续给大家介绍我的爱车--吉利博越！   吉利博越由国际著名汽车设计大师彼得·霍布里带领国际设计团队操刀设计，整体造型融合了中国文化元素与国际审美潮流，外观动感精致，内饰轻奢典雅。吉利博越采用了许多中国风设计，例如家族式“水滴涟漪”进气格栅、中国玉如意造型的前雾灯镀铬饰条，以及灵感来自于西湖拱桥的主仪表台和源自中国书法的中央扶手等，整体设计更符合中国消费者的审美偏好。这也是我选择博越的原因之一，外观设计原创度很高，没有抄袭的痕迹，内饰大赞，设计的美观简洁，整体内饰用料做工都很精致，坐进车里会给人一点点奢华的感觉，而且舒适度相当好。在驾驶质感方面，吉利博越出色的静音及滤震，远超同级自主SUV，甚至超越同级合资SUV。平顺的动力输出，精准的指向，反应线性且及时的刹车，让人驾驶起来十分轻松舒适。我的车子是自动智尚型，用的是吉利自主研发的第二代1.8T发动机，最大功率为135kw/5500rpm，最大扭矩为285N·m/1500-4000rpm，动力强劲，性能卓越，匹配的是吉利旗下DSI的六速手自一体变速箱，换挡平顺，平常开基本感觉不到换挡，急加速的时候会有一点感觉，不过相对同级别的SUV来说表现还是很突出的，在高速超车的时候即使没有切换到运动模式，深踩油门变速箱也会马上降一档来提升扭矩，现在高速超大货再也不用担心犹豫，想超就超，动力随叫随到。 再来几张小越越美图收尾    博越，采众家之所长，外型上融合了中国文化元素与国际时尚潮流，精致的内饰在设计上融合了众多的中国元素，博越主仪表台造型设计灵感来自杭州西湖拱桥，优美的轮廓曲线为乘客带来愉悦的视觉享受。水波纹中控面板，与拱桥曲线相得益彰，给人以柔若流水的细腻质感。中央扶手、门板拉手，源自中国书法的写意笔触，采用镀铬工艺凸显质感，寓意着“连绵不断、吉利永长”的回纹被大量应用到了内饰的各个开关部位，博越的地盘很扎实，配合柔韧的悬挂和18寸的大脚，使得博越即使在走烂路的时候也保证了乘坐的舒适度，发动机动力充沛，变速箱换挡平顺，整体开起来很舒服，当然博越也有一些不足，后排座椅不能调节，后备箱空间略小（好在不用拉货家用足够），在走烂路的时候车门偶尔会有点小异响，毕竟哪有十全十美的车子呢，总体来说博越还是不错的，性价比很高，驾驶感受真的很棒！    博越，集众家之所长，伴我行走宽广的天地之间！,auto_home,78c821dce686d8a99e7b79f5bbd8d3fb,,
XTS比950油耗高很多,auto_home,7def4205ff444508692aac22a3fc5551_13,,
我试驾1.3的时候感觉车很沉，应该就是低速动力差，开老帝豪1.8的感觉一加油马上就加速，油门大点轮胎都打滑。,auto_home,56193b250a28943b07f35b05d20b72aa_156,,
没有任何毛病，放心开,auto_home,4305e3329be3f8d12ab81e3015dda7c0_13,,
恭喜楼主，我在4月20号左右定的车，销售告诉我是五月底可以提车了,auto_home,9dcc2284cc77340e01291b53a0bb61e0_62,,
哈6空间也不费油大，旅游专用车,auto_home,7216b0e554ecf8bf288a848409c90c03_9,,
说没必要装，太概括。 装不装要取决于你经常在什么路况行驶， 作用都是考虑到环境因素而定的，你行驶的路况很好、很平整例如城市道路的话，建议就别装了；如果在农村路况不是很好，那就装上吧。对你家的发动机油底壳好一点哦~,auto_home,204c61f188950a66a274244b225f7f24_1,,
楼主，开车时不要拍照，危险动作，当心出事！,auto_home,1e88cdbb5b287356470bcc954ef084ec_1,,
符合a1b1标准的，机油瓶身上都有标注的，你可以查一下a1b1标准是什么你就知道了，我用过极护和银美孚别的不知道，,auto_home,42f1007050a5dba582c816d2db1507e4_5,,
太垃圾了，我的车也是到处响，才开4千公里啊,auto_home,6522,,
看到楼主的车下雨就进水了真心觉得这天窗设计是缺陷，天气变化无常，离开车天窗没关就进水，要是把线路打湿了后果很危险，做车厂家没有安全感，不像博瑞，博越天窗和车窗可以熄火后自动关闭。淹水车窗自动开启，这才是安全意识。造车一定要首先考虑安全。个人观点。,auto_home,6130d41475b76920339ed35224f38231_347,,
博越的悬架表现对应付烂路来说是非常有底气的。,auto_home,42927a90845520b8da2e45295d2c6529_89,,
首保时看到的950事故车，拆开来看用料足啊！950还是很厚道的！,auto_home,4467773a0eda83f989da7999d39bf809_14,,
引用: 原帖由 sxchain 于 2011-11-17 14:31 发表在 2 楼 开了4000公里电瓶就坏?换了电瓶再亏电的话 你叫4S查查是不是后加的导航问题 这到忘了问他们。当时4S说是质量问题。看来我的多注意下这问题了。。。谢谢,auto_home,84aaa2bfae4f37ebcaba89e725e4b830_17,,
反正跳档是我用了手动模式那段时间跳的，估计过多的干预造成变速箱混乱吧,auto_home,7fb1095d0a1c2c90a3c5640189336e66_5,,
荣威干式双离合。板车。就凭这两个物件就不值得买。。谁买谁后悔。别问我怎么知道。我就是双离合车主的受害者。,auto_home,24013,,
必须的啊 爱车如妻,auto_home,1e267d8511b7bd92e767778736396280_131,,
mg3除了噪音大，amt低速糟糕，其他还行,auto_home,607015bb6a42a479f4a61da3a22907b3_2,,
这车的确胎噪有点大,auto_home,d3349f1d8f9aa5057bdf6b01ab906240_5,,
发动机隔音做得还可以就是胎噪音大,auto_home,3a668622a159fb5e8a5ac2982f8fb7d4_5,,
恭喜提秦，这个大中控屏太抢眼，帅的很，前脸也很大气,auto_home,7c1820e2858f5561f09bcfb2972edd0b_9,,
你弟弟会后悔是在意料之中，m6是郑州海马的产品，没有底蕴没有过硬的技术，只有并不算华丽的外观和可有可无的所谓先进配置，可是三大件呢？不懂车又追求面子的年轻小伙，我们也不能苛责他不会选择。同价位一分钱不多花的福美来（海南海马的产品），有机会你可以试驾一下，不夸张的说，工况不是太坏的情况下，甚至有点奥迪车的行驶质感。都是海马旗下，但是不同的生产商做出来的是完全不一样的作品，福美来连esp都没有，配置低的几乎让人怀疑是辆工具车，但是对于真正需要用车的家庭而言，福美来三大件的可靠性才是无与伦比的首要选择。其实国产车有一条路走错了，那就是追求外观与配置，有什么用？全是虚的，从根本上讲，只有整车的质量与可靠才是永远要恪守的。4000万的布加迪怎么样，可是连个中控大屏都没有。打个比喻，m6是一个美丽的大高个车模，福美来是博尔特那样的运动员，选车就要深入了解车，起码要看口碑怎样。另外说一点，前排座椅下边那不是空调出风口，而是进气口，是空调内循环用的,auto_home,42af67a16b28a19036827d68c579e5ff_56,,
你好，这车太难搞了烧防冻液好长时间了，就是小不出原因，求帮忙给解决一下,auto_home,3c797d81e7e1c343dc1c63166c03088e_93,,
打赢gl了吗？荣威坑爹定价注定死翘翘，销量已经说明一切,auto_home,1c5c1dccdd253e3ffff144c4cdcdde73_319,,
直接400投诉4S店,auto_home,1cde89eb0551aa39a6916260c30ef190_24,,
我去，哥们 我也太原的 最近关注这个车，你在哪里搞的？啥配置,auto_home,15430,,
你最好找个空旷的地方试下，急加速不扶方向盘 看他会不会变向毕竟半轴不一样了,auto_home,20461,,
外观 内饰都很适合 非常棒,auto_home,6d9e47f2b74f8985770e1d86659d11a5_27,,
我和楼主想法刚好相反，其实顶配还是有很多实用的东西，比如环抱式侧气帘，遥控驾驶，9声道环绕立体声，360度全景影像，行车记录仪，座椅加热通风，LED大灯等等。加上车型价格差距在1.5万左右，个人认为该上顶配，一句话，牛身子都过来了，还需要把牛尾巴砍掉吗？另外，你女儿确实可爱，祝愿在你和宋大妈的呵护下，茁壮成长！,auto_home,70880b9455df74eb8b5dca5fce3b3900_195,,
我定的自动智享型的，,auto_home,5d6fd64f251bd1d3546d5c37708f6516_7,,
四个胎的压不一样，加速磨损。经常看到车友们的胎压不一样。,auto_home,495fdc1e4627a1767da217cc2e56708c_32,,
什么时代了，谈起加价crv要被国产车吸化了，,auto_home,20970,,
GL确实漂亮，欢迎回帖,auto_home,1ea7d1030cf3d6491e690eb46e617362_154,,
恭喜提车……,auto_home,22fcaec9db37cc75bf9fe1d612d845d0_19,,
呵呵，就是想换suv么，等车卖出去了就去订博越的，其实也看了很多，也都试驾了，包括h6，h7，博越，crv，荣放，昂科威，cx5，只有h7，博越和昂科威质感好点，一度差点订了昂科威，，想想还是舍不得,auto_home,7c6d8c73bedbcb755abc97be03dd3ca8_67,,
刚买了十天，车是四月产的，就是感觉反应有点迟钝，起步，或者行驶中刹车到一定速度再采油门加速，就感觉反应慢一两秒，而且会有顿一下的感觉,auto_home,29fd83741a7d5af0576de0db93598064_4,,
一年的时间和博越的相处很有感受啊。博越现在就是我的家人了。,auto_home,25650,,
这么说卖给包工头也不行了，难怪销量升得这么快，要是人家小三粘到黄油了，一套衫三万多，看那上汽怎赔，,auto_home,1127,,
我倒是没后悔选择大5 但上汽和四儿子的态度我十分不满意,auto_home,6090de62226285ddcf236779510982b0_20,,
实车更好看 真的,auto_home,11703763ab6e2c5ea0cd80879faeceec_19,,
h2s仔细看着其实有点不协调。高度有了长度没有。,auto_home,5381cafac39abf87b38b04a6a40f2956_8,,
熄火停车后，刹车踩几次就踩不下去了，因为没有真空气压。现在的小车几乎都这样。方向盘动不了是因为锁死了，熄火后再转方向盘，就会进入防盗状态，方向盘会锁死的。同时一键启动也没用，通电转转方向盘就好了。,auto_home,20189,,
问题是10万块钱的车子，买不到什么这个质量的涡轮增压的车子,auto_home,5fab865f10f14c728cdd76f07e62e82b_9,,
我发现的是只要车身有水就会出现这种问题、应该是哪里线路有问题、要么传感器坏了。,auto_home,6355d1adec36287e7912d1c643974edb_3,,
光线问题。照片始终没法和实车比,auto_home,22170c68d04e9f9c029ca4c136919ef9_22,,
我在决定宋大妈前就打电话问过极睿经销商，这车，不能上节能车号牌 限牌城市可以无视了,auto_home,5e1789bdbae21738199ed947a5cd3995_3,,
后备箱放备胎处下雨过后里面就有好多水，是怎么回事呢？怎样能够解决问题？万分感谢！,auto_home,4c6fd205254c8def941ff3259045ea1a,,
前些日子，老爸说村里分了点花红，，就给我买辆车，平常就不用挤公交上班，于是就去泡论坛跟去车城看车，看了国产的哈佛H6，宝骏560，，，比亚迪S7，，传祺GS4，合资就看了XRV，缤智，这些车型，，无奈合资车相对比较贵点，，而且尺寸有点小，然后按老爸的意思转战国产，，国产这几款也就传祺的性价比比较高，所以一到4S店看传祺GS4，老爸一样就相中展厅那台棕色的，于是就叫销售过来开始砍价之路。 --------------------------------------------------------------------------------------------------------华丽的分割线 结果经过一番周旋，就下了5000大洋定金，，，就坐等提车了。反正配置那些都是老爸谈的，我也不懂什么，有车就开 作为刚出来社会工作的我，虽说不是什么车，但还是满足我的虚荣心了！ 好了，，来分享一下提车历程！,auto_home,d06a572e17a863c7df9dd9d93c279120,,
上汽是一家负责任的车企，不然也不可能发展如此迅速,auto_home,26312,,
这种是假的，小心人家将你骗了，订金都要不回来，网上这种骗子多的去了。 真要实价，老款优惠5万以上还是有的，毕竟BBA的中级车才要多少钱？ATS-L优惠后的低配终端价也接近21万，荣威950不降价就是找死，但11万的价格是还是不可能的事，小心呀、,auto_home,7ad4578d49a3edd31be5edcc064dae75_5,,
我昨天看了一个二手的350，，，5年的车，，，5万公里，，请问个老司机估计要多少钱??谢谢,auto_home,62b874e25c2d98dbed0909652d6f0ff6_19,,
两个都是4AT，就看你更加喜欢哪款了，我没有试驾过，也不好评价，恐怕帮不了你，你问问开自波的同学吧！,auto_home,e62e58d3e9424c1547d3080f67fddf90_29,,
又在为插电混动做出自己应有的贡献啦。这个虚拟仪表还不错。不过荣威的底盘我始终不是很喜欢，算是偏见吧。,auto_home,26e1636ff8c971fd9fac692f07cb29c7_16,,
