source_id,content_source,content,auto_related,sentiment_label
63c2f2e72cec14ad9dedfe2b79229258,auto_home,不知不觉小五子已经陪了我们全家9个多月了，跑了一万公里，是时候做二保滋润一下了。先说说这一万公里的用车感受，吸引我下单的是惊艳的外贸和豪华的内饰，那LED大灯那大屏那前后排的乘坐空间太招人喜欢，购买欲蹭蹭的往上飙，说说驾驶感受，顿挫，低速时脚法如果没控制好，能明显感受到。上坡加速，如果你想在坡道中加个速超个车什么的，请提前手动降档或挂s档，要不然这变速箱会让你抓狂。底盘整体感还是不错的，毕竟是新车，希望多年后能保持这样的整体度尾箱的行驶噪音有点大，但还能接受。导航十分的好用，地图更新快线路规划都比较合理。大屏的响应速度比较慢，点下去半天没反映。乱七八糟说了一大堆，RX5和合资车比，鸡头凤尾，我还是选择了鸡头，目前为止我还是对鸡头很满意的希望荣威也早日飞上枝头变凤凰。,,
5e1821e495cdebd9bb97ff81af2e3b97,auto_home,【前言】 作为热爱生活的人，个人觉得喜欢的东西就要珍惜，要用心去守护，就像过日子一样。生活中亲情爱情必不可少，小弟命好，两年前终于把相恋多年的女票，变成了媳妇，自然也生活在蜜糖中。 6月是我那俏皮媳妇的生日，大概半年前我就在想给她一个完美的惊喜。想着她上班路途遥远，送一辆合适她的车代步，还能提升整个家庭的生活水平一举两得。 考虑到目前新能源车型是现在趋势，省油环保也是符合我们这种正在奋斗的家庭主旋律，所以最终将宋DM作为了送给媳妇的生日礼物。 从缴纳定金最终提车，可谓心惊肉跳，一来是怕自己预定了白色没有货，二来是怕最终不能按时提车，好歹中途没有发生任何意外。生日当天把车钥匙放蛋糕里面，最终获得美人和她闺蜜的一致好评，成为那传说中的别人的老公 好好，我知道在论坛里面撒狗粮不太地道。所以作为一个业务摄影师，拿起了手中的相机，记录下媳妇当车模的美丽瞬间，希望大家可以喜欢，把手里朝我丢的臭鸡蛋，换成美丽的鲜花，那我这篇帖子的目的就达到了。那我们废话不多说，走着。。。 【正片】 先上生日礼物和媳妇靓照 咱们内饰在走一圈 后备箱空间也很足哦，用我媳妇的话说，听声音就知道是宋DM来了，看来在低速环境下的新能源车型的辨识度真的挺高。 好好，我知道大家很心急，大家都想看美女，其实下面的内容才是真正的正片，下面有请我们的俏媳妇继续登场！！！ 老死机已上车 正片到此结束！ 【最后补充谈谈一位女车主对宋DM的感受】 1.很省油，真的很省油 2.超车很容易，不过目前还不敢随意地板油 3.车内噪音很小，基本听不到什么噪音 4.这是她收到的最好的礼物 嘿嘿嘿，看来我的选择是对的，感谢各位看官欣赏，最后祝福论坛各位车友，享受生活，享受爱车！,,
6c18c8567767e30162bf9c379999aa3a_5,auto_home,空调效果不错，声音也还行，我没开过最大档,,
2624,auto_home,牌照政策一直在变的，不过也无需担心，荣威是上汽的，是上海政府扶持的，如果不发牌照我们就集体退货就是了，老实说，我买了24万元的车，看中的还是这块绿牌,,
10f12be8d431aefb21c5d6024b4faddd_5,auto_home,调了不下于4次了，过了一段时间还偏，四轮定位也做过轮胎也对调过，轻微的向右偏,,
baad3879837b3ddaa9906793c4d06e10_17,auto_home,我这次也把节温器换了，冷却液也直接换掉，冷却液最终加了5L多一点，目前液位在MAX。 经过市区、长时间怠速和高速实测，运行相当稳定。正常行驶温度可以很好地控制在90度整，工况变化情况下，向下见87-88度，向上见91-93度。,,
aabc79db2834781840ecadfa2dbb90f0_20,auto_home,你是看的测评视频吧？高压油泵都是本安型防爆泵，放心吧,,
10b684191d0fa2003c08a4eda5a8f3a8,auto_home,本人30出头，参加工作已经有几年了，工作无论待遇，薪资方面都还可以，有了一定的存款，足够过小康生活。老婆在家照看孩子，一家人其乐融融，这不最近就发生了一件不愉快的事情，晚上11点多，孩子大哭不止，老婆用手一模，吓一大跳，孩子高烧了，那体温计一量，更吓一跳，赶紧收拾东西，抱孩子去医院，走出小区，马路上的公交车少之又少，急得我直冒冷汗。老婆也是一个劲的埋怨，说让你考下驾照就买车，可你偏不听，这下好了吧。我说媳妇儿，咱不着急，明我就去买。这不就开始了看车之旅。我先后也是看了不少车，看都看花眼了，听得都不知信谁了。后来还是看朋友有一辆荣威360，觉得外观虽然不是很高大上，但是最起码看着有一种车非常结实，稳当的感觉。媳妇也很是满意，我开了一圈车，起步时车子有点太肉，不过车跑起来动力却很足，后劲很大。决定到当地的4s店逛逛，想在听听销售顾问的讲解。今天就来到店里,,
3baba9c80f46b6605c25e1a71b7e2ea2_8,auto_home,分离轴坏了，你才4000多公里应该不是，主要是润滑，我在4s店他们直接用机油小壶在哪里倒，倒了很多，还漏出来了点，刚开始感觉踩下去阻力小，过了3天吧，一点也没有了，现在过了一个多月没问题，喷的的没有用，维持时间短，润滑不够，最好是打机油，黄油的话拆变速箱，新车最好别动，你说分离轴有问题也要拆变速箱，继续打机油里面去，自己也可以搞,,
1cbe9103be8fadec7c19170d8568b710_16,auto_home,操控台看着还挺好看 不错,,
43ed52d9202a0683466c3a894efcd7d6_21,auto_home,维修是可以的，调校的话您就抬举我了。我去再修炼个十年八年也不敢说调校一款变速箱。,,
303f11ecb4427e43ca26fd1458c2f1f5_30,auto_home,还是买飞度或致炫去吧，这车不省油，特别是在市区。,,
36af23b227551c134dae569222df9afb,auto_home,好多网友直呼“BYD这个车标改换了”，比亚迪秦采用了全新设计的多辐式镀铬格栅同时蓝色的饰条中央使用了全新的“秦”字LOGO，视觉效果相比现款车型更加大气。 车内的实体按键也延续了中文按键的特色，直观明了，这点必须给比亚迪点个赞，而且方向盘的车标也换成了秦字标。 比亚迪新能源汽车，充电难题已经解决，半个小时充电续航100公里。油耗从1.6L/100km降低至1.2L/100km。（这个油耗，按93号汽油6.2元/L来计算，一公里才7分钱） 汽车内饰营造出高于本价位的豪华感，12.8英寸的高清触控电容屏，科技感爆棚。全景影像功能、丰富的多媒体显示功能。 我就是“大”不服来辩 这12.8英寸的高清触摸屏，英雄联盟都可以玩起来了吧！哈哈 比亚迪秦100油电混合式动力驱动，1.5T发动机最大功率为154马力，功率达到110千瓦，295马力的总功率以及479牛·米的最大扭矩，6挡双离合变速箱，百公里加速5.9S。 值得关注的是，本回全新升级的秦100还搭配了多种智能“黑科技”。如升级到4.0版本的360°超高清全景摄像系统，拥有4个高清夜视超广角镜头，真实拍照画面，还原车身及周围360°全景，可谓是广大新手司机的“福音”；而想到当今的空气质量，比亚迪的PM2.5绿净系统就显得更有必要了，能快速降低车内PM2.5值，对症下药“专治”雾霾；此外，秦100还搭载行车记录仪、主驾座椅通风加热、三项记忆联动系统、遥控驾驶等多项智能配置，带来全方位驾乘体验，全液晶仪表盘科技感十足并且显示效果相比其他车型优势很大。,,
23ae505546c24168f13b0a92fecbc7ea_1,auto_home,多连杆不是标配，有点遗憾！噪音问题也值得改进！,,
1e9a96467bb67b344b18075abe4f3be5,auto_home,2015年第一批车，到现在两万多公里，已经有出现过五次电瓶没电现象。4S店检查说是什么都好，一切正常。我都是醉了，那到底是怎么回事呢。。。,,
25fe69873c2acb33d7c1216ad74c97d6_9,auto_home,我喜欢那种小排量的车，而且高性价比的。,,
1d0add5b57a6abd9e45272061701e24e,auto_home,10款荣威550踩刹车踏板有漏气声音停放两天刹车踏板就只能踩点点啥问题真空助力泵有点漏气还刹车油壶油太满,,
18497baeb5d7e498fd693969f2e3952f_13,auto_home,呵呵我的艾七高速四千转车速才120发动机转速太高耗油,,
57a6b7bd8e455d4e3b6d1555f78d1010_70,auto_home,我的天，这上山道，简直惊悚，上去都不敢下来啊,,
155dc9600c44b7bc700bb77fc36961cb_11,auto_home,我都是每次保养提出来让4S解决顿挫，他们说没法，我就告诉他们以前他们给我退点油就好了，我说你再试试，不行我也认了，他们每次都免费给做。,,
452787112e5d9f7a370f635c81d30d90,auto_home,刚才看到远景suv手动挡有定速远航的配置连远景都有，为什么gl的手动挡就没有这个功能？跑高速右脚都要断了.吉利偏心啊，问4s说不能加装这个功能，有哪位车友知道哪里可以加装吗？,,
7853ed36f42d324f9174c553bae52d30_28,auto_home,配件质量不过关，装配工艺不熟练，这是奇瑞最大的问题,,
37d5b02d9943474800bb9f844c33580d_28,auto_home,车内的镀铬条设计确实是挺有亮点的,,
48faea541ffd619468b872473ea626b9_163,auto_home,刚哥的视频敢讲真话，这点要点赞！相信不止我一个人认真看完了视频，实话还是对H6有点小小的失望，但是也认真的回顾了视频中新款H6的各种表现，还结合了此地无垠测试的情况！个人认为，车与车确实各有优劣，何况咱们买的都是普通家用车，百米加速，百码刹车，绕桩测试，麋鹿测试，试问有多少车友每天一上路就做这些的？我不否认将来驾车时有可能会有这些类似的操作，也看过刚哥对BX5的测试，最终选择新H6是因为一是不想太另类，二是真心担心福田宝沃的品质！H6是我人生第五台车，目前正在发现他的优点也正在适应他的缺点！这个年纪开车，也就图个四平八稳，安全舒适，带家人出行时更是如此，只希望长城不要辜负我对他的期望，别把我丢路上就行！,,
2ea0a909c5aaa49d2d42f360663b2ab9_142,auto_home,博越的配置还是非常高的,,
7dbee9ba10596bbb7a449520ad913cd1_50,auto_home,车子看第一眼真心不错，设计感很强。,,
18298,auto_home,想问问博越和长城那个很,,
78c821dce686d8a99e7b79f5bbd8d3fb_1,auto_home,博越还有改装的空间，把它弄的在高大上一些吧,,
75207f9adb39b22afb394e1170a93d8f_30,auto_home,拥有博越，我们一起快乐,,
7a9211f2d12b360d399cb047ee65f640_3,auto_home,好喜欢，红色的越越，好骚气,,
67612405fff5eca4cbe1f90e375056bd_6,auto_home,开空调起步加速时，是不是有风扇高转速的声音,,
18081,auto_home,不差钱就2.0T吧！,,
16d2b798327719f3b4dafa4401e24996_464,auto_home,这款车真漂亮，眼光不错,,
32b7bc7790165ecb39e6da31a98a49f0_15,auto_home,定价偏高，销量不行了  越来越少了，而且看车主反应的小问题比较多 小细节做得还可以更好,,
2e1eafe7d6c23c5d92e3e7bcc8b59ea3,auto_home,关于青春 只是尘封了你的记忆 只要你愿意开启枷锁 便会找回自己的青春 可回忆 勿沉迷 记忆中的美好 留在记忆里就好 青春 依然在流淌     提到我的爱车也快一个月了，对于我人生的第一台车，我是疼爱有加，就如我对自己的媳妇一样。购买全新哈弗H6后，对于我的生活，增添了不少乐趣，平时工作结束后没少带着媳妇去兜风，媳妇对于自家的车也是赞许颇多。     当初购车也没考虑太多，颜值控十足的我一眼就相中了全新哈弗H6，现在不到一个月的驾驶，我越来越喜欢这种酣畅淋漓的感觉了。其实，这台车的脾气我算是摸准了，还真是我媳妇的脾气相近，你若顺着它走，它会给你带来许多乐趣，不要去刻意的去放大某一点就好。要让自己的媳妇和爱车去适应自己的习惯那是多难，爱他就要学会去接受它的不足，爱他就要懂得适应它的品性。     动力方面绝对够用，2.0T的排量不是盖的，虽然猛然加速油门反应迟缓一点，但也绝对不影响它澎湃的动力输出，7速的变速器也顺应了这样的动力输出，连绵不断。     内饰方面质感很强，黑色虽然是那么的压抑一点，但这是我喜欢的内饰颜色，没得说，只不过平时有些小懒的我，还是时常带着抹布拂去它身体上的灰尘，自己选择的颜色，再懒也得咬牙坚持下去。     操控方面比较轻盈，转向不是很称重，驾驶起来比较舒适，但不能说是完美，我只是觉得座椅调至最低，总有一种坐在坑里的感觉，不过不用担心，座椅往上调一调就好了，只是刚开始适应它，有些功能不熟悉而已。     至于油耗，可能是大家最关心的，我的油耗是10.5L/100KM，对于有些小轻狂的我，面对别人的挑衅可是毫不妥协，经常性的和别人斗车，我知道这样不好，可面对挑衅，我总是安奈不住，就因为这个，好几次都吓着媳妇了，以后得改了。对于这样开车的我，油耗算不算高呢？     这不，逮住休息的机会，带着大老婆和小老婆去采风拍照，就当是青春里的一抹美好记忆吧。,,
1a075a91d3ffae5f3099203c07882fcd_17,auto_home,大美博越，值得拥有,,
5a901756ea6a5cb2579b39c5b1b945b3_17,auto_home,偶尔用没什么事，长期用还是用30的，用40机油链条出问题的机率很高。,,
24aa86238d28afec8801f64365774f27_16,auto_home,我的也是到档打齿，很严重，你的解决了么,,
51b2368cadf41987286994b972f1709b_21,auto_home,车很漂亮，恭喜楼主！！！！,,
3ca182fa3ce6d1499a3aff51e60f129b,auto_home,      长途驾驶是一件非常累而且极其无聊的事。从工作所在地到老家江西，虽然不是很远，但是也要八九个小时，全程七百公里。但是拥有了博越，一路你不会觉得无聊，反而TA会给你带来驾驶的快感。这次有两个老乡搭顺风车。全车加上我一共四个人，三个成年和我小孩，总共大概520斤左右，加上我后备箱塞满了卫生间用水暖卫浴。总体太概在700--800斤左右。      知道为什么福建高速过路费贵吗？这个问题我曾经问过高速收费的收费员。因为福建的高速公路大部分是在山中开辟出来的。所以收费比中原地区的要贵。然而问题来了，既然是在山中开辟出来的，那免不了有上坡下岭。即使这样，博越也没让我失望。一般情况下还是用CEO模式，即使有小小的坡CEO也能搞定。如果坡度有点陡还用CE0模式，车身就有点抖动。这时马上就要换普通模式。换了普通模式以后，车子明显会串，没有一点抖动。相反的，速度越快而声音越小。      这次旅程，因为福建的天气晴天，室外大概在36度左右，全程必须开空调。晴天行车真的有一点担心和心疼，主要是担心轮胎，所以在行驶中经常会看看胎压和胎温。今天就向车友们展现一下福建高速一路的风景和博越的雄风及一小点门道。（注意看图！！      因为高速行驶，安全起见，所以不用手机拍照。这些高速上的风景照全部是由行车记录仪所拍。 不知道是老乡们太困了，还是博越太舒服，没开出多远他们居然睡着了，剩下我和七岁的儿子。他只是一个比较话多的小孩，很喜欢问七问八。高速行驶，我又要专心开车，所以好多问题都无法答辩。这是我灵机一动，你和博越说话吧，他会为你解答。小屁孩的真行，真和博越聊得很欢！你好博越，首先放一首《理想》我听听。博越还真听话，时不时又要博越讲笑话和回答问题。真心不错，关鍵博越还不会累，只见我儿子一边吃着零食，一边和博越聊的甚欢，所以拥有博越即使你一个人驾驶你不会孤单。      今天室外温度是36度，一直很担心轮胎，我一直都不敢放松对轮温的监测。胎温一直保持在49度以下。在这阳光下，人和烤肉之间的距离只差一把孜然，出去走一遭都感觉要熟了。这是不担心人，我只担心博越也会“中暑”，爆胎就是的常见症状之一，据说这种温度发生爆胎几率是其他季节的3倍！ 后来才知道我担心胎温过高是白操心的，其实小车在高速上行驶如果不是经常踩刹车，没必要去给刹车盘浇水降温，浇冷水后爆炸可能很小，但会加速车胎老化埋下安全隐患。 虽然胎温过高确实会不安全，但如果轮胎动不动就会因为温度过高而爆炸，难道那些轮胎工程师都是混吃的吗？这时只要把车停下来休息一下，自然降温就行了。 说来真邪门，一进入江西地界，就阴天伴小雨 看到靠背上那个ALRBAG商标吗？ 那可不是普通的商标。凡事有这个商标的地方，那里都有安全气囊。所以车友们看见有这两个标的地方千万不能用全包的坐套！      以上就是我这次回老家的心得。千言万语不及驾驶博越的快感！      走过路过的车友们，抬起你的金指，请留下脚印，全程空调和载重七百多斤行驶，朋支们，这种情况你们的油耗是多少？欢迎留言！感谢！！！,,
62c81db1b9b505047967189dd93984e3_11,auto_home,提了自动才后悔呢,,
13ee29bb49ccd58dc7c3c0f4e3f7ee7e,auto_home,提车需求：原本名下就有一辆丽驰B01纯电动代步，老爸还有一辆D50，不能说家庭用车需求不大，但是两辆车续航远近互补。这样交替开一年也能省下一笔相对于这个小县城不菲的费用。准备结婚时我家楼上提了一辆GS4，我和老爸都看上了，恰好丈母娘发话要在彩礼钱上再添点钱给买辆车，所以就有了在大婚之日前两天匆忙的寻车之旅。 目标车辆：长城H6 传祺GS4 帝豪GS    当天大舅哥带着我和我媳妇匆匆忙忙，先去了长城4S店，只能说是长城不愁卖啊。H6庞大族谱中店里所有车型寥寥。再者的确超预算了，原本欣喜若狂奔着8.9W起价去了，结果大嘴巴那款只有12+而且无优惠。只能说H6的族谱太庞大啊。后来在销售要求下小心翼翼的到大马路上溜达了一圈，连五档都没上去就掉头了。看着12.8的平均油耗，想着12+的售价，奈何再喜欢H6的空间，也只能无疾而终。其实原本老爸开着一辆老H6来着，忘了是2.0还是2.4的机头了，那种感觉即使是五档手动动力也是相当充沛，即使没有驾照也能轻松驾驭（考科三前开着去封闭路上加练了一把，当时下着雨自动开启的雨刷相当令我惊奇啊）只可惜油耗不小心就18个了。所以PASS！   第二站便是传祺GS4，进店直奔前台，要求试驾GS4。签完试驾协议销售便把我们交给了试驾专员，由试驾专员带我们路试。说起路试那叫一个惊心动魄，之前只在汽车之家看过的测试自己也着实体验了一把--百公里加速、百公里刹车、绕桩、六十迈180度调头、爬马路牙子（是不是很接地气）、怠速音噪（高大上了说就是NVH）。逐一体验完之后，试驾专员把车交到我手上，自己也进行了正常行驶和百公里加减速.当即拍板，买买买·····   回到店里便和销售开始了价格拉锯战最终以整价拿下了1.3T手动精英，送了导航，脚垫，后备箱垫，贴膜，脚踏，方向盘套，洗车拖把。当然没有邻居在车展上买车的优惠多，但是也经过了一番苦战啊，当时整整谈了三个小时销售都不耐烦了，最后谈崩以去吉利为借口出来去了传祺另一家4S店，找了个熟人讲妥又回去提的车。刷卡提车走人一气呵成，连提车照都没拍（还一天就结婚事情太多，实在是着急啊）    第三站，谁关心呢、、、、  开个玩笑，吉利也是一个比较令人骄傲的品牌，3.0时代的产品都有关注，奈何就是喜欢GS4。      就在昨天，媳妇的表姐打电话来，说厂子里给做了套脚垫。美美的装上果然是不同凡响。只不过拍照时天黑了，照片效果有点渣。 插了这么张图片，还是说说为什么选择1.3T精英版把 当时硬性要求是必须有ESP，安全第一 然后电动后视镜调节 再者定速巡航 最后导航大屏倒车影像 原本看着兜里的钱钱想先买个只要有ESP的，然后自己慢慢加装。结果看了配置单点名精英版后，销售居然送了导航，哈哈。总之性价比还是很高的 接下来再放送几张十月一期间一家人开着GS4自驾游的照片想想我也是心大，当时还没出2000呢，到了盘山轻松离合然后加油明显感觉到发动机使不上力，好在到达驻点休息后也掌握了方法，起步两千五百转走起，满油满载爬山不含糊。当然也要和各位说一下，现在出AT了，买车就买个自动挡的吧。 接下来就是认证了，本人常年潜水，小白一个。要是认证还缺啥，还请各位提醒。（其实还很希望能被版主提个精啥的）,,
eb804c4a894cb469dd2f9a8705bd1d50_13,auto_home,博越换变速箱才有出路，2.0出这么多问题，1.8T的低档也顿挫得和人家双离合一个样。,,
160827a1013ce200616a74afe295df72_64,auto_home,听君一席话心情豁然开朗、是呀，谁的车不掉价，谁的车会开一辈子。往好的方面想这是唯一的安慰方式！在开开就换了，也没有必要过于纠结了。,,
b74346662b87ed2164a289fb7a017f80_318,auto_home,是的，但是很多功能我还没研究透，越来越喜欢，越来越佩服一汽,,
7c6cd54a184a08f34737b4a0db06941e_23,auto_home,恭喜美女，长得非常漂亮，祝用车永远安全顺心,,
760137e93450c242e879d063e7c79ff4_10,auto_home,这个价位买这样的车已经很不错了,,
1c16adefa50bcf4e701be364330164fe_2,auto_home,好车，值得拥有。欢迎常到我这里留下你的脚印,,
110df4967afb7c9728c7e7d386838f33_22,auto_home,空间很宽敞，一点也不挤啊,,
949621fb67498e04555ecce323d49750_20,auto_home,1.5动力足够。起步慢是变速箱问题。手动应该最超值。,,
23315a6b9f18abda73439323e348c6da_12,auto_home,实车挺漂亮的！,,
79bcca080baccd0199c0dd8926cf65ef_4,auto_home,最后一句说错了，出现，毛病只能换凸机。修不好~,,
4df256cf43cd2ffb71bbfc83f39e9620_11,auto_home,双离合很差吗？怎么别人没你说的那么夸张,,
7150e09513b7a5086d3b6b6012802733_9,auto_home,是三缸的嘛？表显油耗多少？,,
5d6fd64f251bd1d3546d5c37708f6516_12,auto_home,这绝对是一个昏招！这是完全想搞死荣威360的节奏！ 荣威i6应该增配，而不是出新车型！ 上汽的这个营销老总完全是个木马！好车都让这个老总整死了！ 可惜了上汽的好车！,,
42faa1b815ff99b011d2a96a5ec0c693_128,auto_home,就欣赏顶配的轮毂帅气,,
1a0a92b3ab18db7d39f687a509bcbb81_17,auto_home,一直期待着南京的MG6车友动起来,,
7f69d9f6c1a6a2e853ea45e6047dda05_65,auto_home,银色真漂亮啊！,,
3e340a115c6d510882a0e1d0030d93d4_365,auto_home,这车真的性价比很高,,
2cd09d81e4ff7407420ccde21ce49447,auto_home,不知道i6的底盘怎么样？经得起折腾不,,
67b320b151ddb50e66caa9036de3413f_12,auto_home,钛金灰不错！回踩我的帖啊,,
33f2fc9e45936a76de7eb0b77debcee7_23,auto_home,我这边是二级经销商，，他们这边的售后确实是没有定位器，，如果你那里确实是死儿子没有定位器那就说不过去了，强硬一点叫他给你钱去最做，没有定位器的四儿子算什么四儿子,,
ae31457cfc243413eee3628c24fb7190_4,auto_home,不要跟上汽联系 ，直接先打国家质检电话，然后汽车投诉网投诉。然后搬出一堆车友链条拉长的证据。等着上汽联系你把。当地媒体在联系联系。上汽也怕的,,
66577185dc1b5f76744f9e6dd2e8a262_127,auto_home,这个车挺不错的，喜欢棕色内饰，大爱,,
20979,auto_home,默念4驱低配定速巡航后座出风口自动驻车一百遍啊一百遍！,,
26ab955f4d7e16514bd4b9a7f698f8dc_121,auto_home,不错，不过日行灯太靠中间了吧。,,
3a6e024fa73449ee6bc42861ed2fe1b9_19,auto_home,没有。这车换发动机不是傻吗……,,
667174aac2318f0d86c44352ef27f52d_6,auto_home,我的也有这种情况，如果内漏了进入发动机内，机油应该是有乳化白色的出现，但我的没有这种现象，现时初步仨计是副水箱密封不严，造成蒸发所致！,,
