source_id,content_source,content,auto_related,sentiment_label
14357aff2c017a2c225023a41201965b,auto_home,"    年期盼今年自己终于拥有辆性能优越越野车辆白色荣威W5伴随白5到来那在山间草原去撒野渴望冲动无以言表考虑到女儿放弃穿越西藏计划选择海拔算太甘南川北带lp女儿在黄河边煮杯咖啡这个也我年愿望同时让我宝贝女儿去适应原为以后西藏穿越做做准备吧    目确定以后就老婆开始忙做起功课来计划初期踊跃报名参加挺有同事也有朋友还有在连弟弟弟媳妇但最终成行只有弟媳妇个人路书也几易其稿在临行前个星期确定来但接来准备工作我们怎么也提起兴致月初以来成都直就暴雨断此行必经都汶速成绵广速相续遭遇洪水泥石流而临时中断种祥感觉笼罩于心后来在安全返回抵达成都时我舒口气感谢帝眷顾在各种自然灾害缝隙中给我们留条道路让我们以平安出行出行计划能能实施当时心里实在没底到出行前两天成都再次拉响暴雨蓝色预警出行前天虽然解除蓝色预警都还敢确认出行时间到出行当天早通过各种途径汇总信息明确整个降雨区域向南移动川北部将出现难暂云雨天气当机立断按计划行事打点行装赶紧路后来发现准备工作确实够细致带东西堆满W5后货箱,但旅行必备物品尽然忘带  D1成都至汉中 冒零星雨中午从单位赶回家草草对付完午饭我lp开始打点行装换洗衣物洗漱用品各种零食琳琅满目应有具有当然还有我那套相机堆满后货箱 出发从羊西线到绕城成绵广速出成都时淅淅沥沥雨才停来刚过广汉便看堵车车辆依次排行通过鸭子河桥洪水已将鸭子河桥冲毁段舟桥部队临时搭建个便桥保证型车辆通行约分钟以后交通正常路直奔广元又临时修改行程决定赶到汉中扎寨经过剑门关时候天空放晴便在lp面前对自己正确判断沾沾自喜番      路无景色说说我白5吧这他第次速还在磨合期中断提醒自己要慢可车载电子狗还停提示我超速因为在速路对白5唯需要注意就在你毫无感觉情况车速慢慢由120迈到140迈在140迈发动机转速到3000车内可以从容欣赏CD当然会影响家伙安然入睡这里顺便赞电子狗固定测速无漏网路个移动测速也被准确侦测到只由于周围电子狗相互影响常常谎报军情 再说说汉中06年lp送辆普瑞达到山东也在汉中停晚当时坐出租车在城里转圈去吃有名张胡子凉皮时隔几年再次来到这座古城变化之难以想象老婆感慨番中国这几年建设真卓有成效   经过鸭子河桥时车辆依次通过应急车道也被堵严严实实    家伙坐车最消遣就睡觉        雨后汉中     汉中到宝鸡道路有两种选择经西安走速路程时间快另种经太白翻秦岭路程耗时我选择后面道路原因简单就想让白5到秦岭去撒撒欢看看秦岭风景lp在给女儿编儿歌里说过你拍我拍爸爸带妞妞去爬山回想当年翻秦岭开普瑞达这回换成威风面白5可谓鸟枪换炮心中自然底气足    将lp女儿留在如家吃营养早餐自己出去品尝久违凉皮蔬菜豆花9点才路在限速60国道行驶个时逐渐进入到秦岭山区车流量也开始没有刚出城时那么密集在电子狗协助白5也慢慢进入状态弯车秦岭山区道路主要特点每个超车时机都显急促而宝贵白5表现没有让人失望平顺而有力提速出色ESP控制还有车内静音效果堪称优秀此时感觉到靠自动挡减档完全没有使用手动挡那么操控自如自然会放过在城市道路难用手动档功能起初最让人担心W5配备1.8T发动机动力爆发力问题在这段山路到肯定结论白5在秦岭山区驰骋没有遇到对手路见车超车无败绩用W5广告片句广告词来描述还非常恰当这款让驾驶者获轿车般舒适感受跨领域专业SUV当然路没有遇路虎悍马等重量级选手超越最级别辆知排量霸道（自己偷笑） 威风面白5. 秦岭风光       车过太白县 顺便秀电子狗征服者行车记录仪加电子眼侦测可以侦测移动电子眼还对付那些碰瓷者有力武器改天拍拍外形挺看 经过4个时跋涉中午到达宝鸡宝鸡个交通枢纽虽曾次经过从未入城游此番虽仍经过歹也穿城而过告诉女儿此处人称宝鸡却勾起家伙对鸡食欲此时正午餐时间家伙饿途中百度宝鸡美食最后决定品尝名鼎鼎凤鸣春羊肉泡馍这家羊肉泡馍应该算正宗网评价挺价格适中生意也红火当人举家光顾家老围坐在桌旁边聊边细细掰馍休闲在路途中我们自然会这般闲散饭店提供机器切馍正中怀省时省心碗汤浓肉香泡馍肚女儿抹抹嘴角油水赞道吃哟只知道机器切馍还能能算正宗羊肉泡馍饭后立马启程奔赴麦积山 此处所售羊肉分档次自然要点最级反正家伙觉吃碗肚餐后甜点又来个冰淇淋      出宝鸡再次回到速公路连霍速依然车水马龙热闹次走东段所同西段在群山峻岭中穿越道路在各种桥梁隧道中崎岖延伸所有隧道均限速60令电子狗狂吠止这里提句原本给力W5自动头灯因为我换成氙气灯搞给力冲进隧道自动头灯启动但氙气灯要等段时间才能亮起来还要摸黑前行截才有灯光只直开灯前行有想改装氙气灯朋友要考虑清楚     赶到麦积山已4点景区已经停止售票   在景区门口连续问两家农家乐均已客满立马紧张起来问到第家仅剩间房间且价格便宜慌择路我立马拍板定此行住宿条件最差房间第天lp抱怨几乎宿未眠后悔死过这家老板还算厚道晚餐点个菜核桃花炒肉土鸡蛋炒木耳还有个什么忘老板端我lp顿时傻眼西北人豪爽确实让我们在川生活人无法想象要知道这些菜足足够我们吃几顿晚饭过后家口散步到景区门广场深蓝色天空飘鲜红晚霞映衬出麦积山美丽轮廓山区空气甚至可以嗅出丝丝甜意女儿在路早已养足精神我玩起她降落伞山谷里回荡她开心极笑声       后悔当时竟将我无敌兔扔在车睡觉 再走连霍速路 进入甘肃 早早关门麦积山景区 精力旺盛家伙 手机拍摄麦积山晚霞 农家条件并影响家伙心情 路劳顿白5懒懒晒太阳        麦积山石窟莫窟石窟山西龙岗石窟河南龙门石窟为中国石窟该石窟现保存有北魏西魏北周以及隋唐代宋元明清等各窟两百个最早石窟距今已有两千年历史位于甘肃天水市秦岭山脉西端座奇峰 山百余米这里山形奇特孤峰崛起 犹如麦垛人们便称之为麦积山山峰悬崖峭壁石窟就开凿在峭壁这麦积石窟最具特征之处      甘肃竟然拥有如此山清水秀方麦积山风景秀美麦积山窟参观栈道错落有致别石窟看到另外石窟内有相当部分彩塑也有特点可惜许都有铁丝细网看太清楚但雕刻精美超出我们想象我lp自然会去过龙门石窟比较番龙门石位于中原带洛河之滨依山傍水气势略胜筹麦积山则在险峻精美均有自己显著特征      早餐后早早来到景区70元门票还算可以接受观光车将我们送到山脚仰望麦积山陡壁栈道有些想打退堂鼓自幼据有些恐我担心女儿要在此处撒娇愿走路该咋办给lp建议我女儿去她自己轻装阵Lp犹豫坚持家人起后来知当时舍浪费门票钱真让我知该说啥但事实证明lp英明路因为没有吃到冰淇凌发脾气女儿听说要爬石窟立马精神抖擞路几乎没有要我们抱坚持走完要知道落差足有百米层楼房度家伙自幼有佛缘岁就舅舅起拜菩萨,这路每个石窟都隔铁丝网细细观看问这问那 家伙从就对各种寺庙有浓厚兴趣 精美石刻可惜绝数佛像都被放在铁丝网里看清楚过保护文物理解      游完麦积后继续赶路此时弟妹已经在连登机正在飞往兰州路从天水连霍速后继续西行秦岭山脉山峻岭渐渐平缓起来逐渐有些塞外风光道路也逐渐放直此行计划到兰州首保之前在这段速公路要拉拉车据说在车辆磨合里程快到时在各个档位让发动机保持5000转并保持几分钟让发动机内部磨合出来杂质流到机油中对车辆有定处（知否真如此需要求证）档位用手动档转到4500转舍就加档关键在6挡确实怎么也去找到车路直路段开始加速车辆速度久就提到160公里看看仪表盘发动机转速才3500转加到4500转岂在时速要200以考虑到家人安全几次冲到160后就放弃加速值提W5在160时速表现非常让人满意车辆稳定性依旧丝毫没有发飘感觉噪音完全可以接受几乎只风噪声听到发动机声音      到达兰州时间约午点速公路在黄河以北沿狭兰州行进久后到达出口转向南经过黄河桥进入兰州市区GPS将我们带到定汉廷酒店匆忙放lp孩子要在班前赶到荣威4S店此时白5行驶总里程4000按计划首保荣威4S店服务态度热情等就说在荣威4S店等候时兰州哥们儿刚刚办完接车手续本想前祝贺番想荣威4S店竟为他燃放起爆竹成都荣申披红戴绿相比还要隆重首保后白5此时就像名待命出征斗士去应对各种挑战 首保后白5就名战将 同白5这辆车交车仪式比我要隆重       回到宾馆弟妹见面后无需寒暄直接按lp计划直奔正宁街品尝兰州吃走到正宁街路口已人头涌动热闹也许功课做到家在熙熙攘攘人流中我们有些知道该吃些什么家挂《舌尖中国》字样摊位前竟然排起几米队我等非有闲心之人吃也罢胡乱点些吃尝尝味道平心而论兰州吃自然无法成都吃相提并论加就餐环境吵吵闹闹遍垃圾还有些失望看见邻桌哥们喝桶装黄河鲜啤酒我等商量去买桶回宾馆为此行剪彩可这玩意超市居然没有卖只换成两瓶般黄河啤买些吃回宾馆去路见卖黄河蜜元斤买个路无暇顾及在花湖边野餐时切开品尝真又香又甜后悔没有买几个 同坐张桌子兰州本人家老人各种吃摆桌子我对中间那个羊头感兴趣偷拍来留作纪念 醸皮想到西北人也如此辣受还烤肉串吃羊肉那叫个香 看见脉动吗 解辣专用为美味有时候需要忍耐 为接来行程干杯     早醒来懒散在汉庭酒店里喝茶等lp给女儿梳理头发弟妹急促跑到房间问我们感觉到震吗没有哇我老婆异口同声宾馆客人纷纷走出房间略有惊慌失措以本人经历512420练就臀测功夫嬉笑预测震级在3到4级之间旁翻手机lp突然表情严肃起来甘肃定西6.6级天又场灾难降临昨天从天水出发第站就定西县我们再次灾难插肩而过后来朋友门纷纷电话微信关心我们安全单位领导也第时间打来电话令我感动已在此谢过查看图震区我们行径方向要定距离决定计划依旧调整情绪继续旅程       按计划步马子禄牛肉拉面沿在维修河滨南路路西行经过中山桥黄河母亲雕像发现车辆根本无法就停靠我等顿时连车拍张到此游照片欲望也没有加早餐还在马子禄那里召唤我们当即决定取消这些景点直奔牛肉面而去马子禄牛肉面馆生意错也有本人光顾据说吃马子禄定要早去为就那锅熬宿浓汤正宗兰州拉面端桌家心情平静lp问我为什么震老跟我跑愣方才明白川震说去年在云南赶昭通震这回震有我到甘肃只苦苦笑笑震还影响到家兴致商量在白塔寺看看兰州全貌枉到此回然后提前向甘南进发 牛肉具备只欠拉面 这就享誉世界兰州拉面      白塔寺当时烈日炎炎但却有凉风阵阵那感觉在闷热成都感受到站在石栏边兰州市貌尽收眼底母亲河在这座美丽城市前面缓缓画道美丽弧线就像妈妈温软臂弯呵护这座城市人们默默祝福灾区人们有伟母亲河保佑切平安 兰州全貌 白塔寺白塔并非传说中白色 著名黄河铁桥——中山桥路过时拍张照没有办法停车      匆匆游完白塔寺结束兰州行程路向南向夏河进发离开兰州市区以后座座形态各异***寺在车窗外划过我们来到***世界男人们头戴白帽女人们紧裹面纱切都那么神秘忽然吃我声宣布我们去吃顿真正***手抓羊肉引来车内片雀跃车过东川回族县***感觉极强立马停车驻足准备开饭车后感觉怪怪马路饭馆关门闭户打听方知道赶***教斋月人家在这个月以内只吃素街边个卖饼铺花元钱买个饼准备充饥时用继续前行到个村庄饭店还在营业问有肉有饭有面片歹可以吃顿饱饭最难忘45元份火爆羔羊肉端来肉却砣砣毫无爆炒迹象问过老板这个确实爆炒出来将信将疑放在口中咀嚼满口立刻充满鲜美羊肉味道口感细嫩极在此穷乡僻壤之处竟然可以吃到如此美味但名女子对此反应平平受原生态羊肉膻味 也许黄土原最西端吧让人总能感觉到黄土原气息 花4元钱买***饼成我们几天主食      车过临夏就看到熟悉藏寨便知道离拉卜楞寺在尹集镇告别国道转入S202省道沿途风光特点发生明显转变原本那路略显荒凉黄土原景色知觉转换成山清水秀原景色省道道路状况极佳窗外景色宜人道路平整笔直驾驶车辆如同仙境般 山清水秀甘南风貌 尽心尽责副摄影 家伙对蒲公英始终情有独钟     在离夏河县还有几公里方忽然道路边村民在溪边聚会引起我们兴趣靠边停车向个藏族老哥打听这位老哥真坦诚红脸用蹩脚普通话说我们藏族人嘛就迷信嘛请来个活佛给摸顶嘛天这个可谁都能赶拿相机冲进人群中这个可我最喜欢题材Lp买来根哈达敬献活佛活佛依次给我们摸顶祝福喇嘛专门给家伙拿来彩线保佑平安成摸顶后信徒们围在堆篝火前场祭祀活动将气氛推向潮随篝火燃起祭品哈达各类食物还有些专门树枝被抛向烈火随海螺发号吹出节奏信徒们声诵经忽然间又齐声呐喊放飞各色风马虽然我听懂但我能真切感受到在他们眼中已经看到明天丰收富裕 活佛摸顶祝福平安 抛撒弄打翻译成汉语就放飞希望       告别活佛他信徒们我们继续前行此时道路已洒满金子般色彩夕阳道路两旁河流山峦庄稼野草都侵润在这艳丽色彩中就在这如诗如画般风景中我们来到个拉卜楞寺面环山拉卜楞寺在夕阳映衬正如传说中描述般像聚宝盆样发出阵阵耀眼金光屋顶金龙蟠绕墙旁银狮雄踞这里藏传佛教等学府这里僧人信徒们天堂 宝马宾馆名字俗气却家藏味足网络名店  ",,
406e54cd2b218b92c49cf866f85180ca_80,auto_home,我的是1.8L，高速省油，现在油耗8.8,,
7de53423085ecce57b8235c2f36dbbcc,auto_home,从哪说起呢，自从成为荣威i6的主人，生活确实变得精彩许多，有车者事竞成。 平时我们也都蛮喜欢出去旅游的，有了车之后会更日常许多，虽然是轿车，但各方面自认为都蛮不错的，舒适度高。 车子作为我们一家人的主要出行方式，外观倒是次要，实用性才是硬道理。不过i6也刚好满足需求了，空间够大，一家人够坐了，配置也够丰富，还能人车对话，斑马系统挺强大的。虽然说是20t的，但是家用足矣了，过了一档二档之后，动力强劲，只要舍得给油，不比我朋友2.0思铂睿自吸加速能力差。不管是在市区还是高速，动力输出还是非常不错的，另外双离合变速箱在这款车上表现也很称职，换挡比较平顺，同时带来了一个比较不错的油耗。 经常出去玩，所以很重视车的舒适度。i6的座椅包裹还行，柔软度刚好，在对一些人体支撑上面做的蛮不错的。加上空间又大，老婆平时就喜欢坐在后排，高兴起来就直接在后面躺着睡着了。不过就是感觉这车的悬挂硬，不知道你们有没有这方面的感受，也问了身边的一些朋友，都说悬挂硬操控好，所以凡事都是有利有弊的。 最近的一次出游还是端午，我们一起去了。第一次开车过来，但是不怕迷路，i6拥有实时导航，很精准，路痴也不用迷茫。就是至今还没在高速上尝试一次定速巡航，有点可惜，下次一定要试试。i6的高速表现还是可以的，就说噪音方面，风噪和胎噪都控制的很好，表示满意。 路上来一张！ 溪口镇为蒋介石的出生地及蒋氏父子的故里，溪口风景名胜区为首批国家5A级旅游区，位于宁波市西南二十公里，东靠武岭，南濒剡溪，北临雪窦山，水绕山环，景色秀丽。 溪口本身很小，但现在作为旅行地，开发的还不错。尤其是在溪两边，散散步感觉还挺好的，尤其是夏天。 第一天蒋氏故里，景点都在一条路上，半天走马观花，既轻松又愉快；第二天大早雪窦山、雪窦寺，游客很多，随着人流，从三隐潭开始，自上而下，一步一景，目不暇接，累并快乐着 爬山还是比较累的，即使有索道跟小火车，还是要走很多路，杜鹃谷景色特别漂亮～ 雪窦寺中金色的弥勒佛看上去很震撼 回去也来一张，以后会经常到论坛逛逛的，还请支持！,,
45f9bf13a8b3e98463b6e161c85c0290_17,auto_home,黑色高大上，漂亮,,
7194b6bdbecfa5c75c1d099fc7326e40_62,auto_home,你的车挺棒的，就是好看。,,
73ebb90631db086dc470afb3d1ee0c95_42,auto_home,跟楼主同病相怜。 我的刚提车前几天能用，但只是监控，后来想用远程控制，就让车机输入安保密码，输完后就不能用了。 把楼主的遭遇都跟厂家说了，就是不给再激活。400让去四儿子店，有点远，还没时间。,,
8060c4d8fee8d82bee7cfa6b2e2f2260_38,auto_home,不必等价位的其他车差，。,,
1575cf789e76ff44cb288bc40a008190_83,auto_home,很漂亮，很拉轰，很喜欢你的档把。很个性的说。。,,
8523,auto_home,嗯，再研究研究荣威确实漂亮。,,
51ade5d7561de43dd36ded819e86424b_243,auto_home,恭喜楼主提车，写的真详细，哈六真好看。,,
d9049df57161b25f0326c4bcfda38450_54,auto_home,名爵ZS腿部空间大怎么这么火。,,
26284,auto_home,本人也定了，白色的，更喜欢一些索尔蓝，但是没实车不敢定，白色和红色选白色，白色车大众化，比较多，相对来说显大，好打理，小划痕不近看看不出来，我是修车的，如果有索尔蓝实车，可以看看，我是蛮喜欢的，看个人吧,,
5959ab201157d9e64fba30f755eb6340_5,auto_home,不是在修车就是在去修车的路上,,
23004,auto_home,终于看到大橙子了，恭喜楼主提车。关于车灯，我发现日行灯出了那两圈，确实内侧的灯也会亮，但打开一档（不是自动那个），反而那个内侧小灯会灭，两圈LED还亮着。,,
6df8dbe7e6ebfc367b3ed0353291eb2e_8,auto_home,艾7可以，艾5不了解,,
58f014ebc5374504149919ab784d33b9_281,auto_home,"引用: 原帖由 六月雪2185 于 2010-12-03 22:34 发表在 272 楼 我的动机提速时,有拖拉机.柴油机一样哒\哒\哒的声音,后视镜向下的失控了,才1200KM哦,郁闷啊!!!!!!1 不是吧，后视镜的去SSSS调下看看 ?",,
40c3e7bac536abc246852b4c9722cbaf,auto_home,本人购买的是i6至尊版赤焰红，端午节提的车，在使用过程中发现停车起步和倒车起步时候松刹车有咔嚓咔嚓声，还有上坡变速箱换挡声音明显。,,
146b1d01707041cc64c4fe07c50b5a26_5,auto_home,只有我觉得灯很丑的吗？能不能造个大众都能接受的造型 别搞自己的小个性,,
301cd1012fd2d56556c91407136c484b_5,auto_home,9~13个是真实油耗,,
751cd49c0ee2a8005c16c7ae1fdb8d23_24,auto_home,本来还挺好看的，想说360也能改的那么好看，到最后那4个角……真的好像什么女郎,,
2c960d449ebd91cbc19c0bc4542c0207_15,auto_home,倒挡挂入停下车肯定离合是踩到底的，然后松离合车子抖动再踩下还是回不来，很紧，又不敢使劲，,,
48faea541ffd619468b872473ea626b9_116,auto_home,可是这是双离合，我怕用了几年出问题，虽然现在平顺稳定,,
146fa791a4a3ae96a0d06b33b31141f6_80,auto_home,4好好爱惜博越吧,,
47dc1caa0b4d0d43a8898d9f4b7b3393_25,auto_home,异响，太响了……不换不行啊,,
5bdfb9b2459aaff5fdd4aae3537fd636_97,auto_home,荣威这车，质量不行,,
5bdeb5be5b033490047ae64307d6e784,auto_home,我买的是荣威360手动豪华版，对比过大众的宝来和朗逸最终选定了360，和大家分享一下我的个人观点吧！希望大家像我一样尽快买到相对满意的车。【最满意的一点】车的外观不错，真心的，侧身的线条直到尾部，整个裙线拉的很高，车的尾部设计的很锋利，感觉不错【空间】空间宽敞，其实这款车作为家用是再好不过的了，前后排的距离很大，坐在后座的乘客腿部空间和顶部空间都很宽敞，不过中间的地方比较突出，所以坐在中间的乘客不是很舒适，小孩坐会比较好一点【动力】车的动力是1.5的自然吸气，对于我这样没有多大追求的人来说是够用了，满载的时候会动力不足，不过好在正常都是一个人开车上下班，就算是满载，为了安全起见，也不会很强求速度【操控】电动助力的方向盘很轻便，指向性也算精准，坐在车里也没有什么阻挡视线的，所以整体的感觉很好【油耗】油耗，估计是因为新车的缘故吧，油耗一直都在5-6之间，不过我相信在以后的日子油耗会低的【舒适性】对这款车所定义的舒适就是宽敞，轻松的氛围，不过唯一的缺点就是新车有点新的味道，闻着的感觉不是很好【外观】外观喜欢啊，最喜欢的就是外观，家里人喜欢的也是外观，尤其是前脸和尾部【内饰】内饰整个很干净，清爽，座椅的包裹也很到位，做工什么的都没有好挑的地方，不足之处就是味道和用料，味道在日后的日子里还是可以散干净的，但是用料是只能这样了，不过我还是可以接受的，因为这个价位大抵上都是这样【性价比】性价比还算挺好的，看过大众的宝来和朗逸，可是裸车价的话要比360的要多一点，而配置方面也都差不多的，所以说最后还是决定就买这款荣威360了，毕竟还是一款新出的车呢，应该还是不错的【其它描述】车的座椅是真皮的还带有中控大彩屏，这是我万万没有想到的，总觉得这个价位上是买不到真皮座椅的，没想到上汽这么的人性化，给上汽点赞，棒的【为什么最终选择这款车】首先，买车最重要的就是外观和空间，对于我家来说，我看中空间比较多一点，但是我老婆比较在意外观，所以又要实用，又要合老婆的心意是件不容易的事，在网上看来看去觉得空间大的外观又不合老婆的意，但是外观合意的空间又不大，最后还是有朋友推荐了一下这款荣威360.说是口碑和评论、价格、油耗等等方面还不错，然后我就在网上看了看这款车，没想到还真是这样的，各方面还不错，就预约到实体店看看试驾一下，试驾完就决定就是它了，整个驾驶感觉很好，操控方面也是得心应手的，所以就在最快的时间里订了车，提了车，以后会好好爱护的，给大家看看我拍的照片，喜欢你没道理！,,
227cbe9a61d122e693790e986ed99842_30,auto_home,既然后期要加装这么多配置，而且加装的不一定比原厂好，还不如买的时候就直接高配置，也多不了多少钱吧，对于350，不推荐买乞丐版,,
3abde5968a3981e1764b9f36f4af377b_15,auto_home,大叔，你觉得我26岁在你看中的这几款里最适合那款？您是老司机给个建议呗？,,
49a30e01da0e65fb6898d6fa321d59cb_1,auto_home,这个吉利金装机油垃圾的要死，3000公里开始衰减，我4000公里左右就换了银美孚，性能比这个强好多，反正我是不会再用吉利的任何机油了。,,
75e287b9926e84c3271cf29983d0eaba_2,auto_home,我也不想要这个车了 我7月13才提的 很失望 一档没劲 烧油忒多,,
88633e0472d9e8dd6d568921c8d1ab30_19,auto_home,我们车机语音系统反应挺快挺灵敏的呀，你是自己刷的还是4S刷的,,
6830,auto_home,地下车库，没有信号，没发连接，我的RX5就是这样的。,,
2f56cc82f24541f25db5052bcb09dfce_11,auto_home,下雨天或者刚洗完车刹车盘和刹车钳因为潮湿生锈粘连而发出的异响,,
b9b27191d820129033c4a2435cea4880_28,auto_home,步骤也太细致了吧，爱车之人哦。,,
60b61631a68b2c371e53e3e4c545c18e_27,auto_home,话说出去玩还是SUV好吧，毕竟不可能一路平坦，还是越野性能好点的车适合自驾出去,,
27ce0d7e7b1c84698aa435ee7a0476f2,auto_home,也不知道是离合发出咕噜声还是离合踏板发出的声音，熄火踩离合没有声音，我这车是我自己调底离合，看论坛说液压离合调底不好我又调回原来的样子。,,
5137,auto_home,你因该在首保时候当着他们的面打上汽荣威400电话，就说4s首保送的油不匹配rx5投诉他们，估计立马给你换上。,,
3f46485d33238e243044fc2d3ca17515_13,auto_home,自动挡，四年8w一点问题都没有啊,,
15118,auto_home,妈蛋车管所放假只好五月二号提了,,
7c9c7289fa7bc55830570fa87a92f561_19,auto_home,好车，好智能。,,
