source_id,content_source,content,auto_related,sentiment_label
768074b3f781955e00e7476b53f60566,auto_home,    吉利帝豪GL--现在我就要带你回家     本人90年的，算的上是第一批90后。话说这几年已经很久没有人说90后怎么怎么样了。现在的这个社会已经是00后的天下了。当时，很多人给90后的标签————个性，非主流等等吧。     也许我算不上一个标准的90后吧，因为我也是在80后的尾巴上诞生，基本上周围的朋友也都是80后尾巴的。所以我在没有一点标签上的意思。不过也被莫名的打上了90后的标签，正直昨天热播的极限挑战，也许这就是命吧。     以上一点点我小小的自我介绍，闲话不多说了。     看中GL，也许就真的像歌词一样的简单“因为我刚好遇见你，留下足迹才美丽”。     虽说我是一个90后，但是驾龄也有5年以上了，毕业出来就找了一份开面包车送货的工作，每天大街小巷的到处跑。尤其城内跑的居多，所以也经历过各种形形色色的事情，也算得上是一个称职的老司机了。在17年1月份左右的时候有了购车的打算，因为是我自己挣钱买的车，所以格外的慎重。而对于我这种屌丝来说“豪车虽好，但是价格太高哦”，以前也偶尔一直潜水关注汽车之家，那时候一直没有申请账号，是因为毕竟自己还不是有车一族，有时候在论坛里面到处看看，在汽车之家首页看看各个车的参数配置。经常看一些超跑的视频（虽然买不起，但是意淫一下还是可以的，梦想还是要有的，万一实现了呢）。其实我梦想中的车车是小牛，不过真的事梦想，也不敢过度的奢望。     对于人生中的第一辆车我还是比较看重的，也要根据我们的经济实力多比比，而且当时我看车的时候有是快过年的时候，所以我也不急着购车，因为我有朋友告诉我，过年是旺季，很多行业都不打折扣的。因为我也是做业务员送货的，所以也觉得这个话说的在理。不过不影响我看车。     幸好是坐业务员的工作，有一辆面包车代步，有时候送完货还早我就偷偷的开面包车去看车，我们这边4S店都集中在城郊，交通基本靠走，没有车实在不方便（不要让我老板看见了，不然知道我多用了他的油呢）。     其实我也对比了几个车型才选中你的： 第一个，捷达。因为从驾校出来，对于捷达的感触还是很深的，而且大众也是深入人心，但是大众说实话真的还是很不错的，那时候的教练车被我们这些学员一顿乱搞，开起来还是非常的舒服，不错。但是最后在对比中，才发现捷达虽然品质好，但是里面的内饰真的是太无奈了。所以就直接PASS掉了。 第二个，丰田的威驰。丰田的车也是非常的不错，口碑也是相当的好，唯一对他映像不怎么好的原因就是因为他是一个日系车。不过发动机的技术还是相当成熟的。不过威驰这款车。刹车太硬了，配置太低。PASS掉。 第三个，斯柯达的昕锐。其实也和捷达属于同一种类型。动力不如捷达，但是内饰又比捷达好了那么一点点。 最终选择帝豪GL的原因，就是看到的第一眼给我的眼缘就非常的不错，动感的外形。运动十足。然后动力也非常的强劲，有些朋友会问我为什么买个国产车。我会告诉他，因为我相信国产车，而且现在国产车的技术也非常的成熟了。从驾驶了一段时间GL之后。我对GL也是越发的了解。因为刚好遇见你，所以要一起留下一些足迹 现在GL开起来感觉非常的顺畅。各种感觉都非常的棒。给我了非常棒的驾驶体验。动力方面强劲，手动挡的还非常的省油。空间方面更加没的说。油耗方面有点点偏高。大概6毛左右。不过也是非常不错的。 接下来看图： 这就是我人生的第一辆车，我会将他一直保存下去，他陪伴我的，给我更多的也许会是一段段美好的回忆吧,,
785f05d1555888dd0698b06865efe52c_9,auto_home,双离合的都差不多，以前开过一次大众迈腾，一二档怎么点油门都会抖，不过这个真没什么好担心的。,,
8647,auto_home,本人90后，想买一款suv，选了很长时间最中决定买荣威rx5.本来问没有手动豪华的，后来销售陈姐给我打电话可以定了，第二天毫不犹豫的订了，等了半个多月，中于下来了，老铁们，看看图片，，，，车上坐5个人丝毫不觉得挤，坐着很舒服，而且前面视线非常好，发动机声音也不大，总体来说整车的感觉非常不错，适合年轻人，值得一提的就是这音质，老刺激了，声音放到最大都不变声，手动豪华版标配了esp这个真心值得赞，还有这车挺省油的，我有一个荣威rx5全国交流群，里面普遍说油耗挺低的，这也是我买车的一个原因，,,
f8611a35e89b82c872adf6bd589a5180_19,auto_home,给人的感觉就是比较简约，而且比较精干的,,
24511,auto_home,网络上关于发动机下沉的问题，普通人也知道发动机下沉无非是发动机悬挂承载出了问题，多么简单的问题，可以说没调查之前谁也说不清，况且只是单独个例不排除其他原因，你懂的。上汽集团在郑州开厂抢了郑州某些品牌的市场，为什么视频出现在河南的电视台？荣威i6上市才几天，这其中包括出厂，交车，意外，联系记者，拍摄，调查，一切的一切好像是安排好的。记者言语中根本显得太过于偏激不理性，作为当事人如果真遇到这种事情当然情绪波动很正常，不过好像记者更激动，一副只要998的台词太明显了。所以其中定有蹊跷，上汽作为河南省政府扶持的项目，享受了河南绿色通道可能惹人眼红了，就一句话太蹊跷了，比说书的都巧，我要信它就好比陨石砸头上，还是双份的。,,
184a8b020ee1479984c561b202cd3886_5,auto_home,温度高，第一次听说。如果故障是真的，吉利肯定会派厂家的技术员直接飞到用户车所在地上门解决。,,
14c7e01fa69a1d52270664f5bdd14a67_403,auto_home,后排地板中间几乎是平的，主副驾驶室很宽敞，不压抑，全车储物地方设计很人性化，空间利用的很好,,
5038,auto_home,今天过来做保养，晚了点了。在门口看见二个Rx5一白一黑，我看了看颜色还行，我的比较亮，其实我是过问问价格的，有优惠了，国产车还是性价比有点那个，买都买了，先开着吧。他们是二兄弟买一款车型，估计都看上这车。牌照选的还不错，随便拍了几张照片，黑车是看小一点。,,
13e0bb516cd090bc4e567db376e43a2e_30,auto_home,不错，不错，空间比较大，看起来内饰也高大上，dm很拉风呀，多少人的梦想呀,,
22dc806641c2acb842655cb7671150b3_11,auto_home,你的车有面包车那种噪音吗？我车噪音也大，像开面包车的,,
11df71c832ecff941789191391bdc1c0_68,auto_home,就还是比较喜欢这车的,,
18337,auto_home,这款吉利皮卡车头的造型比博越SUV更加激进，中网沿用了“回形”设计，引擎盖加入了条形进气口和散热格栅，增加涉水能力，皮实肉厚完全一个肌肉男。,,
45eb9e0c8bb487c5baf0678800239c57,auto_home,    博越车已经跟了我一年的光景了，陪我们家走过四季的更迭，岁月的变迁。一路走来有欢笑，有幸福。最初选择了手动挡的车，之前也说过了，我和先生出奇的喜欢手动挡，可能我们那时候学车的时候都是手动的习惯了吧，也可能我的第一辆车也是手动的吧。不过说实话，当初买车的时候，主要是考虑是我开，其实我也动摇过自动挡的念头，虽然有十几年的驾龄了，但上路的时候遇到红绿灯比较多的路况还是有些疲惫，但更多的时候是喜欢挂挡的那种操控感，感觉只有挂挡才感觉有加大马力的那种驰骋的感觉。     我本来就是一个喜欢旅行，喜欢到处走走停停的人，现在儿子也三岁了，正是长知识的时候，也总是带着他到处去认知这个奇妙的世界，所以“小越”也是我们天天生活中必不可少的，但很长一段时间还是纠结着手动挡，有时候还是有丝丝遗憾，前段时间就听朋友说手动挡加装个东西可以半自动了呵呵那时候听说叫“双离合”，因为本人是比较车盲的上学的时候也是文科专业，对这些机械的理科性的东西着实不太感冒最近跟一个汽车圈的朋友吃饭的时候，他也问我当初既然是自己开，为何要买个手挡车，我也只能呵呵了，他给我详细的推荐了自动离合器，也给我讲了其他车型的加装案例，我心动了，回来跟先生商量要不要也改装一下。不过说实话心里还是纠结的，怕现在我的车还没出质保期，而且这个东西咱不太懂啊，质量怎么样啊之类的，这事就这么搁下了，上次去马山，又咨询了一下车友会的比较懂车的博友，说可以加装的，但目前我们车友会还没有，唉，既然都说没事了，既然心里纠结了那么久了，跟先生商量一番，决定——加装自动离合器！（呵呵申明一下，我可不是什么自动离合器的托哈，只是自己刚刚加装了这个，感觉挺新鲜的，赶紧在之家上作业一篇）     附“小越病历”一份     姓名：小越     年龄：青年     科室：整形科     表现症状：需要增强“免疫力”     诊断方案：“隆鼻”——加装自动离合     过程：住院治疗     诊断结论：完美    话不多说，开启悬念，上图！    （我也不专业哈亲们，我要是哪里说的不对勿喷哈我只是按我的理解写的呵呵） 第一天： 第一天，看着拆的乱糟糟的小越，难免心里有些心疼虽然我不懂，但真心的不放心啊决定明天再来 第二天 自动离合器加装完毕我觉得小越只能用一个词形容——完美 这次好了，彻底解放了左脚，也可以像自动挡的车一样只有油门和刹车的更换，再也不用踩离合了嘻嘻，而且我还是可以体验挂挡时的操控感，真是完美的结合，总之很是满意呢，我想这就是真真正正的“手自一体”吧哈哈     后续的体验，会继续跟大家分享心得,,
648e135c4952845c7d468d99099e6fb1_90,auto_home,但是英朗后期维护费用有点受不了，配件、保养贵的不要不要,,
57936d90920e055e5133d73c897d7d42_16,auto_home,颜色是这款车的珍品,,
26431,auto_home,支持国产那是必须的，支持吉利,,
1513048ce958c6c5d6dd042646991d1d_3,auto_home,说明吉利品控不好,,
36c00587eb6fdb30c07e6c35de277ba9_10,auto_home,不错，操控非常棒,,
3036c5163eb6bd1fcafaf2407b527e55_1,auto_home,应该是冷车气门声音吧，热车声音就小很多,,
151397783a2d28fc3ac06d376f7c55fa_20,auto_home,斑马语音什么车型有的，还是都有,,
10682,auto_home,出租车都是手动挡，也没见人家怎么样了啊，私家车每天才跑多少啊！,,
2e9fa9e3754cf710da6ce8d852eff474_2,auto_home,我的是右后刹车异响,,
37d1560d63271dd21927094b4ebec5e1_8,auto_home,我觉得这车手动最不爽的就是1、2挡的操作，很难掌握平顺,,
2bd958cdccf46adc35e97407853c8461_710,auto_home,个人觉得底盘灯是个败笔，天使眼太多变得不伦不类。低矮的车身搭配前后叶子板鲨鱼腮超赞！但楼主稀饭就好！支持个性！,,
41228f9d05a101346291f5eab131ea98_10,auto_home,爱信的都可以买，还不是看调教，哈弗都是爱信的。地盘呢？发动机呢？,,
4778,auto_home,满意就好。荣威细节方面不够人性化。,,
799ba57461410da910a2d2b6886ab4b2_3,auto_home,还能坚持坚持，什么时候怠速也响最好提前换，我的就是，换了半年不到1万公里早上启动时又开始响了，再跑跑看。刚看到论坛置顶的维权贴，我是错过机会了,,
5a6863b94ecf2db68c5ca24293d8565c_139,auto_home,新车跑160，发动机会过早磨损，提前大修时间，而且油耗也会增加！,,
4342b2bcdd2ccbbc972faa6ef010d24d_9,auto_home,修好了！踏板油门坏了！清洗了节气门1000,,
6592,auto_home,顶你，我2013年买的老款750，感觉比当时同价位的君威，帕萨特，雅阁，凯美瑞强多了。尤其是用料方面。吉利比荣威差远了,,
19871,auto_home,我去4S店时，4S吉利推荐帝豪，GL也是摆在最里面，不知是为什么！,,
7f71a68ca17202e1d9cce1cedd601e7b,auto_home,"        男人总喜欢把自己的车子比喻成为自己的情人，平日里把车宝贝的不得了，谈起车来眉飞色舞、口若悬河，从外观到内饰、从配置到动力操控、从舒心娱乐到无忧安全，那都是如数家珍、侃侃道来。可女人则不同，就比如我吧，我就喜欢把车比喻成我的闺蜜，我们也确实是亲密无间，无话不谈，我们形影不离，一起上班、下班，一起出门旅行，去看那海边的日出日落、去深山深处去寻求心灵的宁静，我们相约共同面对这纷繁复杂、又有些无奈的大千世界。         我的现任闺蜜是一款2015年出产的比亚迪2.0T四驱旗舰型大白唐，说来惭愧，在与如今的大白唐结缘之前，我的前任闺蜜是一款于09年购买的白色09款1.8L自动尊贵版东风本田思域，这下你明白了我说惭愧的意思了吧？那个时候我对国产车有一种不信任感，毕竟大件物品的选择还是要谨慎从事的，当时只是觉得日系车、美系车、欧系车比国产车要强一些，所以当年我购买了日系车思域，咱抛开对日韩车国家层面的厌恶不说，我们单独从思域这款车本身来说，这是一款从各个层面看来都还算不错的运动型家用轿车。         我与我前任闺蜜思域朝夕相处了六年，达七万公里行程，在这里我要谈一谈对东风本田思域的用车感受，也算是对我们曾经的友谊有个交代。首先从女性驾驶者最感兴趣的车子外观来看思域：流线型造型很帅、从侧面看去很有阴柔的美感，尾部也很性感，操控台很现代范，这是我当年选择她的几个原因，女人选车总是感性在前，理性在后。 其次从男性最感兴趣的车子的动力性和操控性看思域：这是一款动力澎湃，平顺性不错，操控精准的运动型家用轿车。动力是随叫随到，在高速开个一百五六十迈那都是轻松自如，超车更是没的说，有男性朋友说思域在加速时有推背感，也就是加速很猛的意思，我对这个倒没有什么特别的感觉，也许我是女性驾驶者的缘故吧，我的感觉就是开起来很爽。日常行车灵活而精准的操控是思域值得称道的地方。在其次，思域作为运动款车型，内部使用空间和后备箱还是蛮大的，综合油耗中规中矩（日系车型总重量轻的缘故吧），保养比较省心，用料并不豪华，但是做工非常精细。最后，既然是总结性谈思域的用车感受，当然也要谈谈这款车的不足的一面，作为运动款车型的思域，底盘过低、减震太硬、噪音控制差，行车舒适性较差。配置不算丰富，隔音差，手刹配置不爽，特别是副驾驶的外门扣没有阻尼装置，很容易磕腿。你看不足之处还是蛮多的。对前任思域的使用感受就说到这吧，毕竟现任比前任更重要。         当初09年买思域时，我的用车任务是上下班代步，送孩子上下学，兼顾买菜使用，你们看我是不是特别有贤妻良母范？时光荏苒，随着时间的推移，到了2015年我的用车任务有了很大的变化，又增加了带父母看病、带父母及家人旅游等诸多任务了，于是我产生了换车的念头。2015年这个时候的中国制造业，无论从军舰、航母到飞机，从卫星到空间站，从汽车制造到高铁，无论是从大件家用电器还是到小件的家用产品，我们的制造业已经得到了长足的发展，无论是从质量上还是从价格上都比进口和合资产品不遑多让，有些甚至超越了进口及合资产品。同样，这些年中国制造的国产汽车无论从质量上还是从价格上都已经超越了合资车和部分进口车，这个时候的我对国产车已经是信心十足，我决定购买一辆国产车代替思域，来满足我一直以来的爱国主义情结，我记得很清楚，那是2015年的最后一天，12月31日，下班后的我正在收听天津交通广播电台的节目，广播内正在介绍比亚迪唐这款车的详细资料，我一下子就被吸引住了，于是决定去最近的比亚迪4S店去看一看这款传说中的唐，我是急性子，时隔两天的1月2日我就去店里与大白唐见了面，我们一见如故，相见恨晚，我几乎当时就决定了，我要把她带回家（交了五千的定金，当时卡里不够全款的钱，1月2日比12月31日要多付出3000元，因为补贴降了3000了，好倒霉），又是时隔两天的1月4日，我带着全款去了4S店把购买大白唐的手续办齐了（21.98万，一点不便宜啊！还花2980够买了装具套餐，这个比较上当），加上保险、上牌花了不到23万，经过一段时间的等待，我于1月20日把大白唐领回了家，顺利完成了我的换车计划。 第一次开着我的大白唐参加集体活动-蜜唐秦旅 我所购买的唐是比亚迪2015款2.0T四驱旗舰型白色SUV，这也是一款让我在各个方面都感觉到很满意的SUV，她也是我现在最好的闺蜜，不知不觉间，从把大白唐领回家到今天已经有将近一年半的时间了，居然已经有五万公里的里程了，你从中看出我们的感情了吧！ 唐是一款插电混技术的节能环保车型，假如说2.2吨的唐是一款燃油车，那她的一切优点都不复存在了，正因为她是一款可以充电的车子，充电一次八十公里的行程是她最大的亮点，一年下来即使你用油用电一样一半的话，你也能轻轻松松的省个一两万块油钱         女人谈车写车，着笔之处自然与男人不同，我就先从大白唐的外观说起，唐作为一款中型SUV，车身长而高，个头大，看上去颇有唐朝贵妇的范，过去对美女的评价有燕瘦环肥一说，唐朝杨玉环可不就是肥妞一个。我的唐看上去雍容华贵，落落大方，简直就是唐朝贵妇的缩影。前脸大气，线条设计也恰到好处，颇有肥妞有腰的的境界，时尚感也颇强，你以为唐朝妞就不时尚吗？要知道，当时唐朝的长安城可是当时世界上最时尚的都城。 放倒后排座的后部空间，可以供两个成年人休息，在车上休息的感觉和家里和宾馆都会不同，这个只有休息的两个人才能体会，特别是情侣。我在这就不多说了。         谈完了女人感兴趣的唐的颜值和空间，我们再来谈谈男人最看重的唐的动力性和操控性（我是女性车主，我所表达的仅代表我的个人观点，如果有说的不对的地方请各位男性车主多包涵，口下留情）。         唐是一款三擎四驱双模的中型SUV，百米加速4.9秒，不懂行的你也应该知道动力性如何了，什么超车、什么加速推背感，我就不说了，百万豪车不过如此，动力在随叫随到的同时，动力平顺性也很不错，堵车，低档位和高速时平顺性都还不错。唐的操控性精准，行车轨迹清晰，基本上指哪打哪，全时四驱，不管什么路况都行驶的游刃有余（极度恶劣路况除外，毕竟唐的定位是城市SUV,如果您不想豁车，就不要去越野）湿滑的雨天，泥泞的土路，结冰的道路等，对于有四种驾驶模式的唐来说毫无压力，据我所知，二十万的唐可是具有百万豪车的动力和操控性。         颜值、空间、动力、操控性都谈完了，那我们就再谈谈唐的驾驶舒适性和行驶安全性： 先说舒适性：唐的高科技配置简直逆天了，太多了，我在这里没法一一道来，就说一些主要的吧，PM2.5绿净系统在雾霾天会给你一个惊喜，电动座椅八向调节以及记忆功能都很实用，让你开起车来能找到最舒适的点。中控是达到12.1寸的数字液晶显示屏，大气，舒心娱乐系统也凭借中控大屏有着很好的表现，中控屏配上360度全景影像和前后倒车雷达让行车安全无忧。空调是分体前后都可控制的型号，制冷效果超级棒，至于什么大灯自动清洗、全景天窗、行车记录仪、四驱全地形驾驶模式、移动电站功能、遥控无人驾驶功能更是高大上，百万车的功能不过如此。胎压监测系统、LED日间行车灯、定速巡航系统、车载蓝牙电话、陡坡缓降、上坡辅助、伊顿差速锁、智能车身防盗系统等等，这些配置也是很好用的，还有很多很多高科技配置我就不在此一一赘述了，总之唐的配置是很全的，也不是普通车辆可以望其项背的。一下子说了这么多，你觉得唐的舒适性咋样？还有就是前后不凡的独立悬挂和米其林轮胎为2.2吨的唐带来的好感觉。 唐有着公路坦克的雅号，安全性能卓越，全套的安全配置以及不惜工本的安全车身，让唐车主们开起来放心安心。     我对我的闺蜜大白唐的用车感受总评，也许会让有些人质疑，他们会说:一辆车不会光有优点没有缺点吧？那我就来说说闺蜜的不足吧！ 唐的尾门是手动的不是电动的，这对于一个女性驾驶者来说比较困难（还好我个子高）中控系统不是安卓。360度全息影像虽好，但却不是高清版，作为纯电里程80公里续航里程，还是少，因为铁电池受温度影响大，如果能更换三元里电池就好了，虽然冬天有座椅加热但夏天却没有座椅通风，这些有的是可以以后加装的，我对唐有几点不满意的地方都进行了改装（这仅代表我个人看法）改装有风险，需谨慎，不要跟风。 由于经常自驾游，路况有时不好，我决定采用他们的改装方案对弹簧进行更换，换过弹簧后刹车的点头，提速的抬头，超车并线都有很大的改善，个人认为舒适度并没有降低，唐的定位是城市SUV，改装毕竟有风险，而每个人对于风险的承受能力不一样所以不建议跟风，选择自己认为需要的 更换了电容和中置，唐这车12伏电源和普通燃油车完全不一样，普通燃油车是发动机带着发电机给一个12伏蓄电池充电（启动电池）发电机发出来的电直接是直流电，12伏电瓶也是直流电，这个直流就是很纯正的直流。而唐没有12伏发电机，靠大电池往小电池充电，直流对直流这个东西叫DCDC转换器，在转换过程到12伏这个电会有很多的毛刺，同时直流动态特性不行，加电容可以改善电能质量，减少这些毛刺，提高音响动态特性，包括点火的火花塞，在点火的那一刹那的电压波动可以很有效的抑制，如果你对音响没有过高的要求就不用加装了。         我虽然很喜欢唐这款车，但我要告诉大家，如果你没有很好的充电条件，请你不要选择唐，因为那样唐不会发挥她的优势性能的。你如果有充电条件，那你就买唐，她不会让你失望的。写了这么多想必大家也看累了，放上这一年多我开着唐与天津王朝车友会的车友们一起旅游聚会的精彩照片。欣赏一下吧。 这些只是我与大白唐参加天津王朝车友会部分活动的照片。自从有了大白唐做闺蜜，又参加了天津王朝车友会唐分会，受大家台爱我被选为会长，这一年多基本周末就没有休息过，大都是跟车友会的车友们一起度过的，无论是去旅游还是搞爱心公益活动，我想用我们车友会车友们的行动告诉大家:我们是一群热爱生活、热心公益的大唐人，我只想让更多的比亚迪王朝车主参与到我们的车友会活动当中来，因为有你，活动会更精彩，因为你的爱可以让这个社会更美好，期待王朝车主们加入我们的大家庭，比亚迪唐改变了我们的生活。",,
5715cd61ad93b1f3b3188f317c7aab8f_52,auto_home,很不幸，你遇到了刚开始起步的吉利。如果你翻翻旧账，哪个企业创业初期产品有多好？就说丰田，当年的丰田，叫玻璃车，加油门要清，刹车要轻，半年新车就全身秀透，报废。大众就更垃圾，甲壳虫知道不？抄袭捷克太拖拉的。 当年，德国制造，日本制造，都是劣质产品代名词。还有现代汽车，70年代刚起步，要多烂有多烂。 你小孩生出来，不尿床？你知道他尿床，难道他长大也尿床？？ 你想一开始，吉利就是百年老店？那还轮得到你去上班？吉利要这样早就设置很高的门槛了。 你眼中20年前的吉利，早就过去了。外国人有些还认为现在的中国，还是留辫子的清朝。,,
ff14a64b769592e37e02a0b298200390_8,auto_home,4月30提的红标2.0智尚，油耗真的惊喜，差不多一公里一块了，动力杠杠的，对动力没要求的话，还是1.3吧,,
