content,content_source,source_id,auto_related,sentiment_label
我的自精，门开都不亮灯！至今没仔细整！锁车过程如果有人开门，会响两声，卡拉卡拉，最安全的方式就是锁了自己拉一下！自己小心吧！,auto_home,17548,1,-1
这样的车子，开出去也很是拉风的,auto_home,2d3baf863825acec46504ff778c9c739_68,1,1
国产车做的越来越让人放心了,auto_home,43a949fc08057665859ea988fde3bb6d_26,1,1
?????祝贺GS上市一周年！！！2016年初，我和媳妇就商量的应该买辆属于自己的车。因为媳妇有一个梦想，想走完全中国。由于没有车，就连周末出游都是很困难的，出个门坐公交车简直是想死啊；和别人借车更是不现实，人家节假日也是需要用车的嘛。 ?????所以买车就提上了我们的行程。然后就是预算了，我们两商量了下预算就订在10万块钱以内。然后媳妇就把选车的任务交给我了，唯一一个要求，颜值必须要高！ ?????由于只有10万块钱预算！就想着有些基本的配置必须要有，如：ESP?倒车影像?倒车雷达等；然后是空间必须要大（媳妇大长腿不能委屈了）以及最好是SUV。 ?????在论坛看了一圈，首先肯定是看合资车了，毕竟以以往的概念肯定是合资车好了。结果一圈下来...别说是SUV了?正常的三厢都难选，那配置简直是寒碜的受不了，最后选定了一个飞度。然后带媳妇去看，直接PASS。由于这两年国产的销售飞速增长，看配置也都够要求。所以决定转战国产车，一开始看中了江淮S3和宝俊560。既然选中了?那就带着媳妇奔4儿子那里。 ????先看了江淮S3，外观嘛只能说一般般，但在小型SUV中销量是数一数二，配置也都有，坐进去空间也还可以，就在暂定吧。一开始看了宝俊560结果发现没有手动档也就暂时没有考虑，谁知道出了一个智能手动档，号称全家都能开。那我们就多一个选择，媳妇就和我一起去看。外观嘛还是一般般，配置也是不错，就是空间，空间的确是吊炸天，空间简直的太大了。当我们差不多要决定是560的时候，一辆吉利GS试驾车从我眼前经过，瞬间将我们两个的眼光吸走。然后我马上上网一查，这不就是专门给我们辆而造的车嘛。想要的配置都有，颜值，SUV。不说了?赶紧去试驾吧。 ????一进去，在展厅有白色，金色。真是太漂亮了，还分了优雅和运动版，说老实话运动版的真心太配我们年轻人了。红色的卡钳，骚啊。二话没说试驾，一坐进去立马和之前的车比较，真不敢相信才10万块钱。然后去跑了一圈?动力还是不错，问了下媳妇空间也还是可以。然后下车就和媳妇商量，对于560！560只有空间一项有优势，其他完败，那还说什么订了。由于顶配是10万多点，再加上购置税和保险已经超过预算太多了。我们就顶了中配，当时订车是8月中旬，告诉我要2个月左右才能到，其实我是有计划的打算国庆开着自己的车出去求婚。等了差不多20天?实在等不住了，天天催销售，但销售也保证不了国庆节一定能提，只能保证两个月，如果是两个月的话都过了国庆节。然后我就改口了，算了只要是来车能提，颜色随意，配置随意，手动自动无所谓。 ????在9月10日那天给我来电话，说可以提了！不过是手动1.8优雅蓝色，问我要不要。果断要啊?，12号带着钱就直奔4儿子那里。由于是下班了才去提的车，自己都来不及检查就走了。那回家一路的熄火呀，那一个尴尬啊。 ????到目前已经行驶了快14000公里，我也从新手蜕变到了老司机。刚做完二保回来，一切都正常。这14000公里，骚蓝带这我们走了云南?广西?湖南?四川?重庆。见证了我从新手到老司机的进阶之路！哈哈,auto_home,1fc197abaaa0700e832cd0afa4263a94,1,1
今天给大家带来老婆当车模的第N+X季。 照旧还是先说一下GL吧，在这里，我先表明一下我自己的立场：选择GL，无悔的选择。 当初无意间的一个眼神，小金彻底把我吸引住，就像当初初次见到老婆一样，一见钟情的感觉，冥冥之中有一种声音在告诉你：她就是你的女神。 在这里还是先说一下小金让我自豪的地方： 1、小金的流线型非常好，车型外观非常漂亮，况且车身A+级尺寸，看起来非常大气，开出去非常有面子，外出谈业务、走亲戚……小金绝对不会给你丢脸。 2、配置非常高，在同级别里面绝对无敌的存在，我的是标配，就带有无钥匙进入+一键启动、天窗、真皮座椅、导航、倒车影像、倒车雷达等神器，而且帝豪GL还配有大灯自动开启功能，自动检测光线，大灯自动开启，设计非常人性化。而且全系还标配胎压监测系统，保障了我们的行车安全，特别是在炎热的夏天，省去了我们检测胎压的麻烦，非常给力的设计，在这里给吉利点赞。 3、安全系数非常高，选择一款心仪的爱车，在我的观点里，油耗是排在第二位的，第一因素是安全，我感觉没有安全，别的都是胡扯。帝豪GL的钣金做的非常好，非常厚实，最让我意外的就是当初帝豪GL直播魔鬼碰撞，新闻联播全球直播，我相信这是国家对国产最大的支持，也是最大的认可。而且帝豪GL得到了接近满分的成绩，安全系数非常高，这是我非常信赖小金的地方。 ~~~~~~~~~~~~~~~~~~~~~~~~~~~华丽的分割线~~~~~~~~~~~~~~~~~~~~~~~ 说完了车，还是说说老婆吧。那些年，我们行色匆匆，从彼此的青春里共同成长；那些年，我们情窦初开，你变成了我一切前进的动力！现在，你依旧是我梦想的终点，我依然是你风雨无阻的停靠！只不过，现在我多了一位好兄弟—小金，我们共同为你遮风挡雨！让你永远停留在无忧无虑的那些年里！她今天穿一身浅色背带裙，让我想起了以前的那个只会傻笑的初二英语课代表，那是我懵懂青春里最渴望看见的一个身影，也是梦中那个让我着迷的女孩！幸运的是，我用尽所有运气，让她成为我的妻子！而她也甘愿陪我从一穷二白共同努力拥有了房子，车子和孩子，我感谢命运，感谢我的她！ 好了，不多说了，上图 今天就写到这里，希望老大加精！,auto_home,7eaae5620ec1a34f26af884bc5ae814d,1,1
前大灯，很酷的感觉： ? ? ? 正面照，是不是很大气啊，嘿嘿： ? ? ? ? 副驾驶车门： ? ? ? ? ? 气囊锁：,auto_home,2ede9aa88f25bf12d4b5b8385ce44321_4,1,1
写的不错，挺有用的！,auto_home,4955a538df50a00f99ec781a0f9be05c_108,0,
请注意上汽出品的车型，装配采用的发动机机脚纵向剪切力承受不足。 故在过坑时请，低速驾驶（不得超过30KM/H）。 2016年的锐腾，2017年的I6均出现过此问题。,auto_home,2777e5976a8645887f29a21b5a72cd78,1,-1
车顶比较平，大天窗？,auto_home,939660b90da5bb9447e94fd25171ba80_19,1,0
名爵汽车性价比挺高的，大家可以看看,auto_home,2dc354737471ccf24011629a0885fc43_55,1,1
严重同意你的观点，我差点换了转向柱，后到武汉4S，维修技师一眼就看出是连接抱箍的问题，换了就解决了！就在油门边上，车友们仔细瞧哈就能看到！么样说呢，根本不是问题的问题，搞得车友们苦不堪言，上汽啊，你关注哈细节不行吗，国企国企我的儿啊我真服了你们！,auto_home,5fc2b1bd7bc4e5b42b8178af6d6464be_7,1,-1
车子帅气，狗狗好萌！,auto_home,5995e1beea19ef7f2a48c884be6d0ce9_210,1,1
观望RX5也这么久，一直很喜欢他的外形，说实话价格也很公道。搭载YunOS系统的RX5确实炫酷科技感很强。,auto_home,3763,1,1
想买这车的，就是链条是硬伤啊。换个好几千。,auto_home,67b5eb56a1d24236cb230889931a545a_11,1,-1
倒车灯确实很实用的,auto_home,42e9930d7ff4f3f4cf386edb97c91c5d_13,1,1
h6驾驶台是一大败笔，不对称设计我敢预言将损失一大批潜在用户，强烈建议2018版改款纠正,auto_home,39b0dd151dd8e2199ff3c63c3d3fa9f0_24,1,-1
这样看来，这车确实不错啊！,auto_home,26069,1,1
车况原版，已经大保养，正时皮带涨紧轮变速箱油已换，四条2055016新轮胎，动力强劲，小刮小蹭已补漆，审车保险到年底，坐标山东菏泽。wx一五&nbsp;②五四&nbsp;凌捌&nbsp;久一&nbsp;溜溜,auto_home,7b9724a402b7e302542baa8349219b56,1,0
我也有啊，有的时候速度快，响的频率就快，但是看轮胎没有大的石子,auto_home,71b2f68918a4607a2d528337c58be98e_8,1,-1
我们这三线城市，不限牌不限号，就是买什么车优惠都比外地少，小区停车也是随便停，没有车位费，养车成本还是要低一些的。当时我刚参加工作两年，家里买第一辆新车，所以非常激动，当时刚会开车不久，什么都不懂，就是在之家上看了350，一眼相中外观，然后就跑4S看车，觉得内饰也精致，配置在当时也算高的，连试驾都没得，就开始谈价钱，我买的手动高配当时的官价好像是10.8万，最后优惠了8千拿下，那时候真是高兴啊，特爱惜车，经常自己洗车，还在网上买了不少装饰的贴纸，现在想想都觉得挺幼稚的，不过即使现在换车了也仍然觉得当时对荣威是真爱，这车现在我爸还在用，除了发动机的哒哒声外，什么抖动，异响基本都没有，真心是好车,auto_home,dc0ef4850c7a14acfcb8d0b9cf8d0f90_1237,1,1
你变的更加漂亮了，只不过前后车标从“BYD”改成了汉字“秦” 这个颜色很是符合我 轮毂的辐条样式也做出了一些改动 安全配置方面，配置360度倒车影像，电子驻车系统等安全配置，有效的降低事故的发生 空间方面，你的表现非常不错，落下一家五口绰绰有余，而且前后排乘坐舒适性也能得到充分保证，后备箱容积也能满足一般家庭的日常使用 后排空间很大，座椅也很舒适，想量身定做的一样 方向盘也改成了极具中国风的蓝秦 之前的款式里带有呼吸灯的档把也是做出了一些改动 进入驾驶室首先看到的就是12.8英寸超大高清触控屏占据了中控台的大部分面积 天窗控制 PM2.5绿净系统，可以有效的净化车内空气，可以让我们在日常开车出行的途中免受雾霾天气的侵害， 从后面看也是越来越耐看,auto_home,7a7af7d0ebae3b3aaae0245fb3bb065d,1,1
座椅内饰舒适度感觉秦不错了。,auto_home,4f369eaa0b0d4aee2c1d65e69a4ddc1d_9,1,1
改的这个劲可以再造一部车了,auto_home,534953718529f6deee2e6dbc4589f360_20,1,0
"14日新遥控钥匙电子原理图 提车时销售说电池可以用到年过今天我自己拆来看就3V电脑主板电池如果经常用摇控开车估计个月有可能年年实在敢恭维现在卖楼卖车真能忽悠个算个哪说图 换完电池想恢复原来模样从最后张向看 ? 今天午没事再次打开遥控钥匙仔细研究电路其实原理电路简单采用飞利浦索尼合资NXP（恩智浦PCF7941汽车防盗芯片此芯片可编程但成本相对淘宝网块钱片芯片可以有路触发控制汽只采用路微动开关控制改天研究另路如果线接会起什么作用呵呵在电路板看到像纽扣电池样非接触式点火装置应该就此处触动发动机点火附基站芯片希望采用这种方案点火锁附基站芯片PCF7991与频接收芯片UAA3220+钥匙中应答器PCF7941频发射芯片PCF7900先芯片原理图,供有电路知识车友研究学习",auto_home,5cfb8850a09ada458e169fb2124c664d,1,0
是在保险上接的，跟点烟器插座没有关系，不影响原有的功能。不占用插口，记录仪直接插点烟器上即可，不需要作改动,auto_home,1e712e53a500df69eba26fa3db6e2630_22,1,0
????????90后的我刚毕业参加工作两年，手里也算是有点积蓄了，经过和家里的协商，打算入手一台10万左右的车。 ????????个人比较喜欢SUV，但是资金有限，也只能看个小点的SUV了，在选车的途中有看过热销的H2，也看过东南的DX3，可是总觉得欠缺了点什么，于是又得继续搜索目标。 ????????作为年轻人，平常习惯了到网上去了解，所以我就在网上看了一下10万左右的小SUV推荐，无意间看到一个名爵，起初对名爵这个品牌不是特别了解，但是图片看着还可以，就决定到店里面去看看。 ????????来到我们这里的汽车城，进门的一瞬间就被亮到了 一双雪亮的眼睛对着我，非常吸引我，然后跟着销售员的介绍一步步了解了这个车，上汽集团生产的，这下我懂了，上海大众还是知道的 这么大气的前脸还是很不错的，这个标我觉得也很个性 来到车里面，感觉一点也不像10万左右的车啊，非常高大上。 这个出风口蛮别致的，而且很方便 这个轮毂也很漂亮，不过总觉得小了，听销售员介绍说是把悬架调高了，舒适性好些 听说这个还是互联网的，可以和车子讲话 全景天窗，我坐在后面都可以站出去 空间还可以，就是有个凸起的地方，觉得后面坐3个人不舒服 这个车身我觉得比别的好看，比例非常好，看过的车总觉得车头太短了 哇，这个尾灯也很个性哎，符合我的口味，哈哈 这样的后备箱开启方式，让我尴尬的，找了半天没找到 后备箱还可以调节大小，真的很方便 不过就是这个中控台感觉不是特别满意，要是配个电子手刹就好啦 油耗还是比较满意，作为我们这一代人，加油也是一笔不小的开支，所以油耗一定要低。 ???????看了这么多车，论外观，这款车绝对是首选，论品牌上汽至少也听的多，价格也不贵，所以打算下个月钱到位就提了,auto_home,6dfc0f92e06688323868358ccfebcd98,1,1
换了胶条，小哥还在胶条里面给我打了类似玻璃胶的东西，打算一劳永逸。可以先检查一下天窗，省的浪费钱，我是保内，自费好像200不到,auto_home,168c79136b395ba5cc725837a3b04e1f_3,1,0
支持Gs车队，牛逼,auto_home,4f573bb89f47c2fcf39c1c69d7aba332_12,1,1
14年购买名爵3，手动挡1.3排量。今年10月30日出现发动机故障，送4S店维修检查为凸轮轴延迟，链条拉长顶住气门。首保4S店做，之后都在朋友哪里按时保养维修，现在4S店要求提供每次保养的保养清单并盖章（要求二级维修资质），同时还要提供每次保养的发票和购车发票。对于此不太明白，对于提供保养清单没有什么疑问，但是要提供每次保养发票确实不太清楚理由何在，所以发帖想请教圈的朋友们，有没有遇到类似情况？,auto_home,64ac225ded5b616b3447423897aabc71,1,0
RX5的底盘怎么样？,auto_home,3735,1,0
这东北的7月怎么也这么热，为了我的老“6”我真是太不容易了，跟朋友看车一天天的走，挨个4S?店的看，真的是太多的车，太多的选择了，真整蒙圈了，不知道要买那个好了，最后大家一致认为应该选长城，第一我们得支持支持国货，支持国产，第二，这个车的性价比很高，真的觉得国产的车性价比超高，有一天肯定也会做大做强??，第三，手动，适合我，个人觉得还是开手动更有驾驶乐趣。所以决定就是你了老“6”这一款车其实个人已经关注好久了，看来老“6”?的实力还是可以的，用绝对的实力征服你们。 国产车真的是越来越强大了。不远的将来，科技感，高的配置，一定会成为国产车的标签。,auto_home,544e2d4c11a327f008783b81fced02c9,1,1
本人88年上班狗，马上结婚了，所以家里也同意给换一辆新车，自此开始了我的，漫漫选车路。这次买车，女友作为将来的主力乘客，提出了几个需求，剩下的她都不管，空间要大，不能超过18万，没了。其实提车、用车没什么，主要是选车纠结；外观、油耗中等、配置丰富这种经济适用型的车太多，尤其是国产车越做越好。日系车和韩系车不考虑，看了几个车，最早是迈腾1.4，网上每个店都说有，但是进店一问都没车，订车半年，还只能买最低配，要买就是1.8的。朋友们也一直推荐，但是超预算，放弃；同事有一辆H6开过一次他的车，感觉动力稍微次了一点，而且三菱三十年前的发动机，油耗太高；&nbsp;传祺GS4也去试驾了一下，其实外观不错，但是总感觉整辆车松垮垮的；最后圈定了博瑞、博悦和RX5三个，领着准夫人去店里看了看，也试驾了一下，最后还是选择RX5，其实这三个车都不错，动力都不差，但是由于女友的要求空间要大最终还是选择了大空间的RX51.5T智能互联。下面就要来说我们的主角RX5了，D档起步感觉稍稍弱了一点，但是只要给油速度还是有的，提车也相当的给力，我原来计划1个月的，没想到2月10号定的车，16号就到了。店里的销售也是很客气，本来上午就办完手续了，还留我吃了顿饭（虽然伙食一般）哈哈哈哈。下面是几张提车美图~&nbsp;正面照&nbsp;45度照&nbsp;后侧照&nbsp;刚刚起步，油耗10.3觉得还凑活吧，一上高速估计都该7了&nbsp;内饰相当满意，质感非常好，空间也很大，完全感觉不到局促&nbsp;自己贴的纤维贴，整车质感明显又上了一个级别来总结一下吧，目前大概有个1000多公里了，家里人对这辆车都比较满意，无论是空间也好，舒适度也好，噪音不能奔驰、宝马这种豪车比，但是和同级别的车比较已经是绰绰有余了，油耗表现1000公里平均油耗在8L左右，对于城市里开这个油耗已经不错了，毕竟那么大一辆车了。,auto_home,317219568bb3001df4992e7998c6b1c3,1,1
如果你全款4s店又强制你买保险才给提车，你可以买完保险办好临牌以后马上去保险公司退保从新去买保险,auto_home,19946,1,0
感觉车子内饰也是比较好的。,auto_home,13d080b629a1c5fc6ab6d98d58870eba_81,1,1
楼主文采不错！博越也是好样的！很漂亮的图片！很漂亮的博越！,auto_home,5a5a85f7bfa44697e6aa171c1728ed7b_96,1,1
这车很好 超喜欢 值得购买 发动机动力更放心 油耗又低 好好好,auto_home,3343,1,1
我比较喜欢其外观，霸气。,auto_home,68abae42e7bf955eb3dd281073133c4e_74,1,1
那没办法处理，不影响行驶就好，而且下雨天肯定不响，只有天气好停了一夜才会响,auto_home,8718,1,-1
白色确实大气，开自己的车，享受自己的生活恭喜啦兄弟,auto_home,79e95f2934f3ca402d5d5ea10a6a1e63_7,1,1
现在对荣威ei6还是不太认知的，也就是喜欢关注汽车的车友或者有购车意愿的朋友关注，没办法我们城市还没有呢，也就是魔都才可以购买吧，而且人家还任性的送沪牌，赤果果的就是让我等羡慕嫉妒恨啊啊啊啊啊啊啊啊啊！&nbsp;&nbsp;&nbsp;&nbsp;不能现在买，不能现在看，挡不住自己对这款车的关注啊，ei6也算是升级之后的设计了，除去它的绿芯科技电池续航能力之外，其他都和原来全球首款智能互联家用轿车i6差不多，只要你接触了i6就会明白这ei6到底有多好，多科技。&nbsp;&nbsp;&nbsp;我也不是90后，却一样比较看好ei6这新兴的新能源混动车型，直观上ei6的外观不是很张扬的，属于我们都可以接受的东方元素，也是我们国人都可以接受的审美感和眼缘。车子很大气，颜值高性能好，而且用料非常的良心，方方面面都很丰富，就人家这个轮胎都是米其林的，这安全也是有保证的。&nbsp;&nbsp;&nbsp;&nbsp;当然了，耳听为虚眼见为实啊，打算过几天去看看ei6去！,auto_home,9e8774da4f44b0188c7d989313dd2e20,1,1
先顶一个，我的RX5也准备去做了！！,auto_home,30573a1546fbc436b319ab861a6d9ed7_2,1,0
定的1.8的自动领尚版，琥珀金的，优雅版的，家里人说这天幕没有横梁，而且打不开，不安全所以就定的优雅版，其实很喜欢运动版的外形。等车等了半个多月，星期四回来的车，因为星期放假办不了临时牌照，所以星期一去提。人生第一台车，去提车有没有什么要注意的？,auto_home,71cedc78d470f2a39204c43bb691af15,1,1
请大侠老哥们帮忙，挂倒档变速器R闪动，抬刹车底下有很大响动。怎么办？2011四驱豪域。前几天挂倒档变速器R就闪动但不响，现在抬刹车底下有很大响动。请教大侠老哥是怎么回事啊？在线等。,auto_home,fadda94c1ba94cdc8940db0a86d91cc0,1,-1
尾门的声音，有的是牌照不牢靠，有的是内塑料衬板,auto_home,71b2f68918a4607a2d528337c58be98e_20,1,-1
难以想象胎噪和发动机噪音会大到什么样子,auto_home,14d05209c7cdb01e1dabd4aeebc220bf_57,1,-1
老婆的车，320m,auto_home,22537,1,0
确实。。这车油耗比想象中得低。,auto_home,683f32ed49aa720f849312af17d453a6_62,1,1
没得小天窗，有全景天窗,auto_home,6fe151a00cf2460d3546ec35b8217824_170,1,0
你说说，13万内哪个车比这个好？,auto_home,18745,1,0
三叔苏是哪旮沓的 ? 开这车？ 太骚气了吧,auto_home,bf32bd1e39f7c9628a37e2eb9bff7420_13,1,0
变速箱都是上汽产的，1.5T的是干式双离合变速箱，2.0T是湿式双离合变速箱,auto_home,68339002e27e54c2573df6b337b2ea94_1,1,0
个人比较喜欢黑色。黑色怎么都不难看，但好不好看也要结合车型，色彩是一门学问。,auto_home,7700a852e958af95288564147d221958_161,1,0
告诉ACC非常好用。安全智能刹车,auto_home,56a3b12c7f9add40e5ebf9c89a4e947f_6,1,1
离合器总泵不贵，可是这玩意坏了太麻烦，拆装太麻烦，换一次还得连刹车油一起更换，伤精神,auto_home,1b34c4611c5f6f78e7daf8063ecc5e53_1,1,-1
选双擎或老雷SUV,auto_home,7b359d7137ba2837984850885f12d61e_1,1,0
新款308比老款漂亮多了，不黑,auto_home,39ff0bf0a01711ad9238adcc11bae2f9_10,1,1
都有间隙的，没事别老拿手推窗户,auto_home,17579067ff738bd0581722f7a3dcadfe_172,1,0
右后轮异响，看来这是普遍现象啊！ 就是嘎子嘎子的。还有不知道什么地方咚咚咚的想。.【刹车不归位】。车辆冷启动后，启车瞬间，刹车片发出”吱吱吱～”的声音，车行驶热一会不响了。这个我也很明显感觉到了,auto_home,8790,1,0
算算时间，从四月份把爱车提回来到七月也快三个月了，东莞吉利售后也提前给我打电话叫我回去做保养了。于是就预约到了7.1号，平时上班根本抽不出时间来。爱车平时也就上下班跟着我跑，三点一线的，偶尔回回老家，来回400KM左右，总共行驶里程也就3500KM上下，没有一次把我抛在路上，总是安静的陪着我跑来跑去，任劳任怨，没有发过一次脾气，也是时候给它换换新血了，要对它好一点??。 小金到我的手上也三个月了，开了也差不多3500KM，到我写贴现在已经5200KM了。总体来说这车值得，无论是市区还是高速，都能给我信心穿梭在车来车往的道路上。吉利3.0时代的作品值得点赞。,auto_home,23eb562b1a579c76317222451f845733,1,1
&nbsp;&nbsp;&nbsp;随着生活水平的逐渐提高，不再是以前那种满足温饱问题，春节过后看到身边朋友都有了爱车，那叫一个羡慕啊，很受刺激，想想刮风下雨都得去挣钱，不能再亏待自己了，于是便有了提车的想法。&nbsp;&nbsp;&nbsp;潜水汽车之家好久了，每天睡前都先在各大论坛研究一番才肯入睡。老婆每次都说我可以辞职卖车去了，孩子也说我就知道看汽车之家，其实我这是为了你们好啊，给你们选好车呢，我容易嘛我！&nbsp;&nbsp;一开始就研究SUV，提到SUV国民首先想到的肯定是H6了，还有GS4，但大街上到处都是这车了年轻人就要选择有个性的车，咱不能随大流啊。有一同学做家装生意的二辆车买的任性5，就极力推荐我买任性5。个性大灯，犀利尾灯，还有那中控大屏，都是我的最爱。碰巧在家不远处就有4S店就过去了看了看，现车比在网上看到的漂亮多了，而且在跟前又高又大，确实不错。在销售顾问的陪同下试驾了一番，动力确实不错。又有同学的介绍就立马定金交，无奈手头上毛毛有限只能舍弃大屏了。剩下来的就是等车了。&nbsp;&nbsp;&nbsp;大约过了半个月的时间接到销售顾问的电话，立马给同学打电话接上老婆赶去4S店，老婆第一眼看到车子也喜欢上了，三人坐后排毫无压力。车子提来还没有过磨合期，开的也比较柔顺，转速一直没有超过3000，油耗一直在9个左右，首保以后应该能下来了吧。废话不说了，直接上图吧，全是手机拍摄的各位看官先凑合着看吧，改天传些高清大图奉上。,auto_home,60bc3fc0ef12c9bafe32ddf3e26c802b,1,1
这车耐看， 唯一就是最恶心的异响了,auto_home,5a2c8297e5827897615356151813fd75_2,1,1
机器猫的车子好可爱啊~~~,auto_home,23ae89562f15ecc9c65d19ef7d8913a5_43,1,1
低配没有遥控，自动精英版才有，不过，之家的车友会里有配的，几百元搞定，我的也是铁将军改的，跟高配一样的外观,auto_home,2edb3cb296c83a23440c544a6c023559_1,1,0
