content,content_source,source_id,auto_related,sentiment_label
应该某事吧，越野车不是可多装的都有越野灯。灯亮的地方不开呗，到某有路灯的地方在开。,auto_home,35c61266310ffb12cd1c6694bd857c5a_15,1,0
这车好丑啊！,auto_home,2cba855943a843ecf5b3752a4d0ffd91_1047,1,-1
我家这个也有，这车散热一般，开不开空调散热风扇转的都好厉害，嗡嗡的很吵。经常观察散热器脏不脏，洗车时顺带给冲冲试试。,auto_home,526063a656b34b3cd35db06c81dddc99_14,1,-1
GL，吉利又一款3.0精品车！支持国货，打造精品！,auto_home,65fec969741fe0a25c105e9e8398815c_19,1,1
吉利汽车现在已经进入3.值得拥有0时代总体造车技术质量都有提高，博越品质,auto_home,3cbdae4c5a4b20e723816a6df433f4c5_92,1,1
gs是里面颜值最高的车,auto_home,37baafcb1690d42d648b8d4e06817947_130,1,1
自动挡车型成本高，国内技术掌握的还不是太好，所以国产车不大推AT车型,auto_home,13ed103de18650dea49444de18a718e1_1,1,-1
因为买车的女孩都很漂亮，我曾经在湖南见过一个和你一样漂亮的销售！可以交个朋友不？你的荣威360是1.5自豪版不？请问高速120码转速多少？真实油耗多少？,auto_home,42c88f1d9ffce6a30efda1919bb708d0_616,1,0
空间很充足，作为家庭来说，足够用了。,auto_home,4d57d14eaaff9d208b26daf032da04f5_8,1,1
我的是正常模式的，就是一档升二档有轻微的顿挫，没开空调还好，开了空调就比较明显，感到车子窜了一下。,auto_home,45e0018ff2045931883b1e41fec21015_6,1,-1
历经曲折，被4s店忽悠又忽悠，推托又推托，昨天终于提了erx5。结果今天就出幺蛾子，直接动力蓄电池切断，车子无法启动。24小时救援电话打了20分钟才打进去，然后指派的师父嫌远不肯来，也不告知一下，傻等了半个小时。重新打救援电话，说会尽快安排，然而现在又10分钟过去了，没有任何回应。对荣威的服务太失望了，大家千万别入坑,auto_home,177b0ea785d473e5d6319b1d0598a9b3,1,-1
30T吧，啥都有了，免得你买回来有加配那，把车搞异响了,auto_home,3126,1,0
&nbsp;&nbsp;&nbsp;&nbsp;这个机脚垃圾&nbsp;，断了。。d档和r档，刹住停车。。感觉车子抖动，车内发动机声音很响。。切到n档稍微好点，行使的时候&nbsp;&nbsp;听不出什么问题。。&nbsp;&nbsp;&nbsp;&nbsp;我现在不想折腾这破车了。，心累。上车就开收音机。。无视这问题。。。我就想问问。。断了，不换&nbsp;继续开&nbsp;没事吧&nbsp;&nbsp;发动机会掉吗,auto_home,f3a26f242d113f4db3f0a50bb4d3d3d0,1,-1
10多万的车竟然没有隔音棉 传说中的1.8T发动机,auto_home,784445e2b20a2e7250012cf19d7f0038_2,1,-1
支持楼主，好车就该好好保养,auto_home,544ffed7b0b389c708253feed6c9623c_22,1,0
其实光看外观感觉这款车还是很不错的,auto_home,4a18f743fe3405e82abc8db118255a9c_88,1,1
说实话，这车本来我没看上，就是试驾了才感觉不错，位置绝对够宽了,auto_home,5b03d290902e2d44b94004da5e1ac044_211,1,1
这是17款的图片吧，矩阵式大灯,auto_home,364c5f0ea41ca9a8721db75d6b3a3935_16,1,0
我在四川，刚订了一辆，买的人少，想请问你一下，便携式充电器一定要用接有地线的插座才能充电吗？,auto_home,7839,1,0
看上去挺不错的啊,auto_home,1ca891c8f3c4f50ced2f8fac81d3d539_70,1,1
挺喜欢的，很高的安全配置了,auto_home,5805add4bd98baac621ecf878e0f8f31_9,1,1
这个可是超级实用贴呢好车，真是不韵味啊,auto_home,1ca891c8f3c4f50ced2f8fac81d3d539_98,1,1
比亚迪就是造电池的肯定牛逼了，但是我还是喜欢ei6的颜值,auto_home,1fe9ac248eba49b47bef0a1ebd26d8f7_1,1,1
我的小三慢慢变成老三了，但依然喜欢，也准备带老婆孩子来新疆，带着我的小三,auto_home,38566a2c7e7fa5c9fbd3b1208489aef4_142,1,1
低配上个山气大灯肯定卖的红火。。,auto_home,26373,1,1
可以换灰机发动机，再改装下外形，加翅膀，申请空中航线，直接灰起来，又快还不堵车。你觉得能行吗？,auto_home,17f7921373ceea4f45226b370365938d_9,1,0
后排一样没中间头枕，难道荣威全系都没有？哎，这是简配上瘾了！,auto_home,4ce8ada56afc5e36d0fd479207add91d_14,1,-1
你说新车没味道，为嘛我的车提回来味道很重的 而且手精车子也不是全皮的呀不是仿皮吗？,auto_home,1cbe9103be8fadec7c19170d8568b710_6,1,-1
本来计划5月份就入手的，然后和朋友一起自驾去一趟青海。谁知道各种事情耽搁下来就到7月份了，以前总觉得蓝色最好看，日子久了越来越觉得红色更有味道。千万不要说红色是女人的专属，男人开看起很娘炮，我是不接受有这种想法的人，ZS红色是极速红，很正。我觉的它可以代表我对生活的一腔热血，是一种积极向上的颜色。搭配上ZS独特的外形，很特别，当然也很漂亮。注重细节的我也算是个外观控吧！ZS的大嘴设计第一眼看上去还是比较吸引眼球的，侧面看会呈现出内凹的一种状态，立体感十足，美中不足的是只有顶配的车型才配有亮片装饰，以下的都没有。大灯的设计和格栅是一体的，并没有感觉有什么特别，唯一的亮眼之处就是日间行车灯，据说它的设计灵感来源于英国坐标性建筑物伦敦眼在泰晤士河中的倒影，这么一说，倒真的有点像了。设计这个东西是有灵魂的，只有带有灵魂的设计才可以打动人心，不得不说邵景峰确实厉害，耗费半个多小时拍了一组ZS的大片，删了很多，留下我喜欢的和大家分享（具体的用车感受过几天再和大家分享）,auto_home,78d2b58b732c5f45da4948e78345442f,1,1
刚玩两周，不过此车手动好玩！,auto_home,51ef5f85aac8f50ec57d10f820b4fb63_4,1,1
RX5现在跑了5112KM要不要开始保养了,auto_home,17741,1,0
确实不错哈，之前都没注意到这部车的样子还不错,auto_home,25243,1,1
我的2.0智联换过半轴，现在1换2在1500转以上，踩下离合就咔拉啦响，然后换到2挡时还会卡啦的响，， 但是把转速拉倒到1000转左右，就没有那种异响了，，，你说这又是怎么回事，，,auto_home,3349d79d16e54bf98ac047962ac66a32_6,1,0
很喜欢2017款秦,auto_home,7f263e147c79051693fa6bf9f522f11d_9,1,1
我都怀疑这是量产车，还是模型车了，唉。。。。。。,auto_home,19068,1,-1
仔细看回复，那些什么多少转速换挡、什么油离配合的就是,auto_home,18304,1,0
呵呵，你就是镶钻石，包金子，它还是个小三,auto_home,62c4414f86d6acadc94e38b323c9e176_20,0,
博越车的配置及安全性能方面做的还是很完善的！,auto_home,9b8fdc987bbb90c6e1718a327ec8cd80_22,1,1
博越的主动安全配置确实很到位，楼主介绍的也很全面，学习了。,auto_home,523334cb0b62ebab4b80e7011f1af755_5,1,1
奇瑞明年全线上三代发动机加48v微混系统，加上国产一流的车身结构及底盘，想黑都不好意思了。,auto_home,12569b3d9599824a12124d00689fdae8_40,1,1
"老司机们都说，10000公里车磨人，10000公里人磨车！在我与小“G”携手八个月后，双双跨过了20000公里的终极磨合门槛。 小“G”成为我人生的第一部车，在这20000公里期间，人车的磨合虽然称不上绝对完美，但肯定算得上是相当融洽！至少没和我闹过什么大脾气，也从没有丢下过我。20000公里的路，高速差不多有6000公里，主要是回了两次老家，约5500公里左右的高速，一次往返各20个小时，一次往返各15小时，都是我一个人不间断的开，车还好，就是人累啊！ 这车的内外颜值在此我就不再赘述了，总之一句话，看过的基本都说好吧！ 20000公里来，综合的油耗我是相当的满意，现在300元的油可行驶680-730公里之间吧（路况整体还算良好）。从提车至今表显油耗从未清过零，加上平时都是一到两个人在车上，所以大多数时间我都是开ECO模式，高速或满载时则用正常模式，SPORT模式还没有用过。夏天前的表显油耗在6.3L/100KM,进入夏天后空调开的频繁了些，油耗现在升到6.4L/100KM。特别要说明的是，这个表显油耗做参考就行，以我20000公里的综合实际加油费用来计算，油耗为0.43-0.45元/公里,这样的数据，不满意都没理由啊！ 车友会里有太多的车友都爱拿车和老婆相提并论，更有甚者说车就是小老婆（是谁我就不说了，你们自已对号入座吧），可在我这里，车就是一交通工具，完全没有必要捧着护着，该怎么用就怎么用，只要不是过度的暴力驾驶就行。但给予必要的小装饰还是要的，毕竟爱美之心人皆有之嘛！ 装13咱可以不在意，但维护保养可是不能半点马虎，毕竟这关乎小“G”的健康嘛。现在马上要进行三保了，前两次的保养都是用的全合成机油，效果确实不一般，简直有点如丝般的顺滑啊（吹了点小牛皮，见笑了）！“工欲善其事，必先利其器”，想必就是这个道理吧！ 20000公里，是新的起点，更是新的征程！有“G”相伴，梦想不再遥远！",auto_home,61e07704df47f731596e7e41031dace1,1,1
我是一名60后新手司机，别看我年龄大，我的驾龄却不大，博越算起来是我人生第一台车，对于博越的智能使用我也是新手，还要多学习。自从加入呼伦贝尔博越车友会，才发现有这么好的一个交流平台，供车友交流用车经验。认识会长后，车辆问题再也不是难题了，有问题就找会长，小李同志可以说尽心的帮助我这老人家解决问题。 这次阿尔山之行，本来觉得都是年轻人的事情，可是细一想，我们青春不在，精神还在，不服老的我们在会长的领导下开启了两天两夜的行程。 以前开博越去过一次满洲里，全程都是高速，像这次又是国道，又是乡道，还有草原土路，我还是头一次，对于我这样的新手司机来说，有一个好的向导真的很重要，一路上会长提示大家前方有测速，前方有直角弯道，前方注意会车有大车等等，唯一遗憾的是我没有买顶配四驱，车上不带ACC自适应巡航，长途行驶下来还是有点疲累。早知道有这么好的交流平台，能够经常携伴出行，那会真应该买高配了。 对于我这样的新手来说，向大家诉说博越的车辆用车感受，还真有点班门弄斧了，我平时用车地方不多，首保的时候才开了1705公里，这次出行也是为了测试博越的车辆情况，之前有过车门异响，在售后已经解决了。这次长途行驶各种路况都有，我的车也没有出现其他异响，这点我还是很满意的。对于我这种岁数大的新手司机来说，从博越的智能语音系统的蓝牙电话、自动空调和导航，再到360度全车影像，自动灯光，都让我这老人家觉得开车还是很简单的。此次出行算了下综合油耗在8.5个，对于我这四驱自动的车来说，还是很喜人的。 通过这次自驾游，我觉得参与这样的活动真心不错，阿尔山的空气特别好，享受大自然，博越伴我行。,auto_home,69e8bbd2809f1ce706681972a061a04a,1,1
空调滤芯大概多少公里更换一次？,auto_home,17742,1,0
用了多少钱？我今天打开发动机有味道了,auto_home,5ec34775445ba72fea9d4c13535d74ae_25,1,-1
首先要纠正下LZ的心态，没有车牌就超速行驶其实不但是对自己不负责，也对其他人不负责，！希望楼主以后小心驾驶！ 另外这忘记关窗，确实是很多人都会犯的错误，既然电动尾门都加装了，何不加装一个自动关窗器呢，也就200左右吧，某宝很多，这款车子外观确实很好看，定位也不错，比起同级别H2，和 众泰T600，更稳重更大气，另外荣威的技术相对来说更稳定，说起众泰那种浮夸的车子就简直了，外观内饰绝对高逼格，一走起来，那简直整个车子都在发出异响！哈佛的车也还行地盘都很扎实。希望楼主用车愉快,auto_home,6130d41475b76920339ed35224f38231_227,1,cmp
2017年4月19日，上汽荣威ei6车型于上海车展正式上市。新车按照配置的不同，共推出了3款车型，售价区间为20.18-22.28万元，补贴后价格为16.58-18.68万元。其实不到20万元的价格，非常适合日常上下班通勤使用，也是那些重度网络依赖者的首选车型。智能互联系统是荣威ei6的一个亮点，新车搭载上汽集团和阿里巴巴联合研发的最新智能互联系统，全面接入支付宝，用户可通过车辆自带支付宝，轻松支付停车费、油费、电费和保养费等，简直颠覆我的世界观啊。由于采用触控屏，整个中控没有物理按键让车内看起来也是非常简洁。动力系统方面，荣威ei6将一台1.0T三缸汽油发动机和两台电动机相连接，官方的综合续航里程为705公里，综合百公里油耗仅为1.5L，是不是超级心动。,auto_home,12dda01b33477fa275e41b094e6d1461,1,1
多半是排空气存在问题，我的换了感觉比之前好用多了，但是拆的时候暴力拆半轴让人心疼，直接撬棍锤子上，砸得半夜上都有些小坑了，现在时速80以下没感觉半轴有什么问题，不知道高速时会不会因为质量均匀性出现发抖的问题，如果有肯定要去4S店索赔半轴。,auto_home,7f74c4be0a54b5306c075c0a32822076_9,1,1
问题是你这个发动机还没上市呢,auto_home,2bee8ae9adde9279c253d17f27e8c5a6_10,1,0
我觉得后排中控扶手简配的有点不厚道，虽然我从来不用，但是那确实满满的逼格！还有新的保养政策。,auto_home,2797911a647b8758c03d3e2ee74090df_20,1,-1
恭喜潍坊博越军团完美收官，是博越让我们聚到了一起，聚在一起就是缘分，博越一家亲，一岁了，知识讲堂真不错学习了很多，期待两周年庆典。,auto_home,7a72a3442c117cecd636d9c8967262b1_1,1,0
比现款的虎三强，虽然拉货空间没有虎三大，但是比虎三更平整。,auto_home,7acc9cfefbdc1acbe3da318c9563cdc9_217,1,1
就是女士开也很适合的车子,auto_home,30387ce033d80422d7c883f10e622d98_40,1,1
"350外观动感大气,内饰做工精致.性价比还是蛮高的",auto_home,2fa5ebb9d0249f7beed671fe0572fab1_55,1,1
1.3自精近六百公里7.3油耗,auto_home,2c97e4a62b4d2a550ac206df3e20cab7_4,1,0
恭喜提车，顺便问下优惠多少？,auto_home,6572,1,0
没有坏，车子开起来是满的 开到1-2公里停了 启动后还是不满格,auto_home,464bb119071dd8a13e51da2861f12510_8,1,-1
引用: 原帖由 风速77 于 2011-08-11 10:47 发表在 101 楼 楼主，你那百公里油耗4.3，太劲爆了吧，全高速也达不到啊，莫非让马拉着走的啊 瞬时的！,auto_home,37648f8888b01c2633147f2095f6b926_102,1,0
补胎那个小东西不错 很实用,auto_home,4168b80e470d55f77b34b4e1dcc18f4d_17,1,1
车子前脸霸气犀利的感觉有木有,auto_home,760137e93450c242e879d063e7c79ff4_90,1,1
"自我介绍，本人湖南株洲人，90后，男，主要购车理由：被外观所迷，了解详情也能接受&nbsp;&nbsp;&nbsp;订的旗舰版，实在等不了，互联网版，4s店说白色没车，但后来想想用车安全主要还是得靠日常驾驶注意，个人认为不可太依赖这些电子设备；尤其是那个大屏幕价格算是，砍了又砍了，实在没有办法了，试驾带了2个朋友过去的，&nbsp;&nbsp;满载4人，没有胖子，大概平均一个人55KG，档提速是非常慢的（油门到底，车速个转速都都没有什么反&nbsp;&nbsp;应），别有点上坡，这个时候想超车基本不可能（说明一点行车速度与挂当位置匹配的状态下哦,并没有拖档），1-3&nbsp;&nbsp;档动力相对充足，看了很多人都说动力充足，大家觉得我这是问题嘛？外观：高端大气上档次，还没有朋友从后面看误以为宝马X5，嘿嘿，感觉屁股翘的有点高了（远处正后方看）；&nbsp;&nbsp;&nbsp;内饰：一般，座椅稍微偏硬，做工还可以接受，整车基本红线缝制，后排座位舒适度非常好，操控：方向盘转向合适，行车噪音小，隔音效果还行，怠速噪音也接受，&nbsp;&nbsp;&nbsp;总结:4-6档提速不给力，小鸡鸡及大肠本人可以忽视，外观喜欢，内饰可以接受，引擎盖隔热很好，总体觉得这车值&nbsp;&nbsp;得购买，质量方面还有待时间考验才能得知。&nbsp;&nbsp;&nbsp;后续等待考验",auto_home,5ca1c46b48f917bcf11d2b5e01f02005,1,1
漂亮是漂亮，台面的氛围灯在晚上的时候会在车玻璃上映射，造成视觉混乱，引发行车安全！楼主……小心,auto_home,1c12c37abcafc086ed587e296e133a44_3,1,-1
非常好看的一款车子，上下中网的设计很有中国元素的美感,auto_home,396a8f0fc7198726bc473f6981a4267d_1514,1,1
后门加喇叭和不加喇叭区别很大的，多功能方向盘用了就知道，行车安全很多，大灯改了和没改那是天壤之别！,auto_home,643e11c7d7f7449324f08a9537fd81e1_7,1,0
胎噪风噪 13万的车没电吸门 除了手动挡 双离合不说了 爱信变速箱都有顿挫 我感觉不是离合的问题 是车的问题 投诉那么多 根本不解决 厂家后期根本不管 你看看贴吧论坛多少人在等厂家态度 噪音在高速能让你耳朵疼 隔音最差没有之一 摆臂脱落 漏油小问题 不说了 我感觉我知道得太多就会变成车黑,auto_home,24d09c993e182d31b07c90e45384a5b3_12,1,-1
超车用运动模式快,auto_home,315b72b8c41ab0422fbaee0383915a92_15,1,1
荣威RX5发布后一直关注中，原计划2016年年底提车的，因“经费”紧张没能实现！还好，今年二月份资金宽松了点，立马将买车提上“日程”。提车荣威RX5的四个原因：1、支持国产车！哪怕被坑也是将钱给了自己人，尤其上汽集团应该是一家能让国人放心的企业！不会像进口车跟合资车一样，人家赚着你的钱还欺负着你的家！2、价位合适！不到15万享受20万以上的配置！3、荣威车标！两个狮子、一个华表，富有深厚的汉族传统文化内涵，散发出汉民族传统文化的精神、气质、神韵。4、最重要一点！！！“经费”刚够！2017年3月2日，泰安双龙4S店提车两驱互联网智享版（巧克力棕），原计划提黑色（看上去稳重、大气），可惜没车要等，自己工作时间不允许，所以只能提巧克力棕了。不过也不错，拍了几张照片分享一下、、、、、、请各位车神交流下新车磨合期及斑马系统使用技巧！,auto_home,3372,1,1
听说荣威ei6是采用“律动”的家族式设计语言，感觉现在在车型设计中不上点家族式设计就不是自家品牌的车了。虽然不知道怎么看出“律动”，但是倒梯形大嘴与两个前大灯融为一体还是挺有气韵的，镀络条的采用也不像本田那样让人产生“强行加镀络”的感觉。 现在荣威的外观设计，精致而且时尚，不由自主地透露出时尚精英白领的气息啊。? 尾部也是以一条镀络装饰贯穿两边尾灯，看起来还是比较轻松舒畅。以摁下车标LOGO打开后尾箱的方式，会让第一次使用的人有点无可奈何。 最后还要补充一点，非常重要的一点，安全性。ei6这次在电池安全性方面做足了功课。主动安全方面也不含糊，SCS车辆稳定系统和ADAS高级驾驶员辅助系统都是可以确保行车安全的高科技配置。 综合来看，如果在上海，而且两年以上没拍中牌照，那这台车相当的适合。它在自主品牌中，表现已算相当不错。ei6动力充沛，驾驶感轻盈，绝对的代步小能手。,auto_home,3e3a7ef643c6f3fd7c1b9a327f20af97,1,1
对虎7很有信心，直接去4S就订车了，不过销售建议我试驾一下，因为这是他的服务范围，果然，买车后奇瑞售后打电话问我是否有试驾。,auto_home,13fef0eb04a0426e6871835ac2b073ad_2,1,1
斑马智行更新到1.2.1版本，群里的车友ios实测可以启动车,auto_home,65da5e0247c91a802427bb5ede9708a8_52,1,0
就是我的第一辆车，啥都不懂，就知道网上都说它好，我去看看内饰可以，就定了。你最后买的什么车？,auto_home,25739,1,0
一款给人很多不同体验的车型,auto_home,78d14ecbd8d838f38a7defda6b6e2689_50,1,0
是的，车一般,auto_home,241be0efe120a7b8812caf935e35e92a_11,1,0
"松踩离合严重异响,一年多都没处理， 你也够有耐心滴，不行厂家电话、消协电话轮番投诉。",auto_home,21d2f485886d5badbc63dc75ab3b601b_1,1,-1
双离合是趋势，AT专利壁垒太厉害，不是谁都能搞出来的，双离合专利壁垒没那么多,auto_home,19990,1,0
双侧上面有没有装镀铬条？,auto_home,16188,1,0
鼎 写的好详细，这个价位的车就是这样。不过变速箱的逻辑的确写的不好，我的RX5也那样。轴距越长车越不灵活，鱼和熊掌不了兼得,auto_home,1e72726130e8b7f574703f1af631036e_2,1,-1
对散热影响很大，出了问题，厂家可不负责任！,auto_home,291fc62fe86f51e0dc225bd25ca7dc50_5,1,-1
除了大众早期的干式双离合是液压的，现在的双离合好像都是电驱的吧,auto_home,2f3295204d520507947343ec2998c0b6_3,1,0
今年买的二手名爵3，用的嘉实多金嘉护5-30机油，转速表三千时候才一百码，这个正常吗，请问你们的转速80马时候是多少，一百码时候是多少,auto_home,7f6ad1aec308af714bb2b2c1d0a91955,1,0
开始是40。 后面听说容易跳齿 就换成30 但是感觉没40 顺畅..... 后面还是打算用40的....,auto_home,1e62ea4a3e93b902995405320e69b68a_3,1,0
同城车友告诉我，音质真心好。自豪版。仅供参考,auto_home,27f89d5697cfe588f264d988d687e1ce_13,1,1
七万，东营的车，无事故内饰无破损，全车隔音，七万公里,auto_home,66173fd403dc651ff1b81f0d57960dc2_14,1,1
两个前车门感觉松，走土路搓板路会有橡胶摩擦声，不过不是很大声。别的没感觉有啥异响。,auto_home,4e7a0e60f08e14b64fdc5bc1a96f6173_15,1,0
我说的是荣威i6,auto_home,3e1cace0d14c91b2f387884d2c8283fe_3,1,0
吉利论坛没这么狭隘，可以说，但你要同时客观评价吉利,auto_home,4bb0034429c12684021d6d27ca9f7241_93,1,0
恭喜恭喜，哪款？是自尊吗？都快14万了不能智享吧？,auto_home,2d1303f07d39965662e2bba0c13152e4_1,1,0
其实大家在选车的时候都是很纠结的，看中这款之后又看中那款，特别是有选择困难症的人，选车绝对是一件最累的活计，我们就想买一辆自己喜欢点的车，平时上下班开开。然后可以周末出去自驾游，开始我在网上选车，我看好了景逸，可老婆看好了长安XT，就这样我们一直在看，也没有绝对买那个车，有一天，我一个朋友来了，我们就提到买车的事了，然后朋友就推荐了荣威RX5，我们说没听过啊，朋友说，你到网上看看，现在这款车很火的，网红车，主要外观炫酷，然后我们关注了这个车。&nbsp;&nbsp;&nbsp;&nbsp;&nbsp;过几天南通有个车展，朋友打电话给我，说我可以到车展看看，去吧肯定有荣威RX5的，相不中这个还有其它的。就这样我跟老婆一起来到车展。在车展，我老婆看到RX5眼睛就发亮了，直接就相中了这个车。我们到车里面看了看，又听销售讲解一番，最后经过老婆的拍板直接就定了。。。,auto_home,67cb013484c2b5df0dec7d2b593639bc,1,0
俺家小领导唯一的要求，全景大天窗,auto_home,9160,1,0
目前行驶到1000km出头，这几天发现过烂路的时候，车子后部会发出一两声类似塑料物体敲击的声音。。。不晓得各位老司机有遇见过吗？正常的路面一点声音都没。。但是走烂路，有颠簸的时候就会出现一两声这种异响。。。,auto_home,8845,1,0
运动感十足的车子，值得入手,auto_home,23d0f4f1bd91a6a1aa6d805fa64ec24e_50,1,1
其实关看外观还是很喜欢这款车的。,auto_home,16dddb0295e289cc42794ca0cd9bb4c0_193,1,1
我认为最大缺陷是全系18/19寸轮毂。华而不实。换一个胎一个轮毂比原17寸会贵不老少，而且也更容易损坏更换。,auto_home,16633ca51811be7553343a28e5a16f79_66,1,-1
过年的时候回东北 雪地 直角弯 30的速度还是会打滑 不过好像四驱自动启动了 没转圈哈哈,auto_home,671,1,0
对于真正资深的赛车迷，MG一定在他心里有着重要的位置。这么讲不是夸张，不是广告，而是对正统汽车文化的向往。现在的销售，包括上汽自己的宣传，多半仅仅以MG来自英国为卖点，空洞的夸耀什么“英伦血统”，“王室血统”。这些固然不假，但太过单一。真正的MG文化远比这要深厚。而对我来说，对于MG的喜爱从这辆车开始，那便是传奇的MG&nbsp;Metro&nbsp;6R4。,auto_home,600d5e3bea8551d82d2b6d4e4a02c148,1,1
3年了，没问题。这车要多用，多出来豁豁更健康,auto_home,74d20ae7450ab8c59220b54e612a3e7b_119,1,1
你看看其他车的市区油耗就知道ZS省油了。,auto_home,472ca1d0311a3c4232f759df73293096_18,1,1
说实话这车真可以,auto_home,8175,1,1
