content,content_source,source_id,sentiment_label,auto_related
不错，更像昂科威了,auto_home,e4dd4e2fbdfc1e4ac55f3f2619fdd700_10,cmp,
小三的驾乘空间和安全性是很好。发动机是有点老。但是小三还是一辆很不错的车子。,auto_home,52ffac4ddcd25c8d3e24c961be3f45f0_13,1,
小四要死了，骗人的东西，国产坑国人，倒闭了最好啊！小四骗死人啊！,auto_home,4ecdaa5998805df09197f880c4ccdacf_8,-1,
底盘不错的，平整，拆车视频那个荣威任性5底盘乱的连QQ车都不如,auto_home,54f5bd4a3e04c420e220accfa1fc0662_3,cmp,
本人刚买的荣威350自动挡回家后发现，早晚踩刹车起步和打方向盘，有嘎吱响声，非常大，当再找4S店时被告知所有自动挡车系都有声，我不相信又开他试驾车果然如此，所以大家千万别买荣威和MG，同时开2挡空调噪音非常大，避免让更多人受骗，大家一定要转发，我发新贴都发不了，因为我说这车有毛病，同时挂倒挡和前进挡都有噪音？？？？？？？？？？？,auto_home,da0a1923d0b4a86713741d0bcf034d60_63,-1,
最美的博越 最好的车 麻烦回访博越内部详解 谢谢!,auto_home,1f24ec9945815acfcb8d47599f89d10f_227,1,
油耗除各车的因素外，还要根据路况及各人的驾驶习惯而定的,auto_home,5031b01fb8c2c68eaf3b17ef84d940e0_53,0,
上坡感觉动力不足就把空调压缩机关一下，1.5排量车重在这摆着，关键看你怎么开，600公里这么闷车可不好，还没过磨合期。,auto_home,703081572aa4f704627ea65ee33d5b3a_14,0,
             “三好先生”非、徒有虚名       说起“三好先生”关注博越的人自然不会陌生！当然了这是博越广告标语。那么博越是否真的实至名归？配的上好看、好开、好智能的三好吗？我们一起来探讨！ =============================== ?植入广告大图（素描）‖建议连接WiFi          388天‖19003公里‖博越带给我很多的惊喜和意外。既然号称“三好先生”那就先来说说它好的、让我满意的地方。 ______________________________           ? ① ：外观、内饰设计      外观设计各有见解，对我而言很合口味；自动LED鹰眼大灯不管白天还是夜间都是亮点。还有就是隐藏式D柱、悬浮车顶、18寸大脚都是当下流行趋势！     内饰的设计和用料都是我最最看好的！能摸到的地方都是搪塑工艺软软的。中控布局简洁、大气，而且是按照中国自己的文化元素‘西湖断桥’的外形设计；不得不给设计师一个大大的赞。 ______________________________           ? ② ：配置丰富    安全配置丰富主要体现在（ACC自适应巡航）、（城市预碰撞）、（自动LED鹰眼大灯）、（360度全景映像）、（车内空气净化）、（自动分区空调）、（自动雨刷）、（主副电动调节带加热桌椅）、（全液晶仪表盘）、（安卓互联和CarPlay）等！豪车该有的配置它几乎都搭载了，这些对于15万的车型来说是非常难得的。 ______________________________          ? ③ ：环保     新车车内你几乎闻不到异味，这是否能侧面反应出博越内饰用料讲究？不过这只是个人的推测没有经过验证。 ______________________________          ? ④ : 隔音     车内隔音做的确实很好！这里可以提供一个实际测试数据供参考（时速60车内噪音55.5分贝）、（时速100车内噪音61.3分贝）；在实际的驾驶当中，博越安静的让人感觉质感很好；上到80km/h之后，风噪会逐渐增大，但整体还不错；发动机的隔音属于中等水平，传入车内的声音略显嘈杂，而且在D挡停车时，会有一些振动传入车内，不过这对于（6AT）车型来说也是正常表现。 ______________________________           ? ⑤ : 平顺性     换档平顺性博越确实值得夸奖！“三好先生”不关是虚有其表。经济模式、标准模式、运动模式三个模式下除了经济模式2档升3档有轻微顿挫外其他的动力衔接都非常平顺，不看仪表盘感觉不到6AT在加减工作。    涡轮介入也是非常流线性、不突凸，不看数据你是感觉不出它早在1000转就已经悄悄的介入，1500转就已达到峰值。 ______________________________          ? ⑥ :操控      电子助力的转向系统方向盘几乎没有虚位而且很轻巧，值得一提的是转向有普通、运动两个模式提供选择；针对不同驾驶习惯的人随意切换。      作为一台自重相对较大、重心高、悬挂偏软的SUV。急过弯时侧倾还是比较明显，但却非常受控制，俨然一副大厂调校的感觉。      底盘的布局虽然不够规整，咋一看一副很松垮的表现。实际用车中却是另外一种感受；很紧很整没有多余的窜动。      刹车制动系统灵敏，开过我车的朋友都说刹车太灵不适应。 ______________________________      ?⑦ : 舒适性     偏舒适性的表现除了在加速模式上体现，也同样体现在博越的底盘调教上。它的转向力度比较沉稳，悬挂更是舒适为主，对于坑洼烂路的处理都很柔和或者说是Q弹。     座椅的包裹性很好，长途行车也不会很累；因为隔音做的比较好行车过程中和车上人员的交流很轻松就能完成。 =============================== ?植入广告大图（原图）‖建议连接WiFi        说完优点接着就要谈谈在这388天使用中觉得博越还需要改进的一些地方，也算是给博越的一点建议！ ______________________________          ? ① ：油耗偏高     388天‖跑了19003公里。基本都是上下班市郊路线，回过几次老家上过几次高速；一直都用小熊油耗做着记录。        一共加油（13646元、2205升）、平均油耗（11.05升／百公里）、最高油耗（14.49升／百公里）、最低油耗（8.17升／百公里）；跟车机显示的（10.4升／百公里）还是有点差距。自己算了一下市郊路线在（7毛／公里）；高速在（5毛／公里）、‘仅供参考’本人驾驶比较激进，起步都在2000转左右。 ______________________________        ? ② ：加速度    0-40码提速相对较慢。（可能是变速箱调教方面的影响。起步阶段（0－40码）提速较慢，静止状态下踩下油门到车子开始走动有个1秒钟左右的反应过程。   ______________________________        ? ③ ：发动机噪音    发动机传入驾驶室噪音较大，低速行车还拌有很明显的‘哒 哒 哒’声。 查阅资料普遍认为是缸内直喷的声音。不管是缸内直喷的声音还是凸轮顶气门的声音；如果能处理或者过滤得到一定的缓解当然最好。 ______________________________        ? ④ ：异响    门板和天窗有过一段时间异响。后来就很奇怪的没有了，到现在也没搞懂怎么回事。 ______________________________        ? ⑤ ：储物空间不够用    车内储蓄空间太少，整车储物就3个地方扶手箱、门板、后备箱。中央扶手箱太小、门板储蓄中等、后备箱不拆隔板只能放两个标准行李箱加一些杂物长途旅行很尴尬。 ______________________________        ? ⑥ ：USB个数和位置    全车只有一个USB接口，而且还是隐藏在扶手箱内用起来着实不太方便，大部分时间还插着U盘。在这个移动互联网时代下是非常紧张的。如果前后排各两个USB加一个点烟器非常完美，况且增加这个配置对车企来说是非常简单和廉价的。 ______________________________        ? ⑦ ：后排座椅无法调节    后排座椅靠背不能调节，长途旅行保持一个坐姿不管对于老人、小孩、年轻人都不是优点。        ? ⑧ :底盘布局不规整    这个不知道怎么说！要说就是影响通过性或者说增加风阻系数吧。 ______________________________          我是个很会挑毛病的人，说了这么多的不足。不是在黑博越、黑吉利、黑国产，是希望博越作为咱自主品牌里一款非常出色的SUV。它能更加出色、完美、符合更多人的使用需求、得到更多国人的认可！,auto_home,7964cdbde217bcfe361a5ed083eaf8bf,0,
"我一开始也看了vv7,但是总觉得国产新款车不靠谱，还是等两年市场检验以后再说吧，买350已经上当一次了。",auto_home,4b852976eeeb797b1c093c138eeba3c9_20,-1,
这车我试驾过一次。高架、烂路、小路都走过，很好开的轿跑。偶尔低速拐弯时会感觉到顿挫。总体来说，这价格是对得起轿跑了。而且发动机还和别克一样。,auto_home,56a76e89295c91394579d5c84eac23c2_15,1,
荣威汽车还是可以的，楼主你买对了！,auto_home,25113d3dff7dc1ee3b239ff3fdf6d9b1_109,1,
博越这车买了不后悔。,auto_home,7bd019d2e43693aacd6cf42c4802e61a_180,1,
喜欢408但是钱不够，打算这几年不换车，就是在想有没有必要咬牙上408毕竟穷人，而且也没开过车。,auto_home,7b212998549b1dbc0e448fb7bd7d2f2c_3,0,
为博越点赞期待回访,auto_home,146fa791a4a3ae96a0d06b33b31141f6_85,1,
我购买了荣威rx5&nbsp;1.5T自动互联网版。销售员和我说&nbsp;没有过首保&nbsp;速度不要超过100&nbsp;发动机转数不要超过3千。请问如果没有过首保超过了会怎么样？对车有什么不好？如果不小心超过一次没事吧？对车以后油耗不好吗,auto_home,49bee63a0e84de3b317a522cb068cf02,0,
我开的是手动挡，操控性挺强的，配置都很实用,auto_home,437e4936df1b37fe0e9e462d92dc3803_106,1,
我前几天提的新308的1.6自豪，颜值内饰没毛病，动力对于新手足够了。配置肯定不如i6。12.5落地，你的15万估计起码能提个带T的次顶配了。个人觉得还不错。,auto_home,649df5d84838acfeaa0b9deb7f55306d_4,1,
引用: 原帖由 咸豆腐脑 于 2010-06-14 17:09 发表 第一次看中小橙子，是在广州车展。看到他帅气的样子就决定不放过它了。。。嘿嘿。老婆是时尚先锋。。。比较可爱，车子一回来就弄了很多小钻钻。。不过我感觉还蛮好看的，很适合老婆大人。。。女人大部分都是比较路痴，我老婆也不例外，所以当时提的时候就提了高配的。不过原车… 楼主，请问装个倒车后视花了多少米。。。我也想加个这个。新手。。,auto_home,57a576131e9825aec9efd7cbce412aa4_71,1,
车子性能很不错，油耗也低,auto_home,3080,1,
好车好生活。,auto_home,25987,1,
任何产品都有不良率的，电子产品也不例外。车身电子配置在长时间服役之后也许会由最初的喜悦变成烦恼。但新车，这么短时间就出现，不太应该。希望能找出原因并解决。,auto_home,fcc257b412693b3c5ee86af5d3562fd0_7,-1,
感觉白色好看些 欢迎回踩,auto_home,10b3f09193061e06e723907e99d5b87e_56,1,
车也看那么久也对比段时间天气也越来越热决定还把GS4提回家再也用在受烈日爆嗮 管怎样先买个车代步讲究经济实惠性价比喜欢勿喷咱手中就这么you,auto_home,7442c8f6a38daeedda119db2172e116c,1,
汽车底盘出现异响 你要去找有经验的师傅给你先看看 有的是车身的一个零件坏了 造成的响声 还是你车上的东西 发出的响声 响声是不一样的 好好检查一下,auto_home,1367b2a2aefd75db3e5f63a26ef4527c_2,0,
  提车挺久了，来个提车认证吧，搞的都不专业了。国际惯例，以后准备好好在论坛学习，也好好分享。   提车还是顺利的，订车也是顺利的，看车也。。。。，套路啊，这个车不能看，真的，一看就被毒了，每天都在论坛各种研究，各种对比，看到帝豪GS，就是他了没话说了，专业的前脸，这样的配置，这样的中控，看起来太正点了，找不到任何吐槽的地方。该有的都有了，外观就不要说了，真的好看，说说最关注的配置吧。   帝豪GS可以说，一出来配置就是非常的热闹。其实大家最在意的还是ESP车身稳定系统、胎压监测、定速巡航还带有自适应、自动启停、自动驻车、自动空调等等，其实还有空气净化器，现在人都对自己安全健康等等比较关注，因为大家都知道人活着时间非常有限，等车都等了100多天的车主，你说情何以堪，帝豪GS真的好车，为何不做的更好点，扩产呢。,auto_home,15744a90bd9c7d09a63cc8630dbd7a74,1,
"                               致敬国产，支持自主！看我博越纵横天下、攻城略地。 看贴说明：1、请大家文明看贴，文明回贴；看我央央中华，乃礼仪之邦也！！           2、所有相片均采用手机HTC M8拍摄，不是专业相机拍摄，所以请专业拍摄大师勿以此论长短，先在此谢过。顺便说说HTC,是我有情怀的一个品牌，智能手机的开山鼻祖，曾经智能手机的NO1。认识HTC是因为在阅读的过程中知道了王永庆，然后知道了他的女儿王雪红，知道了她对战INTEL，对战IPHONE，对战SAMSUMG。也知道了一个人需要有信仰、有坚持。然后知道了止于至善，知道了《大学》，知道了王守仁，知道了《心学》知行合一......。所以 U11绝地反击、U12锦上添花。是如此！M8用了四年，无任何问题，自己解锁，刷了太多的ROM，有时一天刷几次ROM，从官方到民间，从民间到精简官方，现在用得很顺手，只是电池不是很好了，下一准备换电池升级系统待机时间。        3、对于博越车的整体性能，我会站在很公正的立场去说明，任何事情，有好的一面，那么难免会有不足之处，子曰：人非圣贤，孰能无过，过后能改，善莫大焉。这句话的重点在后面，过后能改。        4、音响的改装可能要等到9月份了，因为那时天气比较凉了时间相对充足，喜欢音响的朋友到时可以关注，也希望可以共同交流心得。        5、感谢：感谢父亲、母亲大人；感谢弟弟、弟妹、公司员工这几个月对我的帮助！感谢一路上遇到那么多热心的帮助我们的人，特别鸣谢：川主寺云来客栈的范总，在我儿子高烧的时候所给的无私帮助，非常感谢！     这个贴想发很久了，但锁事太多，公司有生意的事，要带儿子，要能加开会，所以一直没有时间写。特别是音响的改装，所有设备全准备好了，本来计划5月份改装完毕，然而事不隧人愿，大儿子不想读书，极度叛逆、作了无数工作，费了无数心血。所以很没心情，又加上要高改低，技术难度非常高，安全要求更高，基于此，我所有设备、线材均采用国际高标准，后面会有图片说明。           ————————————————分界线     耐心看—————————————————— 这里总结说说博越的长处和不足： 优点：1、操控不错、也许开了很多年车，自我感觉对车的控制还是比较好。       2、底盘，感觉低盘很整，悬架韧性好，过减速带或碎石路过滤不错，不生硬。       3、配置超高，特别是城市预碰撞，ACC，360度全景，倒车雷达，语音控制，蓝牙电话等真的很好用。对安全起到了很好的保护作用。       4、座椅很舒服，全真皮，为了享受真皮的美好，我没有加任何座椅套，       5、自动雨刷，这个真的好，特别是对新手，突然下大雨的时候，真的很管用。但有一个毛病，就是有时反应慢些，前档上面有时都几乎看不见了，才启动。这个有待加强。       说说不足，我开了一年，发现的一些问题：       1、底盘异响，开到4S店，吕总监直接判断为平衡杆螺丝松了，结果十多分钟解决问题，从那以后底盘再没有响过。谢谢吕总监，真是的好人，待人热情，技术很牛，今后还请多关照。       2、音响真的很一般，高频，中频还凑合，低频真的太差了。也许对有些朋友说还不错，我真的是不能听，我一共有三套音响，大部份都是自己改装来的，后面有我音响方面的介绍，大家看了就会知道我说音响为什么不好了，为什么要改了。       3、前摄相头模糊，吕师看了，直接帮我申请了一个，换了，现在很好。       4、座椅没有通风，这个真的应该有，这个是该有的却没有，实不应该。       5、因为AC不能关闭。空调面板换过一个，到现在很好。       6、夏天不开空调，不开风，怎么会有热风出来，脚下明显有很热的风，上面的空调出风口也明显感觉有热风出来，是什么问题？亲自试过几次，都是这样。  ——————————————————分界线   耐心看———————————————————————————                                      博越伴我九寨之旅 先说说这次的出行路线：广元—青川—姚渡（余家湾下高速。我的老家）—中庙—碧口—文县—九寨沟县—九寨沟—川主寺—返程。特别说明：在这条路上自驾游，因为弯道太多太急，又加上后面是高原地带，新手千万别来，看到很多外省车，开得很慢很小心，由于我们一直在这种环境中开车，比这急的，陡的弯道经历过很多，所以开起来也不觉得。整个路上超了很多车，因为儿子不好，所以开得很快，奔驰，宝马，V8等超了好些，因为时间紧，不好意思。不过不急的话不介意超车，因为有些路段实在危险。 到此，九寨游玩结束，但很多景点没有去，到宾馆儿子吃东西吐，开始发烧，感觉很不妙，赶紧去药店买了风寒感冒药，退烧药，温度计，到晚上一量，39度，赶紧喝了退烧药。第二天早上，吃了点稀饭，喝药吐了一铺，真的对不起，在这里特别向驿恋馨居的老板说声对不起。这里顺便说说驿恋馨居真的不错，价格便宜，服务好，环境安静。并且老板很热情。只可惜儿子不好，着急当时没有拍相片。下一站，川主寺，黄龙，若尔盖。 医生建议要等到儿子病情稳定之后才能上高原，所以第二天整天呆在宾馆里。但儿子病情并未好转，退烧药效过后，一直高烧40度，下午又去看了医生，又弄了药，看看是否有效。   —————————————————————分界线，耐心看——————————————————————                                                 音响篇 这是我家里自用的一套音响，音箱：JBL LX500，很老的箱，很醇厚的声音。 功放：英国音乐传真 A5，解析力很好，声音很通透，人声还原好。 CD机：纯音胆CD，飞利浦机芯，自己升级了金封运放，大盾黄胆管 解码器：诗韵，只负责低频输出；运放全部升级为OPA627金封。低频好很多。 低音炮功放：美国骄阳，加了日本牛，滤波好很多。骄阳很贵，但低频的量感和弹跳真的太好。 低音炮：德国尊宝SW500，很大，完全可以当茶几，效果嘛，听了自然知道。 说说HIFI加炮的感觉：听过好些HIFI系统，几十万，近百万的，声音的确不错，但我总觉得很多的书架箱，包括大书架箱在低频的处理都存在一定的欠缺。不过也难怪那么小的箱，想要出很好的低频量感，在理论上也是说不过去的。所以我一直想做一套很有低频量感，但又不能影响声音的整体均衡，经过无数次的偿试，终于做了一套，听来整个的声场开阔了很多，三段都完全出的来。感觉还不错。 这是我设计书房用的，因为书房面积较小，所以采用以前发烧过程中留下来的一对小书架箱：JBL 4206，机头，大众RCD510。重点说下这个RCD510，不是原版的，自已全面打造。功放块更换成博士TDA7564B，这个块子效果真的不一样，推力好，推我这个书架箱游刃有余，三段很好，很通透，人声表现很人声，只能这样说。电源采用的是DELL的原装电源，弄了这么多年的电脑，音响系统，没见过低压电源做得这么好的。机头内部做了运放板，这个是神器，运放块用了2604，无动手能力的，别玩这个。 这是给母亲大人做的一套系统，因为老人家年纪大了，设计思路是简单易操作，声音要好，所以也采用书架箱，书架箱全手工打造，我和弟弟做了很久，尺寸经过名箱的采集，高音为：德国丝腊尊宝；中低音为：英国的5寸博声；分频器采用：燕飞利仕两分频。机头没有经过打造，只是电源部分处理为高压转低压，不过这个电源滤不好，准备还是换成DELL的，真的不一样。另外加了解码器，大众的机头，大家知道的。 重点在下面，车机系统已准备完毕，计划9月份改装完毕，到时发作业贴。期待与音响爱好者交流， 四门隔音止震也已准备就绪，没有拍照，改音响系统以前已做过皮卡车的，也做过其它车的，有一定的经验及理论基础。所以特别说明：没动手能力的不要乱动，安全第一。对于我来说，博越这么好的车，不做一个好的音响系统，真的对不起它。最后，致敬国产，支持自主。 注：请大家文明看贴，文明回贴，谢谢了！因为平时比较忙，有些贴不能及时回，请见谅，谢谢！！",auto_home,31b286dcb095f1db2e2f91c79a3c6d3d,1,
路很好啊！就是昨晚开着开着前面上桥的地方居然有几块砖。。。这运气没蛇了,auto_home,2cd09d81e4ff7407420ccde21ce49447_3,0,
还是恭喜楼主喜得爱车吧,auto_home,522afbda3d4d9be7440fcaaeb67cd573_195,0,
&nbsp;提车的艰辛就不在这里一一诉说了，因为我相信大家都懂，本人不是什么男神，经常被人喊屌丝，不过在选车上可是一点也不马虎的，认定了就不会后悔，所以我选的是荣威ＲＸ５白色那款，我看到很多车友叫大白，的确，很像大白，尽管屌丝，也是值得拥有的。家里住的地方比较远，目前为止跑了两千多公里，基本都是上下班，半市区半郊区，平均车速在60左右，平均油耗基本维持在9.2个左右，感觉在同级别中算是中庸水平。不过两驱车型是非常省油的，比同级别的省油而且动力强劲。,auto_home,14ae11757fa8917cc036c85222a9c09a,1,
今年的天气热的不行啊，出门就好像要被烤焦了，最后还是跟家人坚持到了4S店买车，现在想想还是年初买车好啊，天气棒棒的，就算冷点多穿几件衣服就好了，不过年初买车属于旺季，家里人开始都说等谈季买划算点，所以我们就从年初一直只是关注了，期间也关注了很多车型，轿车种类和越野车种类几乎都看遍了，其中豪车的话只是发自内心的欣赏了，我自己定位的车型也就在十万到十八之间游走，就这样拖到了七月份，天气热的吓人，难怪很多门店都降价，估计是没人出门的缘故吧，我这人节省惯了，所以天气热点也没关系，只要能买车便宜点那也不算撒，最后经过一大家子商议决定买空间大点的，这样出门游玩方便，在经过几家对比之后，买了一款性价比还算不错的车子，而且还叫了亲朋好友吃了一顿，喜事嘛应该高兴高兴，废话也说一大堆了，现在分享一下我的最爱吧,auto_home,5ad4b7999f539dd9373499abb2818aec,0,
和我的一样，是自豪版的吗？你看下副驾驶前台的底部，就是放脚的那里是不是裸露的太厉害，还有车顶最前面的内饰边缘根本就没有包边，我买的有点后悔了。,auto_home,2061117fb2827b3380f816a933a0e327_30,-1,
主座椅右偏跟方向盘不对称，看我帖子,auto_home,4b8999b314ab9db6deb50e0af09d2249_4,-1,
&nbsp;&nbsp;&nbsp;&nbsp;&nbsp;从RX5上市到现在已经一年了，12月份经朋友介绍到4s&nbsp;店第一次看见实车，一眼就被吸引，当时是仅仅在哈佛H6与荣威RX5直接做决定，考虑了一个星期之后还是毅然决然的定下荣威RX5，空间大配置高动力又强劲，最主要的还有互联网功能，懒癌福音，当时家里人让我买白色，但是个人喜欢突出一点所以选择了蓝色互联网智享版，唯一的不足就是定金交完以后让我等了二十多天，没有现车不够卖的，心急火燎的终于盼来了我的荣威RX5！,auto_home,dc31cfa0787c384fe1bd9eb616b43d10,1,
谢谢楼主，你这车买的性价比确实不错,auto_home,5735910d1356470263f4c3ba125601ff_16,1,
说实在，我的车之前也没发生过抬不起离合，现在开起来感觉挺顺的。,auto_home,6e3133b19390738d642e5f7cef7682ca_5,1,
我也有想法入手哈弗H6，可有网友反应说天窗会漏水，是真的吗？,auto_home,45447e01d5423620b10eedc1fc02dd0c_44,0,
