content,content_source,source_id,sentiment_label,auto_related
"<div class=""tz-paragraph""> 首先 ，解释 一 下起这个标题 的原因 ：我应该算 得 上最早关注GS 的那批人 了吧 ，记 得那时候还都叫他狗剩 。最开始决定买车 的时候 是去年过完年时候啦 ，那时候每天刷汽车之家 ，无意间看到 了GS 的图片 ， 一 下子就被GS 的颜值所吸引 。慢慢 的开始加 了 一些当 地 的群 ， 更加深入 的 了解 了这款车 。后来到 了4月份 的时候经过各种渠道 ， 得知当 地有家4S店号称有第 一批授权 ，所以满怀期待 的就去直接交 了定金啦 。转眼到 了2016年5月4号 ，帝豪GS正式 上市 了 ，从那天起天天盼 着4S给打电话 ， 左等 右等 一直都 是说在路 上 。到 了6月份 的时候实在沉 不住气 了 ，打 了 一 下吉利 的400客服 ，结果客服说我这边没有第 一批授权 的4S店 。当时真 是感觉被坑 的有点惨 了 ，还 好正规4S店 ，经过沟通后痛痛快快 的把钱退给我 。到 了后来 ，因为工作原因买车 的需求已经 很迫切 了 ，就在已经开始寻找替代品 的时候 ，终于从各种渠道找到 了卖车 的店 。正 好巧 了 ，看车那天早晨到店 的第 一批车刚卸车摆到展厅 ，正 好只有 一辆1.8L运动版 ，最后 的结果就 是刚摆到展厅没到半天就被我收啦 ，哈哈哈哈 ！ ！ ！ 言归正传 。总结 一 下 一年 多来 的使用情况 。选择GS 的原因 ：第 一点 ，颜值 ！颜值 ！颜值 ！我相信 好 多准 一这款车 的人第 一点也 是看 的他 的颜值 ，记 得最开始开车 上班 的时候停单位院子里 ，经常会有人凑 上去看 ，朋友 的评价 大气 ，漂亮 。第 二点 ，性价比 高 ，无钥匙进入 、无钥匙启动 、AUTOHOLD 、全景天幕 、空气净化 、自动空调 、车窗 一键升降 、标配ESP ，等 一系列 的功能 ，试问除 了GS之外还有哪 一款同等价位 的车都有吗 ？ ？没有 ，只有帝豪GS 。 再说 一 下自己感觉中 的缺点 ：1.后备箱太 小2.油耗偏 高3.胎噪略 大 。这 是我认为 的 三点 。细说 的话又觉 着既然选择 了这款车 ，这些又都 不 是事 。后备箱 是 小点 ，但 是作为 一辆4440*1833*1560尺寸 的跨界车来说 ，同时兼顾2700 的轴距 ，后备箱略 小还 是可以接受 的 ，作为GS 一 大亮点 的后排座椅全部放平 ，使 得后备箱比任何同尺寸甚至 更 大尺寸 的车都 大 。毕竟有段时间都 是当做移动P房来宣传 的 。油耗 的话 ，国产车通病 ，我 的1.8L自动挡现在跑 了12500+油耗还在9.3 ，毕竟 一个人开车 一个样 ，个人驾驶习惯 不同 ，油耗也会 不同 的 。另外现在中石油中石化都 不定期搞优惠 ，实际油价4块 多 ， 一个月 下来500 左 右 的油费还 是可以接受 的 。胎噪 的问题 ，说实话开 的时间 长 了也就习惯 了 ，毕竟中配17寸 、顶配18寸 的 大脚 ，谁用谁知道 。 车无完车 ，只能 是说看缺点在 不在自己接受范围之内 。GS 是自己第 一辆车 ，现在开 了 一年 多 了 ，还 是感觉百看 不厌 。从当初看中这款车 ，到现在实际使用 一年 多 ，因为自己 小白 一个 ，没有对比 不知道 ，但 是同时 、朋友开过我车 的 、坐过我车 的 ，都觉 着 不管从驾驶感受还 是乘坐感受 ，在这个价位算 是 很 不错 得啦 。 最后加 一句 ，本人坐标山东淄博 ，我们有个车友群 ，有淄博 的车友欢迎 大家 一起交流学习 。</div><div class=""tz-figure""> <div class=""x-loaded"" style=""height: auto; width: 700px;""></div> <div layer2=""desc-s""></div> <div class=""description"">  2016.7.13提车照片  ，本人身  高190  ，GS车主算  高  的  了吧  ，开车驾驶空间感觉完全可以  。 </div> <div layer2=""desc-e""></div></div><div class=""tz-figure""> <div class=""x-loaded"" style=""height: auto; width: 700px;""></div> <div layer2=""desc-s""></div> <div class=""description"">  犀利  的鹰眼日间行车灯  ，吸睛利器  。 </div> <div layer2=""desc-e""></div></div><div class=""tz-figure""> <div class=""x-loaded"" style=""height: auto; width: 700px;""></div> <div layer2=""desc-s""></div> <div class=""description"">  这角度  ，完美颜值  ，独  一无  二  。 </div> <div layer2=""desc-e""></div></div><div class=""tz-figure""> <div class=""x-loaded"" style=""height: auto; width: 700px;""></div> <div layer2=""desc-s""></div> <div class=""description"">  下雨  了  ，  一起看雨吧  。 </div> <div layer2=""desc-e""></div></div><div class=""tz-figure""> <div class=""x-loaded"" style=""height: auto; width: 700px;""></div> <div layer2=""desc-s""></div> <div class=""description"">  8寸彩色  大屏  ，西湖断桥  的流线造型  。 </div> <div layer2=""desc-e""></div></div><div class=""tz-figure""> <div class=""x-loaded"" style=""height: auto; width: 700px;""></div> <div layer2=""desc-s""></div> <div class=""description"">  收获  的季节  ，谁还说拉  不  了  多  少东西  。 </div> <div layer2=""desc-e""></div></div><div class=""tz-figure""> <div class=""pic"" style=""width:700px;height:933px""></div> <div layer2=""desc-s""></div> <div class=""description"">  后排座椅全部放平之后  ，储物空间谁能比  。 </div> <div layer2=""desc-e""></div></div><div class=""tz-figure""> <div class=""pic"" style=""width:700px;height:525px""></div> <div layer2=""desc-s""></div> <div class=""description"">  换个角度再来  一张  ，想象  一  下  ，夜晚  的天空  ，打开天幕  ，后排放平  ，躺在车  上看星星  。有妹子陪  着那叫浪漫  ，没妹子陪  着那叫  。  。  。  。哈哈哈 </div> <div layer2=""desc-e""></div></div><div class=""tz-figure""> <div class=""pic"" style=""width:700px;height:933px""></div> <div layer2=""desc-s""></div> <div class=""description"">  2016.7.13至2017.7.25  一年跑  了12644公里  ，感谢狗剩没把我扔半路  上  。 </div> <div layer2=""desc-e""></div></div><div class=""tz-figure""> <div class=""pic"" style=""width:700px;height:466px""></div> <div layer2=""desc-s""></div> <div class=""description"">  车友聚会  ，感谢  高总给  的  大特写  。 </div> <div layer2=""desc-e""></div></div><div class=""tz-figure""> <div class=""pic"" style=""width:700px;height:466px""></div> <div layer2=""desc-s""></div> <div class=""description"">  车友聚会  ，集结中  。 </div> <div layer2=""desc-e""></div></div><div class=""tz-figure""> <div class=""pic"" style=""width:700px;height:466px""></div> <div layer2=""desc-s""></div> <div class=""description"">  排队中  。  。  。  。  。  。 </div> <div layer2=""desc-e""></div></div><div class=""tz-figure""> <div class=""pic"" style=""width:700px;height:525px""></div> <div layer2=""desc-s""></div> <div class=""description"">  排  好队  ，排  好队  。 </div> <div layer2=""desc-e""></div></div><div class=""tz-figure""> <div class=""pic"" style=""width:700px;height:305px""></div> <div layer2=""desc-s""></div> <div class=""description"">  全景  一张  ，雨中文昌湖  。 </div> <div layer2=""desc-e""></div></div><div class=""tz-figure""> <div class=""pic"" style=""width:700px;height:525px""></div> <div layer2=""desc-s""></div> <div class=""description"">  颜值担当  ，没毛病  。 </div> <div layer2=""desc-e""></div></div><div class=""tz-figure""> <div class=""pic"" style=""width:700px;height:466px""></div> <div layer2=""desc-s""></div> <div class=""description"">  一排屁股  。 </div> <div layer2=""desc-e""></div></div><div class=""tz-figure""> <div class=""pic"" style=""width:700px;height:525px""></div> <div layer2=""desc-s""></div> <div class=""description"">  车友聚会  ，没有什么  是  一顿烧烤解决  不  了  的  。 </div> <div layer2=""desc-e""></div></div><div class=""tz-figure""> <div class=""pic"" style=""width:700px;height:525px""></div> <div layer2=""desc-s""></div> <div class=""description"">  干杯  ，被问我为啥都  是饮料  。  开车  不喝酒  ，喝酒  不开车  ！  ！ </div> <div layer2=""desc-e""></div></div>",auto_home,266acca5020c4a748570cd3c2090ea70,1,
买车将近一个月了，确实很喜欢它，我给它取了一个名字“小青”，每次和”小青“出去都是信心满满，回头率着实很高，也着实很给面子，好几个朋友正想换车，介绍他们去了当地4s店，也已经订车了，作为自主品牌，我也很自豪，相信我们中国人自己的东西会越做越好！,auto_home,15d7c2e9de638c8c5cd69b59bf7a5f1b,1,
博越每天伴我上下班，很爽啊。,auto_home,5d275056ee96c4837acddcb666f434b0_13,1,
博越伴我行，楼主车开的也不少了，综合来说，博越的性价比很高,auto_home,48589da472ae8bc4ee3a315630ddc15d_33,1,
呵呵，夸的博越太神了,auto_home,57b9e63a4847c81bfe2efd95d96343a0_19,1,
国产的，和昂科威是一样的，发动机性能在国内还是数一数二的。,auto_home,3fd2ea60a32e182a8eb31a44a188dc2c_1,1,
前来回访，棕色博越喜欢,auto_home,37406987c3a5bf632888a535cbd2f245_173,1,
所以说啊！4s店永远都有借口，我的车严重抖动，4s店不管，厂家也不管，投诉315，车质网，质监局都不管！没办法只能认了！,auto_home,4b14aa8898f574613a536ac2209d7872_3,-1,
博越手动油耗，穿越比较费油！,auto_home,5f26829e8724f0475c44e6767ce681a1_459,ns,
多大排量，油耗这么低,auto_home,3a88e2640857709a9e555c8be52fdc5d_2,0,
楼主 2天了 现在还有异响吗 我的新车才开了一周 200公里 就已经开始了 阅读灯的地方异响 头顶也有异响,auto_home,6d2061cd6412e193b3386ebaddb64567_40,-1,
直接入正题吧…… 滑石寨位于重庆市梁平县金带镇滑石村3组，相距西南地区禅宗祖庭梁平双桂堂不到3公里。古寨位于一座拔地而起的纺锤形孤峰山顶，山四周皆是陡峭的悬崖峭壁，上山只有从绝壁上开凿而成的一条石阶小路。由于地势极其险要，古寨至今依然完好地保存着古碉楼、寨门、石厅等遗迹。 2015年，滑石古寨成功创建国家AAA级旅游景区。 先辈们留下的痕迹，总能给我们带来无穷的正能量。 滑石寨距离我们出发地还有一段路程，走老路得两个多小时，但告高速只需要50分钟，为了感受下沿途风景，我们选择了走老路，一路上青山绿水蓝天白云的环绕，确实能带来无尽的美好！ 爱车穿行在这片土地，带给家人的陪伴与快乐，一切都显得格外和谐！ 来时，路上山路居多，小六子完全没给我丢脸，不过说到油耗，确实很不错，但是说到动力，还是稍逊色了。 滑石寨，顾名思义，石头上的寨子！所以，我们是一路往上爬上来的，太阳不大，但却能爬出一身汗，正是因为艰难，所以才有了滑石寨深刻的意义！ 滑石寨的一路上都是山与石头的结合，也因为它孤独，才留下来让后人陪伴它！开发成旅游景区，我们能感受到的气息可能相对较少，不过，去之前不妨百度一下，让脑袋里浮现出它的英姿！ 到这里祈福的人也不少，看着这挂满带子和钥匙的护栏，自己也不由得许下愿望，希望一切都好！ 在半山腰上看着小六子，还是那么帅气！ 准备返程的三连拍！ 还别说，小六子的颜值还是很高的，虽然很久没洗车，但是照片还是非常美！ 返程走的高速，因为来时时间较长，坐得腰酸背痛，想早点回家休息。高速上小六子的表现还是很不错的，虽然是新车，但速度到120也没有问题！一路平稳！坐在后排也不觉得累，相比之下，小六子的空间还是能完胜很多合资小轿车的！昨天去加了290块钱油，起始里程是2057，看下次跑到多少加油吧！这段时间爱车的平均油耗都不动的，所以我也测不到到底多少油耗了，希望这次的油耗能有一个惊喜！加油，小六子！ end.,auto_home,758098257b7e1a24a9e553a7635812b0,1,
发动机声音不大  可以的,auto_home,26400,1,
好久不见了，不过W5车子总体说不错的，我开了4年没什么问题，就是这货厂家不重视，都不更新换代的。,auto_home,263088f68925278505d806e9ef4e0ad6_74,1,
恭喜恭喜，风景和车都很漂亮,auto_home,51c7482840208b53f644c5c5bb838d3e_397,1,
哈哈，真心很不错的一款车呢！,auto_home,a1c96c5bda71ecb0326a8192fe5a1e50_4,1,
蓝标蓝色漂亮啊,auto_home,6a9475af48a180f2b881c95316c56f82_259,1,
荣威i6，看了下，是辆好车。钱多点就上i6，钱少点就上gl；但是有一个问题，荣威不得不面对，那就是如果有上荣威次顶配，顶配的钱，就有大把合资的好车能选呢,auto_home,18904,cmp,
开去4s店检查开自动大灯行驶中突然所有的灯熄灭的问题，没有检查出问题的根本，就说可能光感传感器坏了，要换，才2个月啊，就要修，不舍得啊，能不能要求补偿啊？？？,auto_home,49500ffd8111a9fbca8b52a5e19ef07b,-1,
后备箱里边上边两根杆连接处全都是油。后备箱支撑杆也是比较掉价。,auto_home,24610,-1,
因为我觉得你都能把x1换标成x5，说明你觉得这车外形跟x5能比了。,auto_home,22173,cmp,
可以的 车子不错 我也在考虑入手,auto_home,26423,1,
恭喜提车，又多了一位博越车主,auto_home,56c9cf3b09f2165bf95c57103f77aebe_105,0,
车无完车zs的水准已经很强了。,auto_home,5df046850cc837cf824e91df3a1a54f6_35,1,
新6蓝标2.0空间足够大，动力充足，油耗目前还可以，转向少有虚位，但不影响，刹车感觉信心不足，急刹车可以，空调风量到3以上风声很大，其他的都很好！,auto_home,725ad2d2eeb11f0c0ad82c149529d4b0_1,1,
买得起车，加得起油，就这么简单，谢谢，不要拿什么吉利长城的来比，一概不会看的，懂吗？,auto_home,8286,0,
倒车影响的摄像头里面有水汽怎么处理？原厂的摄像头在哪能买到，多少钱一个？我在4S店问要600多一个。,auto_home,3ffb95821e8fb63cadaf532ff7a88801,-1,
各位大神，小弟有辆erx5，近日安装了行车记录仪，有停车监控的功能，请问长期打开会造成亏电无法启动吗？我是混动版，usb取电，用的是三元锂电池的电量还是发动机的蓄电池电量呀？,auto_home,9075,0,
这车最漂亮的地方就是全景天窗,auto_home,29f7c1d3bc8e500cb46fbebbba14cca7_127,1,
更换后视野开阔了许多。开车更安全了。,auto_home,7ef8872a01c61f83737205efee62424d_59,1,
一直来在论坛反映这个压缩机噪音的车主都是这情况，但是具体是什么原因什么部件发出的，真的不懂，厂家给很多车主换了管子没用，压缩机也有人换了也没用，有些想为哈弗洗白的人硬生生的说成空调出风口的风声，我就呵呵了，还有一些车主车子没开几天，就迫不及待的来证明没那声音，等车子开了千把两千公里后真没那声音再来说吧,auto_home,6dd40aeb1f360aa28854ad2bef6faead_23,-1,
这破车谁买谁上火。已卖！,auto_home,7d0bc3ff2cb827bd56d497a6de9745b4_9,-1,
方向盘的设计合理是一个方面，底盘调教好是一个方面，档位清晰好操控也是一个方面，所以说它的操控性真的很不错,auto_home,5516d48a7fdec52abc11c192d5c0fb90_102,1,
后备箱开启后两侧各有一根与车体之间的电线，检查有磨破或磨断的！应该是右侧的，记不清了，左侧好像是灯的！,auto_home,2b8601fa2672a24a89a8b51c19729bf0_2,-1,
一些托老拿外观尺寸来比较…带节奏… 真正懂车的是看空间轴距大小……而不是看外观尺寸……懂不……,auto_home,7f4aa487254b95a7e7800c51ebad6904,0,
我是按说明书上磨合的，1500公里以后随便开了，,auto_home,17646,1,
我得按你说的做做，看油耗真能降不,auto_home,7d1bf905c6b43b38146e4418319466aa_4,0,
rx5确实很漂亮。实车比图片还要靓,auto_home,4cdd9b5b4fd6577daa765cbc8323a475_115,1,
底盘只有一个H型钢，加两边侧面H 组合成最经典的3H结构，不过比日产闲逸强多了，还没有散架，只是断了两截,auto_home,57ebc4217435e08094b8a21282867703_13,-1,
看到这个东西不爽 为什么我们的顶配都少这么多配置。最蛋疼的就是座椅调节  ,auto_home,19a5511b4546b720246aecfd0fbd5e8d_202,-1,
我看协议了 两个月内提车 。。。今晚店里的经理打电话过来，忽悠我说这配置的车还没牌产，真是搞笑,auto_home,19336,-1,
北汽的车混军界了，我们就警界吧，比较贴近生活，实用，嘿嘿,auto_home,1e4c4eba431d58811e475d7a14eaf316_7,1,
这个确实是，好手都自己单干了，不过没办法，就算是召回，估计也是让当地店里维修工帮着去做。,auto_home,23c7f04e1664bfe5268ad82c9b970075_11,0,
车的颜色还不错阿,auto_home,20b088ff368d32f60543e2a4e2c2424c_16,1,
最近还是一直沸沸扬扬的讨论帝豪GL更换液压分离轴承的事情。其实不管再怎么说，这次手动挡的车友受到的伤害实在是太大了 在这里还是希望大家能够以一个平顺的心态去看待这个问题，在我们聊城帝豪GL群里，暂时还没有更换液压分离轴承的车友，我相信这个只是概率问题，我的GL开了大半年了，但是基本没什么毛病，一直都是非常给力的再帮助我，给我的生活带来了很多便利，不得不说帝豪GL是一款非常不错的车型，无论在配置、舒适性等综合方面，帝豪GL在同级别中都是NO.1的存在，其实这次暴露的问题，在很多车黑的无限放大之下，事情就变得非常恶劣。在这里还是要提醒大家，不要盲目的跟风。可能这一批有问题的车型，秉承着诚信的原则，吉利汽车为每一位手动挡的车友免费更换液压分离轴承。其中我感觉责任最重要的不是吉利汽车厂家，而是很多四儿子店，很多维修工在更换过程中，出现很多失误，这才导致很多手动挡车型的用户不满，所以很多事情都不好说，不能一件事情，就否定了整个车型。 好了，就说这么多吧，晒晒我的小金吧 好了，就写这么多吧，还是希望大家能够用车愉快，希望能和大家有更多的交流！,auto_home,6b50957096eef17c3cb6b75fb40a4370,1,
后备箱空间很满意，能装很多货，以前小车得跑两三趟的货把后排座椅放倒一次就能全托走,auto_home,101e60a5160644335766955c8aec4e5f_75,1,
汽油不好是黑烟，烧机油是蓝烟，有点棘手,auto_home,212cad13af5568a2c3d010963c9dcdd6_24,-1,
恭喜提车。现在有不少人都等着别人做小白鼠那，以后多发点动力方面的感受吧。现在这个2.0t数据上不怎么出彩，我本来以为至少能上h7那个231马力，没想到才197马力，估计是为了省油和匹配新变速箱，也就是动力并没发挥出来。我订车那时1.3车别说试驾，连展车都没，后来才定了酷派。,auto_home,303a2d738036a707f329137811573ed1_1,0,
估计是轮胎质量不好，让玛吉斯赔,auto_home,b7417df69211b4d15eebca229bb1be20_8,-1,
如果真如楼主所说100以上就不稳，那这车确实不行,auto_home,272fdf5996c1f9e38028bd1b36014eea_61,-1,
我是X20.考虑到哈曼假货遍地，选择了美国来福的喇叭。买了bo功放发现原车电脑看不到功放，换了哈曼卡顿顶级高保真功放，电脑还是看不到功放。但可以工作！原车新X1貌似就不支持升级哈曼卡顿功放，和bo功放,auto_home,23073,0,
过完元旦提的车，第二天就发现跑偏，不拽着就往右跑，4S又没有四轮定位，折磨了大半年，上周去了100公里外的另一个4S，做了四轮定位，强了不少，跑偏这个事不做四轮定位是弄不好的,auto_home,78f555e97bbce11c407c2bfa949993ba_18,-1,
i6掉发动机，简直就是奇闻。,auto_home,6a17d82ce623725073eafeda804d44f0_293,-1,
差评，没有女司机,auto_home,24742,0,
顿挫大关键还是看人。你松油门太快了肯定顿挫啊，慢收油门就不顿了,auto_home,4a896cf3c2efed6c9f1640846cee1e0c_6,-1,
还在观望，都说这个车离合器不是很好，跑110发动机振动很强烈。而且这个车定价有点虚,auto_home,67757d6073470d3bdf506e0e678e3ef7_199,-1,
发现吉利博越异响给换过半轴后，大概行驶的有1500公里后又开始异响，(根据路况异响的频繁率会增多），然而异响还没解决又发现发动机铁屑，又给换了机油尺，目前一万四千公里，又发现气门室盖侧边漏油，4s怀疑是保养时油溅再上面的，用清洗液洗了两次，现在还是渗油，买个车子不容易呀，就这样忽悠来忽悠去，现在16000公里，气门室垫圈也换了，气门室盖也换了，麻痹还是漏油，被4s店各种理由推脱，想骂人，垫圈换了，换盖子还是漏油，反复修反复漏,auto_home,7ad89902adca0dc372fd6c3e22c6c30f,-1,
我是从19.9油耗过来的，，,auto_home,16050,0,
韩国车做工垃圾，操控垃圾,auto_home,535d596a515d7f3e9a85179b191337cd_13,-1,
昨晚开了一次朋友的车，此车漆面颜色洁白，车况保养良好，双透镜大灯锐利有质感，车尾线条浑圆丰厚，都市型SUV。。。 朋友的车第一次开，有点战战兢兢。还是直接上车，内饰不算豪华，但皮面光滑，配置手感不错。车内空间不大，但也没有压迫感，上出风口有尘，直接用嘴处理了一下。一番熟悉之后，插入钥匙打火，车况不熟，有点忙乱，钥匙插了几次才全进。打火后，能明显感觉到发动机有抖动，隔音效果一般。缓慢加油至3000 转，车身也明显感觉到抖动，伴有杂音。三十分钟后观察，下排气出水，排气管口有熏黑现象。但感觉动力澎湃充足，缸内直喷就是爽！！,auto_home,7cce8a3d5cca8977036b5a427a3a0c73_364,1,
对于新手来说这车就要多开多用，从我驾驶体验来说，车就是你对它好，它也对你好，最起码开到现在没有一点小毛病，也没出现过哪里有异响。有过此类问题的车友也不要着急，多问问老司机。都是小事儿。人无完人、车无完车嘛。 至于油耗方面好多人都问，每次你把车停在那里，肯定会有人上前问的，无非就是这车多少钱啊，油耗啊，必问的。油耗这东西真没法说，每个人开车习惯不同，还有路程长短啊，当时的路况啊都会有影响。反正我对油耗并不是很关注，都能接受，也具体算过，现在平均在10个左右，不到10个。这分量，这动力可以了。能满足大部分人。好了，反正每个车都有它的优缺点，找到一部适合自己，够用的车就行了。以前可能说吉利品牌都是小众车，现在做的真心挺棒的，我身边好多朋友现在也在开，从博越的身上就能完美的体现出来。该车推荐指数★★★★★（五颗星） 。下面就来欣赏吧。。。  ,auto_home,2121764e3b33e9aaa547b49024770134,1,
博越就有一种魔力，看着，试驾着，就开回家了！呵呵！,auto_home,341b6a3913219869e1e542670cadbd29_103,1,
就是你看的车型，15305576851,auto_home,27fb0d9f566b974c85d0c4c6f6179d5a_19,0,
喜欢奇瑞车的，不少是被其高速的稳定性和运动的操控性所吸引，换句话说，就是高速的抓地力强，拐弯、变线稳当，让人很有信心，即使在暴雨天行驶也很从容。这些表现得益于优良的具有运动性的底盘结构设计和刚性材料的应用。其实，奇瑞汽车最突出的特点，就是运动性底盘的调校。从早年的旗云运动版一直到后来的A3、G5、威麟X5、艾瑞泽5、艾瑞泽7、瑞虎7无不烙上了运动的基因。,auto_home,54f5bd4a3e04c420e220accfa1fc0662_85,1,
