content,content_source,source_id,sentiment_label,auto_related
另一种可能也许是用于双龙主席的上汽版——荣威R95上，现在上汽手上技术储备和资源很多，不太好判断。,auto_home,39c66231160d91ec30b667166fbcacd7_206,0,
发动机的机脚架换一下，完美解决 论坛里很多人换的,auto_home,51f17cf8f954a5ce0040c5e253e91dc2_4,,0.0
能不能细致描述一下怎么加 加在卡扣哪里啊？ 门板你会拆不 不想去4S 找了几次都服务不好,auto_home,ef4e2b473a2eddc3e60f47ce07ede730_21,-1,
H1虽然小但真的是代步最好的选择了,auto_home,20b088ff368d32f60543e2a4e2c2424c_59,1,
我是先敲章，然后再订车的。毕竟心里没底啊,auto_home,4058c69aae2f97c95ab5b241254854c3_59,0,
为什么在你们眼里他们是在互搏？我搞不懂你们为什么这么说？只是走的路线不一样，在上汽内部根本没这个说法！,auto_home,71a64460b58364830b20cc9dbd78bdf6_3,0,
秦这款车的市场反应还是相当不错的，用车也相当的经济。个人更喜欢秦这款车。仅供参考,auto_home,3d98f427308b6f03fc919c0f2339b1ef_13,1,
档位我倒没发现异响，关键我才提车一天就出现倒车影像黑屏我是不是应该找4儿子了,auto_home,7503ba56a0e3bb39cdd8854b3956e3e4_7,-1,
口哨声是正常的声音吗？对日常使用有影响吗？我的不知道没注意还是没有。。只要没毛病就无所谓。发动机还有声音呢。。,auto_home,24999,0,
我的也是钛铂金智慧,auto_home,43e4b9ee9b5a140608be57291b4c4735_12,0,
除了油耗，目前一切满意,auto_home,7bdb3a6b2ef77cf129821a7cf6432b2e_8,1,
你的变速箱震动解决了吗？朋友,auto_home,13197ff2509abec21175514ce2626ff1_12,0,
车子不错，帖子也不错,auto_home,26391,1,
我喜欢红色，我等了三个多月。,auto_home,50f0dcca8e187536ea00c4f81a6d931b_42,0,
博越是好车，除了油耗高点，储物空间不足，其他真不错,auto_home,61a72975a57148eaeac9a10c8716c4ba_13,1,
补充一下：这款车子支持远程APP启动发动机，和远程APP打开车门功能，请问为什么不能支持远程APP关闭车窗和打开车窗呢？哪怕长按锁门或者开门遥控也行啊，这些功能在传统的汽车上面都有的，为什么号称互联网汽车的RX5就没有呢？另外后排的充电插座盖子怎么会设计成这样，而且还没有USB接口，很容易一脚踩没了啊！,auto_home,703e701774dcc66265a98a2a1fa1ffa1_1,-1,
都说是17款的拉，不过我车子问题好多，被销售坑了，给的库存车,auto_home,367306e0e04ffdd98f481995fb4b6846_4,-1,
采纳的答案什么鬼   车门异响去4S涂膜静音油，最近厂家出的解决方案,auto_home,3d49a13f03090d34940a54ea70ad71bb_11,0,
我这也有一辆老三，10年的，4W公里 1.4手动的,auto_home,e7d67a60b631cc7d800a67769cb42aa0_15,0,
开车要的就是动态加速，油门响应快，动力随叫随到，紧急并线干脆。,auto_home,4fb7c772522e5a40d8c242728ac7e548_982,1,
荣威的话，肯定选省油，耐用的喽。推荐普利司通绿歌伴~~,auto_home,6b7be513f40a2984e4f446a5d8a6c1fd_9,1,
车美，人美，景美！都美呆了,auto_home,27c1c91231a7a3050cc0d4ccbd396e60_3,1,
各方面性能都很卓越，是首选车型,auto_home,a7b0b148239dcab4aa3de6e14e260170_15,1,
绝对性价比超高的车，生活确实因此而改变,auto_home,3798dc5cd5ddf3ba88e6bdc4eae53caf_54,1,
混动版的eRX5已经上市了，有人发了提车贴的，你可以搜一下。RX5 EV纯电动的，还没有上市。,auto_home,343,0,
我试驾的时候就感觉到了，这车减震很硬，但过弯侧倾很小，这回换国产车就是因为国产车毛病很少，真有毛病也不是那种致命的，这点还是非常可靠的。,auto_home,8636,1,
不知道的还以为这车只有白色，看到论坛提的全是白车。终于有个不一样的，还是金色高端大气上档次！,auto_home,1e0e0b9c428f5471bdca64e07d21c266_4,1,
没有看到一辆灰色，灰色哪有啊。我最中意的颜色。,auto_home,65dfbb5cc7339f712bfb022c6177def2_4,,0.0
真是挺值的！  车子稀有 银色更加稀有  还银色外观大赞 动力配置也不比新出的中级车差 况且现在的车是一年比一年简配  楼主留着开到报废吧  这个价格买到的好车再转手就是亏了,auto_home,6a8bee9bf41547f6d71ee7f57ef48c26_103,1,
这车上高速胎噪大了点！越野车嘛悬挂硬正常！没有大众途观地盘厚重感！,auto_home,55fcae6bf0a599bfb6d04a301f63e2ab_68,-1,
在汽车之家闲逛，突然gs让我眼前亮，便决定去4s店看看，看到它庐山真面目之后我便深深爱上它帅气外形 完美配置  规整内饰……让我喜爱，毅然决然的就交了定金，三个月的漫长等待，终于让我等到你 最后总结下感受，就是大爱咯，无论是动力，外观，内饰，油耗，都符合我心里的那个它,auto_home,5fea29b7ec27dd5eb567cf5a5d0e1a6f,1,
遥控钥匙离开车3米自动锁车,auto_home,5f54724e8b343de7049a68bd647625ef_3,0,
想超车时提前一点时间给油,auto_home,e3ff186fb2e5a97b767439b881a03c60_31,0,
然后4s店会对你说，请拿出外面修车厂的合格资质证明，,auto_home,b20684d6b532eddc58d6dfeb103bb380_2,0,
你的车腐蚀的情况和我的一样，我的比你还要严重。不错，防范于未然,auto_home,3d9db6da2483330331b0b184dcd84ebb_1,0,
我现在的中控很不好用，不好开锁及锁车，我想自己加装一套中控锁，可是车车自带的有中控防盗，报警的时候必须用原车遥控解锁，不知道哪位师兄知道怎么自己加装中控，而且不用以前的遥控解锁啊！,auto_home,7d422d4351f0c484d52eaece4d6a4c5d,,0.0
我的今天空调也坏了 真他奶奶的垃圾 空调不出风了 不晓得什么原因,auto_home,7d858705f373f6c25e983f2ec6af9215_12,-1,
吉利是我们自主品牌的希望，博越是我们的骄傲,auto_home,1f24ec9945815acfcb8d47599f89d10f_238,1,
方向盘套接缝咋歪的，看着不爽,auto_home,4ba80f0b4065979fb826496a928249f3_47,-1,
带刹车啊？刹车盘变形?,auto_home,323b1ef4b55ad6f438a1e34863462433_2,0,
博越的外观我很喜欢，锐利大气，辨识度极高。,auto_home,28f3090f4ce7e06a05af67595e812580_114,1,
有一点是必须赞赏的，名爵ZS空间足够大很拉轰哇。,auto_home,d9049df57161b25f0326c4bcfda38450_181,1,
都这样，刹车盘太硬，跑跑再看吧，我的也响,auto_home,7911437893d831baf35c1312ae1d8a5e_2,-1,
发动机打火时有咔咔的声音就赶快去检查，我的就是一直拖着没去。,auto_home,1d1f9ad342943f98938ef5fafe755158_5,-1,
做做保养，清进气道、节气门、打打吊瓶，加点燃油添加剂就得了，再不行换车吧，这车只能代步，激情不了咯,auto_home,22144b70369e08c086fcff65dbc0fcc1_6,0,
只换了油，滤芯可以考虑跟换，油底壳不用,auto_home,7e2de4485ac1cb9d6fb84309c81c4768_11,0,
有问题可别找4S店，4S店是黑社会，我也是i6车主无奈啊,auto_home,1857cc68188a9b38740f69b1cc946c21_123,-1,
超车加速初段2秒左右很肉，不过可以用换挡拨片超车，超过了再切换自动挡，但总有点不方便。,auto_home,311b8a4a95ae82b4f10d2dd8cc652721_1,-1,
高颜值，内饰也比较好。大全景天窗好吸引人，斑马系统好用，可以通过手机操作上锁解锁或者不用带车钥匙开车这个很爽。,auto_home,7fedd2e8defc771521a6b24cd9ea9c6d_30,1,
兄弟，新款全系都是标配LED大灯，除了入门的丐版外！,auto_home,22290,0,
博越，值得拥有，天津车友虫子前来支持,auto_home,1c16adefa50bcf4e701be364330164fe_93,1,
2.0的也不错,auto_home,7ab2aaf6943517c559ede0bbddd78e8a_178,1,
别怀疑，是真博越，博越手动都异响顿挫啊！,auto_home,43d881f69008aac061d7f0ed81ce96a6_16,-1,
"博世9.1系统的锅，博越不背。 40码,ABS完全启动介入！",auto_home,148ebd0ffeb43ad44830b2ba6b6f40bd_25,ns,
不贵，换个led的，200-400多都有，马叔叔家有卖！装逼又帅气，,auto_home,15766,1,
新款博越有消息吗？什么时候出？,auto_home,1a16682f86a545a0665980de5514c97b_124,0,
我四月的新车也是佳通,auto_home,16660,0,
买车的打算已经产生两个月了，今天终于迈出了第二步——去4S店实地考察。看了好多车型，对比来对比去还是觉得荣威EI6不错，虽说是国产吧！但在配置上丝毫不比合资差，尤其是车的配置，性能，动力方面，与同级别车型相比不能说比同级别车型高吧，但也是数一数二的。像是yunos系统，虽说已经在荣威EI6，荣威i6车型上出现过，但功能听说很强大。除此之外，在动力方面，还搭载了“绿芯”新能源科技，在节油方面也是不用说。额~对了，还有两点，一是旋钮式换挡，二是液晶仪表盘，总而言之，不到二十万能入手这样一车型，我觉得蛮划算，只是没能试驾，想问问坛中有试驾的吗？我想听听你们的切身感受。,auto_home,582930af98899b4dd6e7ec770571eac4,1,
只统计投诉次数不分析投诉类型意义不大，像博越那个很多投诉是不能按时交车,auto_home,42b6e7177051c0e6a1cb3536c78b28bb_5,0,
受广州车友会副会长林总毒害，纠结多日终于下手（搞了个团购，优惠了不少）。由于我的是自豪不需要安装胎压监测，所以更换过程非常简单，下面放点图与车友们共享，希望能帮助到大家（高手路过，忽踩）。  总结一下：换了这款安卓中控后，操控性要比原车好很多很多，音质也有较大的提升（高音清晰，中音宽广，低音有力）。最方便的是可以语音控制导航，只要说出目的地，她就会帮你规划好路线自动弹出导航界面。装了微信后可以边开车边听群聊了，也可以象手机一样点按朋友发来的位置自动弹出高德导航。自带内置的记录仪可玩性也挺高的，有车距感应提醒，有压线预警等等。手机同屏玩王者荣耀。 时间匆忙，还有很多功能没玩透。等过段时间出个使用教程。,auto_home,23e7d4073aa54d814f3e7baa86904ffd,1,
底盘确实比较低。 管线直接暴露在外，不太好。,auto_home,60599fde97e163aede332eb52ef0bf17_4,-1,
博越确实油耗高,auto_home,5bff5466dab62cdff0a710089107be80_9,-1,
胎噪怎么样，地盘噪音么,auto_home,6613bde36f132e29fb16d31b70ab0023_10,0,
确定不是轮胎，恩恩恩的响，发动机或者地盘大发出的，方向盘有点震动,auto_home,63f0a36f0d6485125437cde13b073153_3,-1,
哥们你车优惠多少钱提的,auto_home,2a086d09b686c2de5998d6d7a1868a7b_12,0,
它拥有良好的通过性，舒适的乘坐环境，优异的安全性，可以适应各种路况环境,auto_home,255eb169b16f6579fbba87b8ba23a585_15,1,
给zs上的操控什么的说一下的话，实力真的比合资了。,auto_home,db0b5dffa12051db55af2a7035d8f060_143,1,
LZ你车窗装饰条是包边的吧？多少M拿下的,auto_home,26ab955f4d7e16514bd4b9a7f698f8dc_95,0,
我现在基本就是 起步慢深踩， 3000转松一下在踩， 基本都是 3000转+ 以上切档。 如果超车的话， S 手动 4000+ 拨片换。。 烧气。。。。 按照百分比来算的话 烧油100% 烧气70% 烧气加点火提前器85% 只能这么给你分析了！,auto_home,3751eae6a2cd2e93e8b82138e32c2312_27,0,
油耗确实高，我表哥就说油耗很高，今天开了350多公里，遭了43个油,auto_home,32cd4df0b8b2b0b5e5862b3c8af5fd80_8,-1,
反正我是会选互联版，大屏的功能就不说了，18寸轮圈，雾灯，侧气囊，全景天窗（互联版送）都是旗舰版没有的,auto_home,6516dcd9d1a664e78ceadc714e0ca160_5,1,
身边的朋友陆陆续续买了车，自己装逼的心情也日益膨胀，每当看见别人在朋友圈晒开车出去旅游的照片，心里躁动的狠呀，有买车的想法有一年多了，天天被身边的朋友洗脑。。。一次偶然的机会被路边停着的一辆吉利车子外观吸引，就在网上搜了一下，慢慢的开始了研究帝豪GL这款车，所谓情人眼里出西施，越看越喜欢，价格配置都适合现在追求装逼的我，在经过慎重考虑之后，与老婆达成共识，去四儿子店看车！！！！在店内销售的甜言蜜语攻击下，差点就一次下定，最后还是老婆理智，价格方面还想压价，留了电话给四儿子说回家商量下，第二天销售就打电话邀再次看车，电话里压了下价，后面还是挡不住装逼的心态去了店里，经过一段砍价后终于下定决心把车子定下来了，不得不佩服做销售的洗脑功力，其实嘴巴说干了，价格也没什么优惠。。。。经过半个多月的漫长等待，终于来了我的大GG废话不多说，上图实在,auto_home,1f3c0ed201a3e6bade28aaf0742637a5,1,
楼主是爱车之人,auto_home,3eba6fba3673dfae91e83ab830ecc9e5_16,0,
加热功能下雨天起的话ZS就非常安全了。,auto_home,7ca55d92742d4e861400f68d74a1ffad_59,1,
检查了，没有漏水的痕迹，加满防冻液，过不了3天就没水了！,auto_home,7b3947deea67dbe2f9590a4c21ba0d5d,-1,
站在车子上的霸气，,auto_home,1bb9eb332e796196e39feecec20c1783_6,1,
卖不好主要问题集中在 1、手动档配置差了些。 2、自动档干式的都怕质量问题。 3、应该全系用独立悬挂系统。 4、相比较其他国产的价格偏高。性价比不高。,auto_home,62f66ccf91ec61e30881c17d0272d81c_16,-1,
回头我也试一试，车门的那种吱钮吱钮的响声还是挺烦人的,auto_home,7539871a0fe9178810a9ced78810a0c1_164,-1,
所以说啊，rx5买的真不便宜。。。,auto_home,7967,0,
现在很多人都在说新能源汽车的问题，也有各种的质疑和吐糟，其实，买车就是看个人啊，你喜欢就买啊，不喜欢就忽视，没有什么大不了的吧，为什么一次次的疯了一样的黑国产车？？   有这么多的新能源汽车，合资的，进口的，还有我们国产的，相比合资进口的高价，还是蛮认可国产的合理的价位的车，而且配置也不比他们差的多吧。     相比合资和进口还有同级车，我还是比较看重的是荣威i6，品牌品质都很好，配置和科技性能也非常的有力度，更关键这款车有支付宝的接入啊这个也是非常的有好感度的，另外主要是价格能接受，看网上的口碑似乎也不错我就想买ei6了，其他你们随便吧，自己适合就好，其他无所谓。,auto_home,be3b13eda0d92dd2897fa0a36d3255a0,1,
博越油耗也很高,auto_home,787c27a1cf52a760781bcd50fab15c75_11,-1,
妹子我终于要成为有车一族了！终于不用等男朋友时间了，终于可以想去哪自己开车就去了。听我说妹子们，独立很重要经济独立尤为重要，只有自己有了底气才更自信才不会怕生活的各种变故吧/哈哈有感而发下看车到现在订车自己其实也纠结了一段时间一直都在问身边的朋友到底怎么样，朋友都说哎呀你一个女的车就是代步主要自己喜欢就行了呗，配置说得过去就行，自己一想也是不能给自己太大压力。毕竟我的大目标在后面呢～拉上朋友走订车去，都说4s店套路深我不得拉个懂行的啊！别说哈朋友挺厉害光东西就送了不少今天一来看到她们展厅放了一个青色的车。感觉也挺好看纠结了下颜色！最终选择了白色觉得红色青色开开就过时！白色才是经典色！,auto_home,26214,1,
功能非常好，zs的斑马系统可是非常强的。,auto_home,44e6ed5c259d81166086e56779fc3be7_27,1,
某4应该是在做工上，用料不好导致的,auto_home,7b4a9afbfa1964d8b580f96c780a62a5_3,-1,
支持205-55-16.我的后轮了半年多了。但是前轮还没换，主要是原来的轮胎还可以用，到时候再把前轮也换成55-16的。 后轮明显比前轮要高一点，但是稍微要窄一点，是扁平率的关系。,auto_home,292d988ee94f81f16c3cffeaf478cf85_14,0,
我用车10个月，之前远程空调从未成功过； 最近车机升级到1.1.1， 手机APP升级到1.2.1，突然试了下可以远程启动空调，很惊喜！,auto_home,c26b639fa8dd8fddffa642897aaa3b20_10,1,
秦EV300新增和升级了多项高科技和安全实用的配置，补贴后价格在17左右，性价比高，在北京不限行不限号优势明显，上下班接送孩子上下学真是最佳之选用车。但存在的最大问题是停车位和充电问题，希望政府有个完美的解决方案。,auto_home,73aee5c36461819ea122ddf930d61147_7,1,
我感觉这车动力是ok，但是推背感没开出来！我也定了熏黑大灯！来你这取取经先,auto_home,695e727a7d9dda906fd56f0688c9b024_71,1,
说实话。这车挺好看的，起码看起来顺眼，而且没有廉价感，这就是进步，越来越好！,auto_home,8450,1,
没有水箱吧，现在都是加制冷液了！,auto_home,3678e90860e96376ffada4957f697b6a_2,0,
汽车配件质量有问题，而且还是大批量的，这还用问吗？根本就是一点责任心都没有,auto_home,4475130dbc1133d16426738cad9a3d60_7,-1,
其实你也可以到4S找一台顶配的试驾车，调到不同模式感受一下，自己的感受应该会更加直观,auto_home,23176,0,
车不错，挺你。媳妇和妹子更不错，看着都舒服。呵呵??,auto_home,2cba855943a843ecf5b3752a4d0ffd91_1220,1,
跑二万以上物有所值,auto_home,4bb0164485adc345e6d9d4f4b9809059_12,1,
一看断两截，不开空调直冒冷汗,auto_home,5ea49294cdf9e1b86a6256a0f8fa2118_5,-1,
前段时间发现起步升档要保持2000转行驶100米才会感觉抖然后切正常今天早出门还老样子过架行驶概60码又感觉车子抖然后就加速也就说怎么板油都能超过80码发动机转速狂转这车买回来问题断病痛我就将就这次知道变速箱问题女司机心脏真有点承受故发此贴向各位神们求助还请知道问题所在神们急速告知,auto_home,62c1fd0afaa8b7ab5c9865b4401cc4ed,-1,
比较满意的是它的外观和内饰，还有它的互联网大屏幕10。4寸真的不错。不满意的是这车没有前置雷达，在路上车多时总是小心翼翼的。对于油耗还是比较满意的，空调制冷效果较好，制冷速度快。座椅舒适性好，没有特别硬的感觉。全景天窗使车里空间显得更亮。,auto_home,6d4cbe39009ab3191e17acc193a67dd3,1,
四年多，我就开了一万六千多点，起步还是很给力的。,auto_home,5e8c2afa939a96f2038b2416c5ce5468_4,1,
我想要个后备箱的那隔物板. 还在不在！,auto_home,52bd01d9435f60f340bcb805ea4076fb_1,0,
你说的一点不错，1.3根本不省油，我的1.3不开空调大概7—8个油，开空调，那就不说了9—10个左右，开个空调提速恨不得下车推！,auto_home,451c955f7c544281aa9e36da95318a8d_10,-1,
H6论坛极力掩盖空调缺陷问题，多处网络媒体已曝光。,auto_home,3e1c9d98bf6ca721efd6c25548512c30_2,-1,
不需要天窗就手动豪华，要天窗就上手动旗舰版,auto_home,4df256cf43cd2ffb71bbfc83f39e9620_2,0,
不知道为什么，文章是有标点符号的，但是却不显示？而且文字也有丢失。 说明：     首先，发表此贴是为了以自身为例子提醒大家注意安全，顺便记录自己提车前后的用车情况； 很荣幸提车开始写的几篇帖子都被加精并且有的被选入每日精选，没想到这篇快要沉寂的帖子也被选入论坛精选日报，却导致一些人未仔细看正文就开喷，对于脏话谩骂类回复本人将不在回复，欢迎客观、公正、合理以及和谐的讨论。     其次，文章内容阐述的是自己几个月来走高速的真实行车体会，以及真实事故的客观情况说明，没有映射任何人和事物以及政策，请勿妄自揣摩给我扣帽子。     再次，关于此次事故，现场判我是全责，而且我是很痛快的签字的，虽然我的车被拖行了几米，并且判决时未考虑卡车路口加速变道的情况，但是光“右转让直行”这一个前置条件就足够了，谁也没话说。所以我本意也不是让大家对这个结果过多讨论，而是对事故引起警惕。     第四，关于路上尤其是高速上强行加塞变道的行为这是客观存在的现状，也是本人的真实感受（每天从嘉定到市区，往返近百公里），并且并没有低于车流速度占道行驶，这点请注意。相信经常跑高速（尤其是S5）的人应该都知道这条路上这种情况真的挺多的，尤其下雨天。     最后，请和谐讨论，注意措辞，不接受脏话谩骂，谢谢！ ————以下是正文原文————     本人新手，四月中旬提的eRX5，提车后第一时间就发了提车作业，还有幸被选入论坛每日精选上了几天首页，在此感谢荣威俱乐部与之家论坛版主和小编的看重。     回归正题，自四月份提车以来，一直小心翼翼的开，连轻微剐蹭都没出现过，这在新手新车阶段应该也算比较不错的了，然而乐极生悲，在一个诸事不顺（这应该算是预警了吧）的一天晚上，清晰的记得那天是5月3日。在S5出口右转时，转弯进道后车速还跟慢，这时一辆直行的卡车直接路口变道斜后方超上来斜插到了我前方，卡车后保险杠从我车大灯处直接讲引擎盖勾了起来，现场无比惨烈，幸好人员无伤（当时车里一点撞击的感觉都没有，完全感觉不到撞击感）。接下来就是双方冷静地报警。     警察过来后，大概了解了情况，然后看了我驾照还在实习期，马上态度就有了明显的转变，话不多说，直接开了责任认定书判我全责，外加一张3分200的罚单，无奈只能认罚，谁叫我是右转呢，在此提醒大家，开车还是多谨慎小心，注意安全，远离那几大危险车种，插个题外话，我在高速路和市区道路无数次被大巴车和公交车强插，数次都很危险。     回到正题，对方车辆毫发无损，又是外地保险，再加上司机也心虚，直接处理完就溜了，我距离家里还有五公里左右，开着破车慢悠悠爬回去了，一路上吸引了无数目光，甚至回到地下车库后，小区保安还专门骑电瓶车追上来围观，我是不是该投诉？     虽然看着惨烈，但是基本没有伤筋动骨，只是皮烂了，在我看来，当晚联系了4s并且叫了拖车拖走，回来的路上顺路报了保险。     接下来就是长达半个多月的等待，不得不吐槽下上汽配件的发货速度，基本时间全在等配件上消耗了，这段时间无奈只能用EVCAR代步，然而开了一次就放弃了，如果放到自行车上那就属于除了铃铛不响哪儿都响的级别。车里堆满杂物，各种按键损坏。。。     等车期间，无法远行，节假日只能附近逛逛，看看风景。       就这样等啊等啊等啊，终于在半个多月后将车开了回来，然后就是等保险公司的定损结果了，一等又是半个月（修车钱我垫付了，咨询保险客服说三个工作日内理赔到账），最终金额两万。对于保险公司的效率我就不多说什么了，还有一次打一网点的电话，态度很不好，来年肯定会换保险公司的了。     车子开回来后，恰好约到了世博博物馆的参观票，正好开着去溜一圈。图片太多了，世博博物馆的照片还是另开一贴吧，哈哈。,auto_home,7882fa338ae061e4b711d3986aedf899,0,
自从我有我荣威i6 吸引我亲戚眼球 天天都在研究我i6荣威rx5 这 因为荣威i6 荣威rx5心脏都样 我哥决定要suv毕竟爷们嘛 还偏运动些 他就喜欢这种有科技感车 带互联网系统 可以语音开天窗 能动口 他绝对能动手 尽量做到手离盘 目离路  全副武装 蓄势待发 我哥说 今天提车 家心情 带我们出去玩 激动 因为 只有我哥路才会包吃包住 包切  喜欢他们4s店养金鱼 旦手指戳 它们就来 超可爱  次来 这花还刚种 这次来居然开 估计喜欢我这美女 看吧 肯定能共享零部件 钥匙都样样  蓝天白云承托我美丽心情  美 美丽花花 真唯美  金沙江水 水退之后我们就准备去捞鱼 这我给我亲哥送漂亮玫瑰花?? 恭祝他喜提爱车  我哥带我们去吃吃 环境错 准美我们也拍几张照片挂去 放筷子有艺术气息 有没有 我爱 乐山翘脚牛肉 有没有想吃 可以起约哦,auto_home,34bc1e82d94f8282870537b3339ce6f0,1,
那只能去4s店看看了，估计起止开关问题,auto_home,5efefa113d5459c8727192a06653a2fa_9,0,
博瑞超级耗油的,auto_home,24189,-1,
